"2TI","4","5","थमनै हरेक बखत अपणे आप पै काब्बू राखणा चाहिए, दुख ठा, सुसमाचार प्रचार का काम कर, अर परमेसवर के जरिये दी गई सेवा नै पूरी कर।"
"2TI","4","6","जै वे मन्नै मार भी देवैगें, तो मेरी जिन्दगी परमेसवर ताहीं चढ़ाई गई एक भेट की तरियां होगी। इस दुनिया ताहीं छोड़ण का इब मेरा बखत आ लिया सै।"
"2TI","4","7","मन्नै मसीह की सेवा करण खात्तर कड़ी मेहनत करी सै, मन्नै अपणी दौड़ पूरी कर ली सै, मन्नै आखरी तक उसपै बिश्वास करया।"
"2TI","4","8","आण आळे बखत म्ह प्रभु मेरै ताहीं मुकुट देवैगा, जो के धार्मिकता का मुकुट सै, वो जो सच्चा न्याय करै सै, अर मन्नै वो ईनाम देवैगा जिब बोहड़ के आवैगा बल्के मेरे ताहीं ए न्ही उन सब ताहीं भी देवैगा, जो उसके दुबारा आण की बाट बड़ी आस तै देखण लागरे सै।"
"2TI","4","9","मेरै धोरै ताव्ळा आण की कोशिश कर।"
"2TI","4","10","क्यूँके देमास नै इस दुनिया की चिज्जां तै प्यार करया सै, अर मेरै ताहीं छोड़ दिया सै, अर वो थिस्सलुनीके नगर म्ह चल्या गया सै। क्रेसकेंस, गलातिया नगर की ओड़ चल्या गया अर तीतुस दलमतिया परदेस कान्ही चल्या गया सै।"
"2TI","4","11","सिर्फ लूका मेरै गेल्या सै। मरकुस नै लेकै चल्या आ, क्यूँके वो मेरे काम करण म्ह मेरी मदद करैगा।"
"2TI","4","12","तुखिकुस ताहीं मन्नै इफिसुस नगर म्ह भेज्या सै।"
"2TI","4","13","जो चोल्ला, मै, त्रोआस नगर म्ह करपुस के घर छोड़ आया सूं, जिब तू आवै तो उस ताहीं अर उस किताब ताहीं भी लेंदे आईये, खास करके चर्मपत्रों नै।"
"2TI","4","14","सिकन्दर ठठेरे नै मेरा बड़ा नुकसान करया सै, प्रभु उस ताहीं उसकै काम्मां कै मुताबिक बदला देवैगा।"
"2TI","4","15","तू भी उसतै चौकन्ना रह, क्यूँके उसनै म्हारी शिक्षायां का घणाए बिरोध करया सै।"
"2TI","4","16","पैहली बार मै खुद नै बचाण खात्तर अदालत गया, कोए भी मेरे साथ न्ही था, पर सब नै मेरे ताहीं छोड़ दिया, परमेसवर इस बात का दण्ड उननै ना देवै, मै प्रार्थना करुँ सूं, मेरे ताहीं छोड़ण के कारण उन ताहीं परमेसवर माफ करदे।"
"2TI","4","17","पर मेरे गेल मेरा प्रभु मददगार रहया, मेरे जरिये सन्देस की घोषणा पूरी तरियां सम्पन्न हो जावै अर उरै जितने भी गैर यहूदी लोग मौजूद सै, ये बात सुण ले, के उसनै मेरे ताहीं मौत के मुँह म्ह तै छुड़ाया।"
"2TI","4","18","अर प्रभु मन्नै हरेक भुन्डे़ काम तै छुड़ावैगा, अर वो अपणे सुर्गीय राज्य म्ह सही-सलामत ले जावैगा। उस्से की महिमा युगानुयुग होन्दी रहवै। आमीन।"
"2TI","4","19","प्रीस्का अर उसका धणी अक्विला अर उनेसिफुरुस कै कुण्बे नै मेरी ओड़ तै नमस्कार।"
"2TI","4","20","इरास्तुस कुरिन्थुस नगर म्ह रह गया, अर त्रुफिमुस ताहीं मन्नै मीलेतुस नगर म्ह बीमार छोड्या सै।"
"2TI","4","21","जाड्डे तै पैहल्या चले आण की कोशिश कर। यूबूलुस, अर पूदेंस, अर लीनुस अर क्लौदीया, अर सारे बिश्वासी भाईयाँ की ओड़ तै तन्नै नमस्कार।"
"2TI","4","22","मै प्रार्थना करुँ सूं, के प्रभु तेरी आत्मा कै गेल रहवै। थारै पै अनुग्रह होंदा रहवै।"
