Book,Chapter,Verse,Text
ACT,13,50,"लेकन यहूदी अगबें पक्त ते कोलीन जनानियें गी ते शैर दे मशूर लोकें गी बकाया, ते पौलुस ते बरनबास दे बरोध चगड़ा कराइयै उनेंगी अपने बन्ने थमां बार कडी दीता। "
ACT,13,51,ओस बेलै पौलुस ते बरनाबास उन्दे सामने अपने पैरें दी तुड झाड़ीयै इकुनियुम शैर गी चली गै। 
ACT,13,52,ते चेलें अन्ताकिया शैर च खुशी कन्नें ते पवित्र आत्मा कन्नें परपुर ओदे गै। 
ACT,14,1,"इकुनियुम शैर च ऐसा ओया के पौलुस ते बरनबास यहूदीयें दे प्रार्थनाकार च किठे-किठे गै, ते ऐसीयां गल्लां कित्तियां के यहूदीयें ते यूनानीयें दौनीं बिचा मतें लोकें विश्वास कित्ता। "
ACT,14,2,लेकन विश्वास नेई करने आले यहूदीयें दुई जातीयें दे मन विश्वासियें दे बरोध च पड़काए ते बैर पैदा कित्ती। 
ACT,14,3,"पौलुस ते बरनाबास मते देन तकर उत्थें रे, ते प्रभु दे परोसै ऊपर इम्त कन्नें गल्लां करदे हे; ते परमेसर उन्दे अथ्थें क्न्ने चेंन ते चमत्कार दे कम कराइयै अपनी क्रपा दे वचन ऊपर गुआई दिंदा रिया। "
ACT,14,4,"लेकन शैर दे लोकें च फ़ोट पेई गेदी ही, एस कन्नें किन्नें तां यहूदीयें आली बखी ते किन्नें प्रेरितें दी बखी ओई गे। "
ACT,14,5,"लेकन जेसलै दुई जातीयां ते यहूदी उन्दा अपमान ते उन्दे ऊपर पथराव करन आसतै अपने प्रधानें दे समेत उन्दे ऊपर दौड़े, "
ACT,14,6,"तां ओ एस गल्लें गी जानी गै, ते लुकाउनिया लाके दे लुस्त्रा ते दिरबे शैरें च, ते आसे-पासे दे लाकें च नसी गै "
ACT,14,7,ते उत्थें शोभ समाचार सनाना लगे। 
ACT,14,8,"लुस्त्रा शैर च एक मनुक्ख बैठा हा, जेसदे पैर कमजोर हे। ओ जन्म थमां गै लिंञां हा, ते कदें बी नेई चला हा। "
ACT,14,9,"ओ पौलुस गी गल्लां करदे सुना दा हा। पौलुस ने ओसदे बखी त्रोयै दिखया के उसी चंगा ओई जाने दा विश्वास ऐ, "
ACT,14,10,"ते उच्ची बाज कन्नें आखया, “अपने पैरें दे पार सीधा खड़ा ओई जा।” ओस बेलै ओ उड़कीयै चलना फिरना लगया। "
ACT,14,11,"लोकें पौलुस दा ए कम दिखियै लुकाउनिया दी पाषा च उच्ची बाज कन्नें आखया, “देवता मनुक्खें दे रूप च ओइयै साडे कोल उतरी आए न।” "
ACT,14,12,"उनें बरनबास गी यूनानी नां ज्यूस, ते पौलुस गी हिरमेस गलाया किके ओ गल्लां करने च ख़ास हा। "
ACT,14,13,"ते ज्यूस दे ओस मंदर दा पजारी जेड़ा उन्दे शैर दे सामने हा, बैल ते फूलें दे आर रस्ते ऊपर आनीयै लोकें कन्नें बलीदान करना चांदा हा। "
ACT,14,14,"लेकन बरनबास ते पौलुस प्रेरितें जेसलै ए सुनया, तां बड़े दुखी ओए, ते अपने कपड़े फाटे ते पीड बेच तौले गे, ते पुकारियै आखन लगे, "
ACT,14,15,"“ए लोको, तोस के करदे ओ? अस बी थूआड़े आला लेखा दोख-सोख पोगने आले मनुक्ख आं, ते तुसेंगी ए शोभ समाचार सनानयां न, के तोस इनें बेकार चीजां थमां लग्ग ओइयै जिंदे परमेसर आली बखी फिरो, जेस ने सोर्ग ते तरती ते समुंद्र ते जे केछ उंदे च ऐ बनाया। "
ACT,14,16,ओस ने बीते दे बेलें च सब जातीयें गी अपने-अपने रस्ते च चलना दीता। 
ACT,14,17,"तां बी ओस ने अपने आप गी बे-गवाह नेई छूड़या; किके ओ पलाई करदा रिया, ते अम्बर थमां बरखा ते फलवंत मोसम ते छैल फसलां देइयै थूआड़े मने गी रुट्टी ते खुशी कन्नें परदा रिया।” "
ACT,14,18,ए आखीयै बी उनें लोकें गी बड़ी मुशकल क्न्ने रोकया के उन्दे आसतै बलीदान नेई करन। 
ACT,14,19,"लेकन केछ यहूदीयें अन्ताकिया शैर ते इकुनियुम शैर थमां आईयै लोकें गी अपनी बखी करी लेता, ते पौलुस ऊपर पथराव कित्ता, ते उसी मरे दा समझियै शैर थमां बार कसीटी लेई गै। "
ACT,14,20,"लेकन जेस लै चेलें ओदे चौनी बखी खड़ोते दे हे, तां ओ उठीयै शैर च गिया ते दुए देन बरनबास दे कन्नें दिरबे शैर गी चली गिया। "
ACT,14,21,"पौलुस ते बरनाबास ओस शैर दे लोकें गी शोभ समाचार सनाईयै, ते मते सारे चेलें बनाइयै, लुस्त्रा ते इकुनियुम ते अन्ताकिया गी बापस आए, "
ACT,14,22,"ते अर एक शैर च चेलें दे मनें गी केंम करदे रे ते ए शिखया दिंदे हे के विश्वास च बने रवो; ते ए आखदे हे, “असें मते सारे कलेश चुकियै परमेसर दे राज च दाखल ओना ओग।” "
ACT,14,23,"ते उनें अर एक कलीसिया च उंदे आसतै अगबें पक्के किते, ते उपवास कन्नें प्रार्थना करियै उनेंगी गी प्रभु गी सोंपया जेस ऊपर उनें विश्वास कित्ता दा हा। "
ACT,14,24,ओस बेलै पिसिदिया लाके बीचें ओदे ओई ओ पंफूलिया जिले च पुज्जे; 
ACT,14,25,"पी पिरगा शैर च वचन सनाईयै अत्तलिया दी बंदरगाह च आए, "
ACT,14,26,"ते उत्त्थुआं ओ चाज ऊपर अन्ताकिया शैर च गे, जित्त्थें ओ ओस कम आसतै जेड़ा उनें पूरा कित्ता हा परमेसर दी क्रपा च सोंपे गे। "
ACT,14,27,"अन्ताकिया शैर च पुजियै उनें कलीसिया किटठी कित्ती ते सनाया के परमेसर ने उंदे थमां बड्डे-बड्डे कम किते, ते दुई जातीयें आसतै विश्वास दा पेत्त खोली दीता। "
ACT,14,28,ते पौलुस ते बरनाबास चेलें दै कन्नें मते देन तकर रे। 
ACT,15,1,पी केछ यहूदी विश्वासी लोग यहूदीया लाकें दा अन्ताकिया च आईयै विश्वासी प्राऐं गी सखाना लगे; “जेकर मूसा दी रिती दे मताबक थूआड़ा खतना नेई ओया तां तोस मुक्ति नेई पाई सकदे।” 
ACT,15,2,"जेस लै पौलुस ते बरनबास दा उंदे कन्नें मता चगड़ा ते बैस-मूआसा ओया तां ए पक्का कित्ता गिया, के पौलुस ते बरनबास, ते इंदे क्न्ने केछ लोक एस गल्ल दे बारै च प्रेरितें ते अगबें कोल यरूशलेम गी जांन। "
ACT,15,3,"एस आसतै कलीसिया ने उनेंगी केछ दूर तकर पजाया; ते ओ फीनीके ते सामरिया लाकें थमां ओदे ओई दुई जातीयें गी प्रभु आली बखी मन फराने दा परचार सनांदे गै, ते सारे विश्वासी प्राऐं गी मता खोश कित्ता। "
ACT,15,4,"जेस लै पौलुस ते बरनाबास यरूशलेम पुज्जे, तां कलीसिया ते प्रेरित ते अगबें उन्दे कन्नें खुशी कन्नें मिले, ते उनें सनाया के परमेसर ने उन्दे कन्नें ओइयै कियां-कियां कम किते हे। "
ACT,15,5,"लेकन फरीसीयें दे पंथ बिचा जिनें विश्वास कित्ता हा, उन्दे चा केइयें उठीयै आखया, “दुई जातीयें गी खतना कराने ते मूसा दे कनून गी मनने दा उक्म देना चाईदा।” "
ACT,15,6,ओस बेलै प्रेरित ते अगबें एस गल्ल दे बारै च बचार करने आसतै किटठे ओए। 
ACT,15,7,"ओस बेलै पतरस ने उन्दे क्न्ने बड़ी बैस ओनें दे बाद खड़ोइयै उनेंगी आखया, “ए प्राओ, तोस जांनदे ओ, के मते देन ओए, के परमेसर ने थूआड़े बिचा मीकी चुनी लेता, के मेरे थमां दुई जातीयां शोभ समाचार दा वचन सुनीयै विश्वास करन। "
ACT,15,8,ते मन गी जाचने आले परमेसर ने उनेंगी बी साडे आला लेखा पवित्र आत्मा देइयै उन्दी गुआई दिती; 
ACT,15,9,ते यीशु मसीह ऊपर विश्वास करने थमां उन्दे मन शोद्ध करियै साड़े च ते उन्दे च केछ पेद नेई रखया। 
ACT,15,10,"तां ऊन तोस कि परमेसर दी परिख्या करदे ओ, के चेलें दी मुंडी ऊपर ऐसा जूंगला रखो, जिसी नां साड़े बजुर्ग चुकी सके हे ते नां अस चुकी सकनयां न? "
ACT,15,11,"आं, साड़ा ए तां विश्वास ऐ के जियां ओ प्रभु यीशु दी क्रपा दे कन्नें मुक्ति पागन; उयां गै असें बी पानि ऐं,, नां के मूसा दे कनून कन्नें।” "
ACT,15,12,"ओस बेलै सारी सभा चोप्प चाप ओई बरनबास ते पौलुस दी सुनना लगी, के परमेसर ने उन्दे थमां दुई जातीयें च कियां-कियां बड्डे चेन्न, ते चमत्कार किते। "
ACT,15,13,"जेस लै उनें बोलना बंद कित्ता, तां याकूब आखन लगया, “ए प्राओ, मेरी सुनो।” "
ACT,15,14,"शमौन पतरस ने खुलीयै बोलया, के परमेसर ने पैलो पैल दुई जातीयें ऊपर कियां रैम दी नजर दिती, के उन्दे बिचा अपने नां आसतै केछ लोकें गी चुनी लेता तांजे उनेंगी अपने लोग बनाई लै। "
ACT,15,15,"एस कन्नें उनें पविखवक्तें दियां गल्लां बी मिलदियाँ न, जियां के लिखे दा ऐ, "
ACT,15,16,"एस दे बाद आंऊँ पी आईयै दाऊद दे डीगे दे डेरे गी पर्तियै बहाल करगा, ते ओदे रौने दी जगा गी पी बनागा, ते ओदे राज गी खड़ा करगा, "
ACT,15,17,"एस आसतै के बाकी मनुक्ख, मतलब सब दुई जातीयां जेडे मेरे नां दे अखे जंदे न, प्रभु गी ढूंढन। "
ACT,15,18,ए उवै प्रभु आखदा ऐ जेड़ा दुनिया दी पैदाश थमां इनें गल्लें दी खबर दिन्दा आया ऐ। 
ACT,15,19,"“एस लेई मेरा बचार ए ऐ, के दुई जातीयें बिचा जेडे लोग परमेसर आली बखी फिरदे न, अस उनेंगी मजबूर करियै दोख नेई देचै; "
ACT,15,20,"लेकन अस उनेंगी लिखी पेजचै, के ओ मूरतें दी अशोद्ध ते ब्यभिचार ते गला कोटे दे मांसे थमां ते खून थमां दूर रौन। "
ACT,15,21,"किके पुराने जमाने थमां शैर-शैर मूसा दे कनून दा परचार करने आले चलदे आए न, ते ओ अर यहूदीयें दे बसां दे देन प्रार्थनाकार च पढ़ी जन्दी ऐ।” "
ACT,15,22,"ओस बेलै यरूशलेम दी सारी कलीसिया समेत प्रेरितें ते अगबें गी छैल लगया, के अपने बिचा केछ मनुक्खें गी चुनन, मतलब यहूदा, जीसी बरनबास अखया जन्दा ऐ, ते सिलास गी जेड़ा प्राऐं च गुआई करदा ऐ; ते उनेंगी पौलुस ते बरनबास दे कन्नें अन्ताकिया शैर पेजन। "
ACT,15,23,"ते उनें उन्दे अथ्थ ए लिखी पेजया; “अन्ताकिया लाके ते सीरिया शैर ते किलिकिया दे लाकें दे रौने आले प्राऐं गी जेडे दुई जातीयें बिचा न, प्रेरित ते अगबें प्राऐं तर्फुं नमश्कार। "
ACT,15,24,"असें सुनया ऐ, के साड़े बिचा केईयें उत्थें जाइयै, तुसेंगी अपनी गल्लें कन्नें मुशकल च दीता; ते थूआड़े मन ओलटे फेरी दिते न लेकन असें उनेंगी उक्म नेई दिता हा। "
ACT,15,25,"एस आसतै असें एक मन ओइयै ठीक समझया, के केछ चुने दे मनुक्खें गी अपने प्यारे बरनबास ते पौलुस दै कन्नें थूआड़े कोल पेजचै। "
ACT,15,26,ए तां ऐसे मनुक्ख न जिनें अपने प्राण साड़े प्रभु यीशु मसीह दे नां दी खातर बाजी च सुट्टी दिते न। 
ACT,15,27,"ते एस आसतै असें यहूदा ते सिलास गी पेजया ऐ, जेडे अपने थमां बी ए गल्लां बोली देगन। "
ACT,15,28,"पवित्र आत्मा गी, ते असेंगी बी ठीक लगया के इनें ठीक जरूरी गल्लें गी शुड़ीयै, थूआड़े ऊपर ओर पार नेई सुट्टचै; "
ACT,15,29,"के तोस मुरतें अगें बली किते दे ते खून खाने थमां, ते गला कोटे दे मांसे थमां, ते ब्यभिचार थमां दूर रवो। इंदे शा दूर रवो तां थूआड़ा पला ओग। अग्गें शोभकामनां।” "
ACT,15,30,"पी ओ विदा ओइयै अन्ताकिया शैर पुज्जे, ते सभा गी किठे करियै ओ चिठ्ठी उनेंगी देई दिती। "
ACT,15,31,ते ओ चिठ्ठी गी पढ़ीयै ओस शिखया दी गल्ल ऊपर मते खोश ओए। 
ACT,15,32,"ते यहूदा ते सिलास ने जेड़े अप्पुं बी पविख्ब्कते हे, मती सारी गल्लें कन्नें मसीह विश्वासी प्राऐं गी शिखया देइयै मजबूत कित्ता। "
ACT,15,33,"यहुदा ते सिलास उत्थें केछ देन रेइयै, प्राऐं कोला शान्ति कन्नें विदा ओए के अपने पेजने आलें दे कोल जांन। "
ACT,15,34,लेकन सिलास गी उत्थें रौना छैल लगया। 
ACT,15,35,ते पौलुस ते बरनबास अन्ताकिया च रेई गै; ते बाकी मते लोकें कन्नें प्रभु दे वचन दी शिखया दिन्दे ते शोभ समाचार सनांदे रे। 
ACT,15,36,"केछ देन बाद पौलुस ने बरनबास गी अखया, “जिन्नें-जिन्नें शैरें च असें प्रभु दा वचन सनाया हा, आओ, पी उत्थें जाईयै अपने प्राऐं गी दिखचै कि ओ कदें न।” "
ACT,15,37,"ओस बेलै बरनबास ने यूहन्ना गी जीसी मरकुस अखया जन्दा ऐ, कन्नें लेने दा बचार कित्ता। "
ACT,15,38,"लेकन पौलुस ने उसी जेड़ा पंफूलिया लाके च उन्दे थमां लग्ग ओई गिया हा, ते सेबा दे कम ऊपर उन्दे कन्नें नेई गिया, उसी कन्नें लेई जाना छैल नेई समझया। "
ACT,15,39,"एस अासतै ऐसा शिकबा ओया के ओ एक दुए थमां लग्ग ओई गै; ते बरनबास, मरकुस गी लेइयै चाजे ऊपर साइप्रस टापू गी चली गिया। "
ACT,15,40,"लेकन पौलुस ने सीलास गी चुनी लेता, ते प्राऐं थमां परमेसर दी क्रपा च सोंपियै अन्ताकिया शैर गी चली गिया; "
ACT,15,41,ते ओ कलीसिया गी मजबूत करदे ओई सीरिया ते किलिकिया लाकें थमां ओदे ओई निकलया। 
ACT,16,1,"पी ओ दिरबे ते लुस्त्रा शैर च बी गिया, ते उत्थें तीमुथियुस नां दा एक चेला हा, जेड़ा कुसे वश्वासनी यहूदी दा पुत्र हा, लेकन ओस दा पिता यूनान देश दा रौने आला हा। "
ACT,16,2,ओ लुस्त्रा ते इकुनियुम शैर दे विश्वासी प्राऐं च अच्छे नां आला हा। 
ACT,16,3,"पौलुस दी मरजी ही के ओ ओदे कन्नें चलै; ते जेडे यहूदी लोग उनें जगें च हे उन्दे कारन ओस ने ओस दा खतना कित्ता, किके ओ सब जांनदे हे, के ओस दा पिता यूनान दा रौने आला हा। "
ACT,16,4,"ते शैर-शैर जंदे मौके पौलूस ते उन्दे साथी उनें विधियें गी जेड़ीयां यरूशलेम दे प्रेरितें ते अगबें बनाए दी हियां, मनने आसतै उनेंगी पजांदे जंदे हे। "
ACT,16,5,एस चाली कलीसियां विश्वास च मजबूत ओदीयां गेईयां ते गिनत्री बेच अर देन बददीयां गेईयां। 
ACT,16,6,"ते ओ फ्रूगीया ते गलातिया लाकें बिचें ओईयै गै, किके पवित्र आत्मा ने उनेंगी एशिया दे लाके च वचन सनाने लेई मना कित्ता। "
ACT,16,7,"ते उनें मूसिया लाकें दे कोल पुजियै, बितूनिया दे लाके च जाना चाया; लेकन पवित्र आत्मा ने उनेंगी जाना नेई दीता। "
ACT,16,8,एस आसतै ओ मूसिया दे लाकें थमां ओइयै त्रोआस दे बंदरगाह आले शैर च आए। 
ACT,16,9,"उत्थें पौलुस ने रातीं एक दर्शन दिखया के एक मकिदुनी लाके च रौने आले मनुक्ख ने खड़ोईयै, ओस कन्नें अर्ज करदे ओई आखदा ऐ, “समुंद्र दे पार उतरीयै मकिदुनिया लाके च आ, ते साड़ी मदद कर।” "
