Book,Chapter,Verse,Text
ACT,20,20,"ते जेड़ीयां-जेड़ीयां गल्लां थूआड़े फायदे दीहियां, उनेंगी सनाने ते लोकें दै सामने ते कर-कर सखाने आसतै कदें बी नेई चकया, "
ACT,20,21,बरन यहूदी ते यूनानियें गी चतान्दा रिया के परमेसर आले पासेगी मन फेरो ते साड़े प्रभु यीशु मसीह ऊपर विश्वास करो। 
ACT,20,22,"ते ऊन दिखो, आंऊँ पवित्र आत्मा दा बझे दा यरूशलेम गी जाना ऐं, ते नेई जानदा के उत्थें मेरे क्न्ने के के बितग; "
ACT,20,23,सेर्फ ए के पवित्र आत्मा अर शैर च गुआई देई-देइयै मेरे कन्नें आखदा ए के बंधन ते कलेश तेरे आसतै त्यार न। 
ACT,20,24,"लेकन आंऊँ अपने प्राण गी केछ नेई समझना के उसी प्यारा समझां, बरना ए के आंऊँ अपनी दौड़ गी ते ओस सेवा गी पूरा करां, जेड़ी मै परमेसर दी क्रपा दे शोभ समाचार ऊपर गुआई देने आसतै प्रभु यीशु थमां पाई दी ऐ। "
ACT,20,25,"ते ऊन दिखो, आंऊँ जानना ऐं के तोस सब जींदे च आंऊँ परमेसर दे राज दा प्रचार करदा फिरया, मिग्गी पी नेई दिखगे ओ। "
ACT,20,26,"एस आसतै आंऊँ अज दे देन थूआड़े कन्नें गुआई देइयै आखन ऐ, थूआड़े चां कोई प्रभु यीशु मसीह ऊपर विश्वास करने दे पैलें मरी जा तां ए अत्या च मेरा कसूर नेई ओग। "
ACT,20,27,किके आंऊँ परमेसर दी सारे मर्जी गी तुसेंगी पूरी रिती कन्नें सनाने आसतै नेई चकया। 
ACT,20,28,"एस आसतै अपनी ते पूरे चोण्ड दी रखया करो; जेस कलीसिया च पवित्र आत्मा ने तुसेंगी अगबें बनादा ऐ, के तोस परमेसर दी कलीसिया दी रखया करो, जिसी ओनें अपने खून कन्नें खरीदी लेते दा ऐ। "
ACT,20,29,"आंऊँ जानना ऐं, के मेरे जाने थमां बाद गलत शिक्षा देने आले औगन, ते थूआड़ा बड़ा नकसान करगन जेड़े फाड़ने आले पेड़िऐ जिए ओगन। "
ACT,20,30,"थूआड़े गै बिचा बी ऐसे-ऐसे मनुक्ख निकलगन, जेडे चेलें गी अपने पिछें खीचने आसतै तरेडीयां गल्लां आखगन। "
ACT,20,31,"एस आसतै बिजे दे रवो, ते जाद करो के मै त्रै साल तकर रात देन रोई-रोई अर एक गी चताना देना नेई छूड़या। "
ACT,20,32,"ते ऊन आंऊँ तुसेंगी परमेसर गी, ते ओदे क्रपा दे वचन गी सौपी दिना ऐं; जेड़ा थूआड़ी तरक्की करी सकदा ऐ, ते सब पवित्र किते दे लोकें च सांझी करियै जे परमेसर ने थूआड़े आसतै रखे दा ऐ देई सकदा ऐ। "
ACT,20,33,"मै कुसे दे चांदी, सुन्ने जां कपड़े दा लालच नेई कित्ता। "
ACT,20,34,तोस अप्पुं गै जांनदे ओ के इनें अथ्थें गै मेरी ते मेरे साथियें दियां जरूरतां पूरायां कित्तियां। 
ACT,20,35,"मै तुसेंगी सब केछ पूरा करियै दसया, के एस रिती कन्नें मैनत करदे ओई कमजोरें गी संभालना ते प्रभु यीशु दे वचन याद रखना जरूरी ऐ, जेड़ा ओनें अप्पुं गै आखे दा ऐ; लेने थमां देना तन्न ऐ।” "
ACT,20,36,ए आखीयै ओस ने घुटने टेके ते उन्दे सारें कन्नें प्रार्थना कित्ती। 
ACT,20,37,ओस बेलै ओ सब रोई उठे ते पौलुस दे गल्लें लगियै उसी चूमना लगे। 
ACT,20,38,"ओ ख़ास करियै एस गल्ल आसतै बसोस करदे हे, जेड़ी गल्ल ओस ने अखी ही, के तोस मिगी पी नेई दिखगे। ते ओस बेलै उनें उसी चाज तकर पजाया। "
ACT,21,1,"जेस लै असें उन्दे थमां लग्ग ओईयै समुंदरी सफ़र शुरू कित्ता, तां सीधे रस्ते थमां कोस टापू च आए, ते दुए देन रुदुस टापू च, ते उत्त्थुआं पतरा टापू च आए। "
ACT,21,2,"उत्थें एक चाज फीनीके गी जंदा मिलया, ते असें ओस ऊपर चढ़ीयै सफ़र शुरू कित्ता। "
ACT,21,3,"जेस लै साइप्रस टापू लबया, तां असें उसी खबे अथ्थ छूड़या, ते सीरीया लाके गी चलीयै सूर शैर च उतरे; किके उत्थें चाज दा माल तुआरना हा। "
ACT,21,4,ते असेंगी उत्थें चेलें लबे तां अस उत्थें सत देन तकर रे। उनें पवित्र आत्मा दे सखाए पौलुस गी गलाया के यरूशलेम नेई जाने दी अर्ज कित्ती। 
ACT,21,5,"सत दिने दे बाद जेस लै साड़े जाने दे देन पूरे ओई गै; ते सबनी जनानियें ते बच्चें समेत असेंगी शैर दे बार तकर पजाया; ते असें समुन्दर दे कंढे ऊपर घुटने टेकियै प्रार्थना कित्ती, "
ACT,21,6,"ओस बेलै एक दुए थमां विदा ओइयै, अस तां चाज ऊपर चढ़े ते ओ अपने-अपने कर बापस गै। "
ACT,21,7,"जेस बेलै अस सूर शैर थमां समुन्दरी सफर पूरा करियै पतुलिमयिस शैर च पुज्जे, ते विश्वासी प्राऐं गी नमश्कार करियै उन्दे कन्नें एक देन ओर रे। "
ACT,21,8,"दुए देन अस उत्त्थुआं दा चलीयै कैसरिया शैर च आए, ते फिलिप्पुस शोभ समाचार पर्चारक दे कर च जेड़ा सत्तें बिचा एक हा; जाइयै ओदे उत्थें रे। "
ACT,21,9,"ओस दीयां चार कवारियां कुड़ीयां हाँ, जेड़ीयां पविखवाणी करदी हाँ। "
ACT,21,10,"जेलै अस उत्थें मते देन रेई चुके, तां अगबुस नां दा पविखवक्ता यहूदीया लाके थमां आया। "
ACT,21,11,"ओस ने साडे कोल आईयै पौलुस दा बैलट लेता, ते अपने अथ्थ पैर बन्नीयै अखया, “पवित्र आत्मा ए आखदा ऐ, के जेस मनुक्ख दा ए बैलट ऐ, उसी यरूशलेम च यहूदी एस रिती कन्नें बनी देगन, ते दुई जातीयें दे अथ्थ च सौपी देगन।” "
ACT,21,12,"जेस लै असें ए गल्लां सुनियां, तां असें ते उत्त्थुआं दे लोकें पौलुस कन्नें अर्ज कित्ती के यरूशलेम गी नेई जा। "
ACT,21,13,"लेकन पौलुस ने जबाब दीता, “तोस के करदे ओ, के रोई-रोइयै मेरा मन खराब करदे ओ? आंऊँ तां प्रभु यीशु दे नां खातर यरूशलेम नां सेर्फ कैद ओनें गै नेई बरना मरने लेई बी त्यार ऐं।” "
ACT,21,14,"जेस लै ओस नेई मनया तां अस ए आखीयै चोप्प ओई गै, “प्रभु दी मर्जी पूरी ऊऐ।” "
ACT,21,15,उनें दिने दे बाद असें त्यारी कित्ती ते यरूशलेम गी चली गै। 
ACT,21,16,"कैसरिया शैर बिचा बी केछ चेलें साड़े कन्नें ओई गै, ते अस मनासोन नां साइप्रस दे एक पराने चेलें गी इत्थें क्न्ने लेई आए, के अस ओदे उत्थें टिकचै। "
ACT,21,17,"जेस लै अस यरूशलेम च पुज्जे, ते विश्वासी प्रा मती खुशी कन्नें साड़े कन्नें मिले। "
ACT,21,18,"दुए देन पौलुस असेंगी लेइयै याकूब दे कोल गिया, जिथें सब अगबें किठे हे। "
ACT,21,19,"ओस बेलै ओस उनेंगी नमश्कार करियै, जेडे-जेडे कम परमेसर ने ओस दी सेवा थमां दुई जातीयें च किते हे, एक-एक करियै सारे सनाए। "
ACT,21,20,"उनें ए सुनीयै परमेसर दी मैमा कित्ती, पी ओस कन्नें आखया, “ए प्रा, तू जानना ऐ, के यहूदीयें बिचा केई जारें लोकें प्रभु यीशु ऊपर विश्वास कित्ता ऐ; ते सारे कनून आसतै जशिले न। "
ACT,21,21,"ते यहूदी वश्वासीयें गी तेरे बारै च सखाया गेदा ऐ, के तू दुई जातीयें च रौने आले यहूदीयें गी मूसा थमां पी फिरने गी सखाना ऐ, ते आखन ऐ, के नां अपने बच्चें दा खतना कराओ ते नां यहूदी रितियें ऊपर चलो। "
ACT,21,22,तां पी के कित्ता जा? लोग जरूर सुनगन के तू इथें आए दा ऐं। 
ACT,21,23,"एस आसतै अस जे तुगी आखनयां न, ओ कर। साड़े इत्थें चार मनुक्ख न जिनें मन्नत मनी दी ऐ। "
ACT,21,24,"उनेंगी लेइयै उन्दे कन्नें शोद्ध ओनें दी विधि पूरी कर; ते उन्दे आसतै खर्चा दे, के ओ सर दे बाल कटन। ओस बेलै सारे जानीं लेगन के जेड़ीयां गल्लां तेरे बारै च उनेंगी सखाई दियां न, उन्दे बेच केछ सच्चाई नेई यैं लेकन तू अप्पुं बी कनून गी मनीयै ओदे मताबक चलना ऐं। "
ACT,21,25,"लेकन उनें दुई जातीयें दे बारै च जिनें विश्वास कित्ता ऐ, असें ए फ़ैसला करियै लिखी पेजया ऐ के ओ मूरतयें दे सामने बली किते दे मांस थमां ते ब्यभिचार थमां लग्ग रौन।” "
ACT,21,26,"ओस बेलै पौलुस उनें मनुक्खें गी लेइयै, ते दुए देन उन्दे कन्नें शोद्ध ओइयै मंदर च गिया, ते उत्थें सनाई दीत्ता के शोद्ध ओनें दे देन, मतलब उन्दे बिचा अर एक आसतै चढ़ावा चढ़ाए जाने दे तकर देन कदुं पूरे ओगन। "
ACT,21,27,"जेस लै ओ सत देन पुरे ओनें आले हे, तां आसीया लाके दे यहूदीयें पौलुस गी मंदर च दिखियै सारे लोकें गी बकाया, ते इयां करलाईयै उसी पकड़ी लेता, "
ACT,21,28,"“ए इस्राएलियें, मदद करो; ए उवै मनुक्ख ऐ, जेड़ा लोकें दे, ते कनून दे, ते एस जगा दे बरोध च अर जगा लोकें गी सखांदा ऐ, इत्थें तकर के दुई जातीयें गी बी मंदर च अनीयै ओस ने एस पवित्र जगा गी अशोद्ध कित्ता ऐ।” "
ACT,21,29,"उनें ए एसकरी अखया, किके पौलुस इफिसुस वासी त्रुफिमुस गी ओदे कन्नें शैर च दिखया हा, ते समझे हे के पौलुस उसी मंदर च लेई आया ऐ। "
ACT,21,30,"एस करी सारे शैर बेच शोर मची गिया, ते लोग दौड़ीयै किट्ठे ओए, ते पौलुस गी पकड़ियै मन्दर दे बार कसीटी लेई आए, ते फोरन मंदर दे दरबाजे बंद किते गै। "
ACT,21,31,"जेस लै ओ उसी मारी देना चांदे हे, ते पलटन दे प्रधान गी सनिया पुजया के सारे यरूशलेम शैर च अहला मचा करदा ऐ। "
ACT,21,32,ओस बेलै ओ फोरन सपाईयें ते सुबेदारें गी लेइयै उन्दे कोल थले दौड़ी आया; ते लोकें दी पीड ते पलटन दे प्रधान गी ते बाकी सपाईयें गी दिखियै पौलुस गी मारना पीटना छूड़ी दीता। 
ACT,21,33,"ओस बेलै पलटन दे प्रधान ने पौलुस दे कोल आईयै उसी पकड़ी लेता; ते दो संगलें कन्नें बनने दा उक्म देइयै पूछना लगे, “ए कोन ऐ ते एस ने के कित्ता ऐ?” "
ACT,21,34,"लेकन पीड बिचा कोई केछ ते कोई केछ करलांदा रिया। जेस लै शोर दे मारे ओ ठीक सच्चाई नेई जानी सकया, तां उसी अबालात च लेई जाने दा उक्म दिता। "
ACT,21,35,"जेस लै ओ पौड़ीयें ऊपर पुजया, ते ऐसा ओया के पीड दे दबाब दे मारे सपाईयें उसी चूकियै लेई जाना पिया। "
ACT,21,36,"किके लोकें दी पीड ए करलांदी ओई ओदे पिछें पेदी ही, “उसी मारी उडो।” "
ACT,21,37,"जेस लै ओ पौलुस गी अबालात बिचा लेई जाने आले हे, तां ओस ने पलटन दे प्रधान कन्नें आखया, “के मीकी उक्म ऐ के आंऊँ तेरे कन्नें केछ अखी सकां?” ओस ने आखया, “के तू यूनानी पाषा जानना ऐ? "
ACT,21,38,"के तू ओ मिस्र देश दे रौने आला नेई यै, जेड़ा इनें दिनें थमां पैलें एका बनाइयै, अपने चार जार लोकें गी जंगल च लेई गिया?” "
ACT,21,39,"पौलुस ने आखया, “आंऊँ तां तरसुस शैर दा यहूदी मनुक्ख ऐं! किलिकिया मशूर शैर दा रौन आला ऐं, आंऊँ तेरे अगें अर्ज करना ऐं के मीकी लोकें कन्नें गल्लां करना दे।” "
ACT,21,40,"जेस लै ओस ने उक्म दित्ता, तां पौलुस ने पौड़ी ऊपर खड़ोइयै लोकें गी अथ्थ कन्नें शारा कित्ता। जेलै ओ चोप्प ओई गै, तां ओ इब्रानी पाषा च बोलन लगया; "
ACT,22,1,"“ए प्राओ ते पिताओ, मेरियां ए गल्लां सुनो, जे केछ आंऊँ ऊन थूआड़े अगें पेश करना ऐ।” "
ACT,22,2,"ओ ए सुनीयै के ओ साड़े कन्नें इब्रानी पाषा च बोलदा ऐ, ओर बी चोप्प ओईगे। ओस बेलै ओस ने आखया; "
ACT,22,3,"“आंऊँ तां यहूदी ऐं, जेड़ा किलिकिया लाके दे तरतुस शैर च जमया; लेकन एस शैर च गमलीएल दे पैरें दे कोल बेईयै पढ़ाया गिया, ते बजुर्गें दे कनून गी बी ठीक रिती क्न्ने सखाया गिया; ते परमेसर आसतै ऐसी लगन लाए दी ही, जियां तोस अज लाए दे ओ। "
ACT,22,4,"मै मर्दे ते जानानी दौनीं गी बन्नीयै, ते जेले च पाई-पाईयै, एस रस्ते ऊपर चलने आलें गी इत्थें तकर सताया के उनेंगी मराई बी दीता। "
ACT,22,5,"एस गल्ल दे महायाजक दे सारे प्राचीन अप्पुं गै गवाह न, के उन्दे बीचा आंऊँ विश्वासी प्राऐं दे नां ऊपर चिट्ठीयां लेइयै दमिश्क शैर गी जा करदा हा, के जेडे उत्थें ओंन उनेंगी बी सज़ा दुआने आसतै बन्नीयै यरूशलेम लेई अवां। "
ACT,22,6,"“जेलै आंऊँ चलदे-चलदे दमिश्क शैर दे कोल पुजया, तां ऐसा ओया के दो पैर दे लगपग एकदम बड्डी लो अम्बर थमां मेरे चौनी बखी चमकी। "
ACT,22,7,"ते आंऊँ तरती ऊपर किरी गिया; ते ए बाज सुनी, ए शाऊल, ए शाऊल, तू मीकी कें सताना ऐं?” "
ACT,22,8,"मै जबाब दीता, ए प्रभु, “तू कोन ऐं?” ओस ने मीकी आखया, आंऊँ यीशु नासरी ऐं, जिसी तू सताना ऐं। "
ACT,22,9,"ते मेरे साथियें बी लो तां दिखी, पर जेड़ा मेरे कन्नें बोलदा हा उसी नेई सुनी सके। "
ACT,22,10,"ओस बेलै मै आखया, “ए प्रभु, आंऊँ के करां?” प्रभु ने मेरे कन्नें आखया, उठीयै दमिश्क च जा, ते जे केछ तेरे करने आसतै रखे दा ऐ उत्थें सब केछ तुगी सनाई दीता जाग। "
ACT,22,11,"जेस लै ओस लो दे तेज दे मारे मीकी केछ नेई लबया, तां आंऊँ अपने साथियें दे अथ्थ पकड़ियै दमिश्क शैर च आया। "
ACT,22,12,"“ओस बेलै हनन्याह नां दा मूसा दे कनून दे मताबक एक पक्त मनुक्ख, जेड़ा उत्थें दा रौने आले सारें यहूदीयें च चंगे नां आला हा, मेरे कोल आया, "
ACT,22,13,"ते खड़ोइयै मेरे कन्नें आखया, ए प्रा शाऊल, पी दिखना लग। उसै घड़ी मेरियें अखीं दे नेत्र खुली गै ते मै उसी दिखया। "
ACT,22,14,"ओस बेलै ओस ने आखया, साड़े बजुर्गें दे परमेसर ने तुगी एस आसतै चुनयां ऐ के तू ओस दी मर्जी गी जान्ने, ते ओस तर्मी गी दिखें, ते ओदे मुंह थमां गल्लां सुनें। "
ACT,22,15,किके तू ओस थमां सारे मनुक्खें दे सामने उनें गल्लें दा गवाह ओगा जेड़ीयां तुसें दिखियां ते सुनियां न। 
ACT,22,16,"ऊन कि चेर लाना ऐं? ओठ, पवित्रशनांन लै, ते ओस दा नां लेइयै अपने सारें पापें गी तोई सोट। "
ACT,22,17,"“जेस लै आंऊँ पी यरूशलेम च आईयै मंदर च प्रार्थना करादा हा, तां आंऊँ बेसोध ओया ते दर्शन दिख्या, "
ACT,22,18,"ते ओस गी दिखया के ओ मेरे कन्नें आखदा ऐ, तौल करियै यरूशलेम बिचा चट निकली जा; किके जेड़े लोक एस शैर च न ओ मेरे बारै च तेरी गुआई नेई मनगन। "
ACT,22,19,"मै आखया, ए प्रभु, ओ तां अप्पुं जांनदे न, के तेरे ऊपर विश्वास करने आलें गी जेले च सूटना ते जगा-जगा प्रार्थनाकार च मार चढ़ांदा हा। "
