Book,Chapter,Verse,Text
1JN,4,15,"जेड़ा कोई ए मनी लेनदा ऐ, के यीशु परमेसर दा पुत्र ऐ, परमेसर ओदे च बना रौंदा ऐ, ते ओ परमेसर च। "
1JN,4,16,"ते जेड़ा प्यार परमेसर साडे कन्नें करदा ऐ, उसी अस जानी गै, ते असेंगी ओदे उपर विश्वास ऐ। परमेसर प्यार ऐ, जेडा प्यार च बना रौंदा ऐ ओ परमेसर च बना रौंदा ऐ, ते परमेसर ओदे च बना रौंदा ऐ। "
1JN,4,17,"एदे छा प्यार साडे च सेध्द उया, के असेंगी न्याय दे देन इम्त उवै; किके जियां ओ ऐ, उयां गै दुनिया च अस बी ऐंन। "
1JN,4,18,"प्यार च डर नेई ओंदा, लेकन सेध्द प्यार डर गी दूर करी दिंदा ऐ; किके डर दा सम्बन्ध सज़ा कन्नें ओंदा ऐ, ते जेड़ा डरदा ऐ, ओ प्यार च सेध्द नेई ओया। "
1JN,4,19,"अस एसकरी परमेसर क्न्ने लोकें कन्नें प्यार करनयां न, किके पैलें ओसने साडे कन्नें प्यार कित्ता। "
1JN,4,20,"जेकर कोई अखै, “आऊँ परमेसर कन्नें प्यार करना ऐ,” लेकन अपने विश्वासी प्रा कन्नें बैर रखै, तां ओ चूठा ऐ; किके जेड़ा अपने विश्वासी प्रा कन्नें जिसी ओनें उसी दिखया ऐ प्यार नेई करदा, तां ओ परमेसर कन्नें बी जिसी ओनें नेई दिखया प्यार नेई करी सकदा। "
1JN,4,21,"ते ओदे थमां असेंगी ए उक्म मिलया, के जेड़ा कोई परमेसर कन्नें प्यार करदा ऐ, ओ अपने विश्वासी प्रा कन्नें बी प्यार करै। "
1JN,5,1,"जेसदा ए विश्वास ऐ के यीशु गै मसीह ऐ, ओ परमेसर थमां पैदा ओया ऐ; ते जेड़ा अपने कोई पैदा करने आले पिता परमेसर कन्नें प्यार करदा ऐ, ओ ओदे कन्नें बी प्यार करदा ऐ, जेड़ा ओदा बच्चा ऐ। "
1JN,5,2,"जेलै अस परमेसर कन्नें प्यार करनयां न, ते ओदे उकमें गी मननयां न, तां एदे थमां अस जांनदे आं, के अस परमेसर दे बच्चें कन्नें प्यार करनयां न। "
1JN,5,3,"किके परमेसर कन्नें प्यार करना ए ऐ, के अस ओदे उक्में गी मनचै; ते ओदे उक्म कठोर नेई। "
1JN,5,4,"किके जेड़ा केछ परमेसर थमां पैदा ओया ऐ, ओ दुनिया उपर जै आसल करदा ऐ; ते ओ जै जेस कन्नें दुनिया उपर जै आसल ओंदी ऐ साड़ा बश्वास ऐ। "
1JN,5,5,"दुनिया उपर जै पाने आला कोन ऐ? सेर्फ ओ जेस दा ए बश्वास ऐ, के यीशु गै परमेसर दा पुत्र ऐ। "
1JN,5,6,"ए उवै यीशु मसीह ऐ, जेड़ा परमेसर थमां एस दुनिया च पेजया गिया, ते पानी कन्नें पवित्रशनांन लेता,ते जेस लै ओ मरया ओसदा खून रुडया गिया; ओ नां सेर्फ पवित्रशनांन लेने आया, लेकन पानी दे ते खून सूली उपर मरने थमां अपना खून रुडानें आसतै आया पवित्र आत्मा एस गल दी गवाई दिन्दा ऐ। ते जेड़ा गवाई दिन्दा ऐ, ओ आत्मा ऐ; किके आत्मा सच्च ऐ। "
1JN,5,7,"गवाई देने आले त्रै न, "
1JN,5,8,"आत्मा, ते पानी, ते खून; ते त्रवै एक गै गल्ल उपर सैमत न। "
1JN,5,9,"जे लै अस मनुक्खें दी गवाई मनी लीनयां न, तां परमेसर दी गवाई ओदे थमां खरी ऐ; ते परमेसर दी गवाई ए ऐ, के ओनें अपने पुत्र दे बारै च गवाई दिती ऐ। "
1JN,5,10,"जेड़ा परमेसर दे पुत्र उपर विश्वास करदा ऐ, ओ अपने दिले च गै गवाई रखदा ऐ। जेस ने परमेसर उपर विश्वास नेई कित्ता, ओसने उसी चूठा अखया, किके ओस ने ओस गवाई उपर विश्वास नेई कित्ता, जेडी परमेसर ने अपने पुत्र दे बारै च दिती ऐ। "
1JN,5,11,"ते ओ गवाई ए ऐ, के परमेसर असेंगी मेशा दी जींदडी दीती ऐ, ते ए जींदडी ओदे पुत्र च ऐ। "
1JN,5,12,"जेस दा पुत्र कन्नें गुडा रिश्ता ऐ, ओदे कोल मेशा दी जींदडी ऐ; ते जेस दे कोल परमेसर दा पुत्र नेई, ओदे कोल मेशा दी जींदडी बी नेई ऐ। "
1JN,5,13,"मै तुसेंगी, जेड़े परमेसर दे पुत्र दे नां उपर विश्वास करदे ओ, एसकरी लिखया ऐ के तोस जानी लिओ के मेशा दी जींदडी थूआडी ऐ। "
1JN,5,14,"ते असेंगी परमेसर दे सामने जेडी इम्त ओंदी ऐ, ओ ए ऐ; के जेकर अस ओदी मर्जी दै मताबक लेखा केछ मंगने न, तां ओ साडी सुनदा ऐ। "
1JN,5,15,"ते जेलै अस जांनदे न, के जे केछ अस मंगने न परमेसर साडी सुनदा ऐ, तां ए बी जांनदे न, के जेड़ा केछ असें ओदे कोला मंगया, ओ थोया ऐ। "
1JN,5,16,"जेकर कोई अपने विश्वासी प्रा गी ऐसा पाप करदे दिखै, जेस दा नतीजा मौत नेई उवै,तां अर्ज करो, ते परमेसर उसी उन्दे लेई, जिनें ऐसा पाप कित्ता ऐ जेदा फल मौत नेई उवै, परमेसर उनेंगी जींदडी देग। पाप ऐसा बी ओंदा ऐ, जेस दा नतीजा मौत ऐ; एदे बारै च आऊँ अर्ज करने लेई नेई आखदा। "
1JN,5,17,"सब केसम दा अतर्म तां पाप ऐ, लेकन ऐसा पाप बी ऐ, जेदा नतीजा मौत नेई। "
1JN,5,18,"अस जांनयां न, के जेड़ा कोई परमेसर च पैदा ओया ऐ, ओ पाप नेई करदा रौंदा; लेकन परमेसर दा पुत्र यीशु, उसी ओ बचाई रखदा ऐ, ते ओ दुष्ट शतान उसी छुई नेई सकदा। "
1JN,5,19,"अस जांनदे न, के अस परमेसर दे न, ते सारी दुनिया ओस दुष्ट शतान दै कब्जे च ऐ। "
1JN,5,20,"अस ए बी जांनयां न, के परमेसर दा पुत्र एस तरती उपर आई गेदा ऐ ते ओसने असेंगी समझ दिती ऐ, के अस ओस सच्चे गी पछांनयां न, ते अस ओदे च जेडा सच्चा ऐ, मतलब ओदे पुत्र यीशु मसीह च रौंदे न। सच्चा परमेसर ते मेशा दी जींदडी उवै गै ऐ। "
1JN,5,21,"ए बच्चयो, अपने आप गी ऐसी सारियें मूरतियें छा बचायो जेडीयां परमेसर दी जगा लेंदीयां न। "
