Book,Chapter,Verse,Text
1TH,5,8,"पर आमै ता दिना रै ई, विश्वास और प्यारा रौ रक्षा रौ कवच भिड़ीयौ और छ़ुटकारै री आशा रौ टोपौ भिड़ीयौ खौबरदार रौऔ। "
1TH,5,9,"कैलैकि परमेश्‍वरै आमै रोशा कौरी सौज़ा दैणा लै नाईं, बल्कि एथलै ई छ़ांटै औन्दै कि आमै आपणै प्रभु यीशु मसीह कु छ़ुटकारौ पाई लै। "
1TH,5,10,"सेऊ आमुलै एथीलै मौरौ, कि आमै च़ाऊ ज़िउंदै औलै, च़ाऊ मौरुलै, ता आमै सौदा तेसी आइलै ज़िवी ज़ेबी प्रभु यीशु वापिस आशा लौ। "
1TH,5,11,"एज़ै कारणै एकी दुजै लै हौसलौ दैऔ, और एकी दुजै री प्रभु यीशु रै विश्वासा री मज़बुती दी मज़द कौरौ, पर आच़्छ़ौ आ कि तुमै इणौ भी कौरदै थाका ई लागी। "
1TH,5,12,"ओ मैरै प्यारै साथी विश्वासिउओ, आमै तुमु कु औरज़ कौरी ई, कि ज़ेज़ै तुमु मांझ़िऐ मैहनत कौरा ई, और प्रभु दी तुमारै अगुवै ई, और तुमुलै शिक्षा दिआई, तिउंरी इज़्ज़त कौरौ और मानौ। "
1TH,5,13,और तिंउरै कामा री वज़ाह कु प्यारा आइलै तिऊं भौरी इज़्ज़ता रै लायक सौमझ़ौ आपु मांझ़िऐ मिली-ज़ुलियौ रौऔ। 
1TH,5,14,"और ओ मैरै प्यारै साथी विश्वासिउओ, आमै तुमु सौमझ़ाई ई, कि ज़ुण आल़सी बौणी गौऐ, तिऊं खौबरदार कौरौ, कायरु लै हिम्मत दैऔ, ज़ुण विश्वासा दी कमज़ोर ई तिऊं सौम्भाल़ौ, सारेउ आइलै सौबर छ़ाड़ौ। "
1TH,5,15,"खौबरदार रौऔ! कोई भी कास आइलै बुराई रै बौदल़ै बुराई ना कौरालौ, पर सौदा भौलाई कौरना लै त्यार रौआ, और आपु मांझ़िऐ सौभी आइलै सौदा भौलाई री कोशिष कौरौ। "
1TH,5,16,सौदा भौरी खुश रौऔ। 
1TH,5,17,हर बुशा दी प्राथना दी थाकौ लागी। 
1TH,5,18,सारी बुशु दी धन्यबाद कौरौ कैलैकि तुमुलै मसीह यीशु दी परमेश्‍वरा री एज़ी ई मौरज़ी आ। 
1TH,5,19,पवित्र आत्मा रै काम लोगु री ज़िन्दगी दी हुणै कु नाईं रोकौ। 
1TH,5,20,ज़ो भविष्यवाणी पौगड़ी हुई तिऊं तुमै बेकार ना ज़ाणौ 
1TH,5,21,"सारी बुशै पौरखौ, ज़ो बूश आच़्छ़ी आ तिऊं अपणाऔ "
1TH,5,22,हर रौंगा री बुराई कु बौच़ी थाकौ। 
1TH,5,23,"शान्ति रौ परमेश्‍वर आपु ई तुमु पुरी रीती कौरी पवित्र कौरा सा। और तुमारी आत्मा, प्राण और शरीर आमारै प्रभु यीशु मसीहा रै वापिस आशणै झ़ांऊ पुरै-पुरै और बेकसूर और सौंभाल़ी छ़ाड़ा। "
1TH,5,24,ज़ुणीऐ तुमै औटाएई सेऊ एस पुरौ भी कौरा कैलैकि सेऊ विश्वास वाल़ौ आ 
1TH,5,25,"ओ मैरै प्यारै साथी विश्वासिउओ, आमुलै प्राथना कौरौ। "
1TH,5,26,सारै विश्वासिऊ आइलै पवित्र ज़िवा कौरी गौल़ै मिलियौ ढाल कौरौ। 
1TH,5,27,"हाऊं तुमुलै प्रभु रौ हुकम दिआऊ, कि इऐं चिट्ठी सारै विश्वासी भाईऊ कै पौढ़ियौ शुणाएऊ। "
1TH,5,28,आमारै प्रभु यीशु मसीह री बौड़ी दया तुमु माथै औन्दै थाकाली लागी। 
