Book, Chapter, Verse, Text
"2CO","1","1","मै पौलुस परमेश्‍वर री मर्जी कने मसीह यीशु रा प्रेरित है। ते असां रे विश्वासी भ्याल तीमुथियुस कने कुरिन्थुस शहर बिच परमेश्‍वर री कलीसिया जो ते अखाया प्रदेश रे परमेश्‍वर रे सारे लोक्कां जो ए चिठ्ठी लिख्खेया करदा है।"
"2CO","1","2","असां रे स्वर्ग बिच रैह्णे वाले पिता परमेश्‍वर अते प्रभु मसीह यीशु रे पास्से का तुसी सारेयां जो अनुग्रह अते शांती मिलदी रे।"
"2CO","1","3","असां रे प्रभु यीशु मसीह रे पिता ते परमेश्‍वर रा शुकर करदे, जे दया रा पिता है, ते हमेशा असां जो तसल्ली दिंदे।"
"2CO","1","4","से असां री हर मुसीबत बिच असां जो तसल्ली दिंदे, ताकी असी भी तिन्हा लोक्कां जो तसल्ली देई सकण जे मुसीबत बिच हिन, जिय्यां परमेश्‍वर ने असां जो तसल्ली दित्ती।"
"2CO","1","5","किजोकी असी जिन्ना जादा मसीह यीशु तांइ जुल्म सैह्‍ंदे, परमेश्‍वर तिन्ना ही जादा मसीह यीशु रे जरिये असां जो तसल्ली दिंदे।"
"2CO","1","6","असी इस उम्मीद बिच जुल्म सहन करदे कि जिय्यां परमेश्‍वर ने असां जो तसल्ली दित्ती, तिय्यां ही तिन्हा ने तुसी जो भी तसल्ली दैणी। से तसल्ली मिलणे री वजह कने तुसी भी बड़े सबर कने तिन्हा जुल्म जो सेइ लैणा जिन्हा जो असी भी सहन करेया करदे हिन।"
"2CO","1","7","तुसी तांइ असां जो पूरी उम्मीद है, किजोकी असी जाणदे कि जिय्यां तुसी असां रे जुल्म बिच साझी हुन्दे, तिय्यां ही असां री तिस आस बिच भी तुसी साझी होणा जे परमेश्‍वर ने असां जो दैणी।"
"2CO","1","8","हे मेरे संगी विश्वासियों, असी ए चांह्दे कि तुसी तिन्हा जुल्मां रे बारे बिच जाणो, जे असां जो एशिया प्रदेश बिच झेलणा पे, तित्ते असी असां री सैह्‍णे री ताकत का केई जादा तकलीफ बिच फसी गे थिये, इत्ते तक कि असां रे जिन्दे बचणे री भी कोई उम्मीद नी बची थी।"
"2CO","1","9","बल्कि असी ए मन्नी लेया थिया कि अवे असां जो मारी दित्ता जाणा, पर आखिरकार असी अप्पु रा भरोसा छड्डी करी परमेश्‍वर पर ही पुरे तरिक्के कने भरोस्सा रख्खेया जे मरे रे लोक्कां जो भी जिन्दा करी दिंदे।"
"2CO","1","10","तिन्हा ने असां जो मौत रे बड़े बड्डे खतरे का बचाया, ते अग्गे भी बचाणा। असां ने तिन्हा पर आस रख्खे री है, कि तिन्हा ने असां जो बचांदे रैह्णा।"
"2CO","1","11","तुसी जो भी प्रार्थना करी असां री मदद करणा चाएदी, ताकी मते लोक असां रे पास्से का तिन्हा आशीषां तांइ परमेश्‍वर रा शुकर करण जे परमेश्‍वर ने असां जो मती प्रार्थनां जो सुणी करी दित्ते री हिन।"
"2CO","1","12","किजोकी असी अपणे विवेक री इस गवाई पर असी पुरी बुड़ख कने बोलदे कि असी अपणे हर काम्म-काज बिच परमेश्‍वर री दित्ते री पवित्रता ते सच्चाई कने जिन्दगी जिन्दे, खासतौर पर जां असी तुसी कने थिये। असी अपणी इन्सानी समझ पर नी पर परमेश्‍वर रे अनुग्रह पर निर्भर रैहन्दे।"
"2CO","1","13-14","असी तुसी जो से ही लिखदे जे तुसी पढ़ी ते समझी सकदे। हालांकी अब्बे तुसी असां री गल्लां जो पुरे तरिक्के कने नी समझी पांदे, पर असां जो आस है कि तुसी असां री गल्लां जो पुरे तरिक्के कने समझणा। ताकी मसीह यीशु रे हटणे रे बेल्ले तुसी असां पर तिन्ना ही गर्व करी सको, जिन्ना असां जो तुसी पर है।"
"2CO","1","15","अवे जां मै जाणदा कि तुसी घट-बध ही समझी पाया करदे हिन, इधेरे तांइ मै तुसी का आणा चाह्‍ंदा ताकी मेरा तुसी का दुबारा आणे री वजह कने तुसी जो दुगणी आशीष मिल्ले।"
"2CO","1","16","अते मै ए सोच्चेया कि मकिदुनिया प्रदेश जो जांदे बेल्ले तुसी कने मिली करी जां, अते फिरी मकिदुनिया प्रदेश का हटदे बेल्ले तुसी का दुबारा आ, अते तुसी मेरे जो यहुदियां प्रदेश बिच पुजणे तीकर मेरी किच्‍छ मदद करो।"
"2CO","1","17","मेरा मन पुरे तरिक्के कने तयार थिया कि ए ही योजना होणी। मै तुसी कदी “हां” ते कदी “ना” नी थिया बोलदा। मै दुनिया रे लोक्कां सांइ योजना नी बणांदा।"
"2CO","1","18","जिय्यां परमेश्‍वर विश्वासयोग्य हिन, तिय्यां ही असां री गल्लां हमेशा ही सच हुंदी।"
"2CO","1","19","किजोकी मै पौलुस, सिलवानुस ते तीमुथियुस ने, परमेश्‍वर रे पुत्तर मसीह यीशु रा शुभ संदेश रा प्रचार तुसी लोक्कां बिच कित्तेया, ते मसीह यीशु बिच कदी “हां” ते कदी “ना” नी थिया, पर तिस बिच हमेशा सिर्फ “हाँ” ही “हाँ” है।"
"2CO","1","20","परमेश्‍वर रे कित्ते रे सारे वादे मसीह यीशु बिच पुरे होए रे हिन। इधेरे तांइ असी “आमीन” बोलदे जिसेरा मतलब है “हां”, ताकी असां रे जरिये परमेश्‍वर री महिमा हो।"
"2CO","1","21","परमेश्‍वर ही हिन जे असां जो तुसी कने मसीह यीशु तांइ मजबुत करदे, ते लोक्कां जो मसीह यीशु रा शुभ संदेश दसणे तांइ असां जो चुणे रा है।"
"2CO","1","22","जिन्हा ने असां पर मौहर भी लाइ ते अमानत रे तौर पर असां जो पवित्रात्मा जो दित्ता।"
"2CO","1","23","परमेश्‍वर मेरे गवाह हिन कि मै सच बोल्लेया करदा है कि दुज्जी बारी कुरिन्थुस शहर बिच इधेरे तांइ नी आया किजोकी मै तुसी जो तुसी री गलतियां री वजह कने बकणा नी चाह्‍ंदा थिया।"
"2CO","1","24","ए गल्ल नी है कि असी तुसी रे विश्वास पर काबू पाणा चाह्‍ंदे बल्कि तुसां री खुशी बिच तुसी रे कने कम्म करणे वाले हिन किजोकी तुसी विश्वास मजबूत हिन।"
"2CO","2","1","इधेरे तांइ मै ए ठाणी लित्तेया थिया कि तुसी जो फिरी दुख दैणे तांइ ना आं।"
"2CO","2","2","किजोकी जे मै तुसी जो दुखी करी देयां तां तुसी रे अलावा मेरे जो खुशी दैणे वाला कोई नी रैह्णा।"
"2CO","2","3","अते ए ही गल्ल जे मै तुसी जो लिख्खी ताकी कुथकी इय्यां ना हो कि जां मै तुसी का आं, तां जिन्हा लोक्कां का मेरे जो खुशी मिलणी चाएदी, तिन्हा का मेरे जो दुख मिल्लो। किजोकी जां तुसी खुश हुंदे, तां तिस कने मेरे जो खुशी मिलदी।"
"2CO","2","4","किजोकी तुसी जो मै दुखी मन का अते तकलीफ बिच रोई-रोई करी ए चिठ्ठी लिख्खी पर तुसी जो दुखी करणे तांइ नी, बल्कि इधेरे तांइ कि तुसी उस प्यार जो जाणी सको, जे खास कर तुसी रे तांइ है।"
"2CO","2","5","पर जे अगर कुसकी ने दुख दित्ते रा है तां तिसने सिर्फ मेरे जो ही नी, पर थोड़ा-मता ता तुसी सारेयां जो भी दित्ते रा है। मै तिस मणु री गलती रे बारे बिच इसका जादा किच्‍छ भी नी बोलणा चाह्‍ंदा।"
"2CO","2","6","इदेय जणे तांइ जे विश्वासी भाईयां ने दित्ते री है, से ही सही है।"
"2CO","2","7","इसेरे उलट तुसी तिस जो माफ करी दो अते तिसजो तसल्ली देयो, कुदखी इय्यां ना हो कि से मसीह बिच विश्वास करणे का पिच्छे हटी जाए।"
"2CO","2","8","इधेरे तांइ मेरी तुसी रे कने बिनती है कि तुसी तिन्हा सामणे ए ज़ाहिर करो कि तुसी तिन्हा कने प्यार करदे।"
"2CO","2","9","किजोकी मै तुसां जो इस मकसद कने चिठ्ठी लिख्खी कि तुसां जो परखी लेयां कि तुसी मेरी सारी गल्लां जो मनणे तांइ तयार हिन की नी।"
"2CO","2","10","पर जिस कुसकी जो तुसी कुसकी गल्ल तांइ माफ करदे तिसजो मै भी माफ करदा। किजोकी जे किच्‍छ मै माफ करदा (जे माफ कित्तेया है) से मसीह यीशु रे मिल्ले रे हक कने तुसी रे फायदे तांइ ही करदा।"
"2CO","2","11","ताकी शैतान असां रा कोई फायदा नी उठाई सको किजोकी असी तिसेरी चाल्लां जो जाणदे।"
"2CO","2","12","जां मै मसीह यीशु रा शुभ संदेश सुनाणे त्रोआस शहर बिच आया, तां प्रभु ने मेरे जो शुभ संदेश सुनाणे रा बड्डा मौक्का दित्तेया।"
"2CO","2","13","पर जां अपणे विश्वासी भ्याल तीतुस जो तित्ते नी दिख्खेया तां मेरा मन बड़ा बैचेन होई गेया, ते तिसजो तोपणे तांइ मै त्रोआस शहर रे विश्वासियां का विदा लेई करी आई गेया, ते मकिदुनिया प्रदेश जो हटी गेया।"
"2CO","2","14","परमेश्‍वर रा शुकर हो, मसीह कने असां रा रिश्ता होणे री वजह कने से असां जो मसीह कने हमेशा लेइ करी चलदे ते असां जो जीत दुआंदे। ते परमेश्‍वर अपणे मसीह जो जानणे री खुशबू जो इक्क महक सांइ असां रे जरिये हर जगह फैलांदे।"
"2CO","2","15","किजोकी असां री जिन्दगी परमेश्‍वर रे सामणे छुटकारा पाणे वाले ते नाश होणे वाले लोक्कां तांइ मसीह री इक्क महक सांइ हिन।"
"2CO","2","16","पर तिन्हा लोक्कां तांइ जे बर्बादी पास्से बधेया करदे हिन, ए मौत री इदेइ गंदी मुस्क है, जे मौत रे पास्से लेई जांदी। पर तिन्हा लोक्कां तांइ जे छुटकारा रे रस्ते बिच बधेया करदे हिन, ए जिन्दगी री इदेयी महक है, जे हमेशा री जिन्दगी रे पास्से लेइ चलदी। इन्हा गल्लां जो कोई अपणी काबलियत कने नी करी सकदा।"
"2CO","2","17","असी उन्हा केई मणुआं सांइ नी हिन, जे पैसे रे लालच बिच परमेश्‍वर रे वचन बिच हेराफेरी करदे हिन, पर असी ए जाणदे होए कि परमेश्‍वर असां जो भेज्जे रा है, ते से असां जो दिख्खेया करदे हिन, ते असी मसीह रे हक कने हमेशा सच्चाई कने शिक्षा दिंदे।"
"2CO","3","1","असी फिरी अपणी तारीफ नी हिन करेया करदे। ते असां जो बाकी मणुआं सांइ तुसी जो अपणी सिफारिश करणे तांइ चिठ्ठियां दैणे या लैणे री बिल्कुल भी जरुरत नी है।"
"2CO","3","2","तुसी ता अप्पु ही चिठ्ठियां सांइ हिन जे परमेश्‍वर तांइ कित्ते रे मेरे कम्मां री सिफारिश करदे ते जिन्हा जो सारे लोक पढदे ते समझदे।"
"2CO","3","3","साफ तौर पर तुसी मसीह यीशु रे पास्से का चिठ्ठियां सांइ हिन जे असां री सेवकाई रा नतीज्जा है, जे सलेट पर नी लिख्खे गे रे हिन पर परमेश्‍वर री आत्‍मा कने असां रे दिल री सलेट पर लिख्खे गे रे हिन।"
"2CO","3","4","असी इय्यां इधेरे तांइ बोलदे किजोकी मसीह यीशु रे जरिए, परमेश्‍वर रे सामणे असां जो इदेइ हिम्मत हुंदी।"
"2CO","3","5","असी नी बोलदे कि असां बिच अप्पु किच्‍छ करणे री काबलियत है, पर परमेश्‍वर असां जो ए सब करणे री काबलियत दिंदे।"
"2CO","3","6","तिन्हा ने असां जो परमेश्‍वर रे नौए वाचा रे सेवक होणे रे काबिल बणाए रा है, ए नौई वाचा मूसा रे कानून बिच लिख्खे री गल्लां रा नी है पवित्रात्मा रा है। किजोकी मूसा रे कानून पर ना चलणे पर ता मौत मिलदी, पर परमेश्‍वर री नौई वाचा रे जरिये पवित्रात्मा असां जो हमेशा री जिन्दगी दिंदा।"
"2CO","3","7-8","जां मूसा रा कानून जे पत्थर री सलेटां पर लिख्खेया गेया थिया, तां तिस बेल्ले परमेश्‍वर री महिमा दिख्खी गयी थी, इस्राएल रे लोक मूसा रे चेहरे जो जादा देर तीकर नी दिख्खी सके, किजोकी से बड़ा चमकेया करदा थिया पर तिसेरी चमक भी जादा देर तीकर नी रेइ, इधेरे तांइ जे अगर मूसा रे कानून पर आधारित सेवकाई जे मौत पास्से लेई जांदी, अगर इन्नी जादा चमकदार है, तां फिरी नौई वाचा रे अधीन होई करी परमेश्‍वर री पवित्रात्मा री सेवकाई करणे बिच इसका भी जादा महिमा होणी।"
"2CO","3","9","किजोकी जां कसुरवार ठैहराणे वाला, मूसा रे कानून महीमामय थिया, तां पक्के तौर पर धार्मिक ठैहराणे वाली नौई वाचा बिच होर भी जादा महीमामय होणी।"
"2CO","3","10","हकिकत बिच नौई वाचा इन्नी जादा अनौखी है कि मूसा रा कानून अवे महीमामय नी रेया।"
"2CO","3","11","मूसा रा कानून इक्क बड़ी महिमा कने दित्तेया गेया थिया जे जादा देर तीकर नी रेइ। पर नौई वाचा री महिमा जादा बड्डी है किजोकी से हमेशा तीकर रैह्‍णी।"
"2CO","3","12","इधेरे तांइ इदेइ आस रख्खी करी असी हिम्मत कने बोलदे।"
"2CO","3","13","अते असी मूसा सांइ नी हिन जे अपणे मुँह पर परदा पाई रखदा थिया ताकी इस्राएल रे मणु तिसेरे चेहरे पर परमेश्‍वर रे चमक जो घटदे-घटदे ते मुकदे होए ना दिख्खे।"
"2CO","3","14","तिन्हेरी समझ मंद होई गे री है, किजोकी अज्ज तांइ जां से तिस मूसा रे कानून जो पढ़दे, तां से ही परदा तिन्हेरी समझ पर पेई रैहन्दा, पर से परदा बस मसीह यीशु पर विश्वास करणे रे जरिए ही हटदा।"
"2CO","3","15","ते अज्ज तांइ जां भी मूसा रा कानून पढ़ेया जांदा तां लोक तिसजो पुरी तरिक्के कने समझी नी पांदे।"
"2CO","3","16","पर जां कोई मणु मसीह यीशु बिच विश्वास करदा तां तिसेरी समझ का से परदा हटाई दित्ता जांदा।"
"2CO","3","17","प्रभु ता आत्‍मा हिन, अते जित्ते कुते प्रभु रा आत्‍मा है, तित्ते मूसा रे कानून का अजादी है।"
"2CO","3","18","असी सारे प्रभु री महिमा जो अपणे उघाड़े रे चेहरे कने इक्क शीशे सांइ प्रकाशित करदे। असां जो अपणे सांइ बनाणे तांइ तिस चमकदार महिमा बिच जादा का जादा बदलेया करदे हिन। ते ए महिमा परमेश्‍वर रे पास्से का है, जे पवित्रात्मा रे रूप बिच असां का है।"
"2CO","4","1","इधेरे तांइ जां असां रे पर इदेयी दया होई कि असां जो परमेश्‍वर रा संदेश सुनाणे री सेवा मिल्ली तां असी हिम्मत नी हारदे।"
"2CO","4","2","पर असां ने शरम रे ते गुप्त कम्मां जो छड्डी दित्तेया, अते न चलाकी कने चलदे, अते ना परमेश्‍वर रे वचन बिच हेराफेरी करदे, पर परमेश्‍वर रे सामणे असी सिर्फ सच बोलदे, ते असी लोक्कां रे विवेक बिच ए बिठाई दिंदे कि जे असी बोल्लेया करदे हिन से सच है।"
"2CO","4","3","जे शुभ संदेश असी लोक्कां जो सुणांदे, से तिन्हा लोक्कां का लुके रा है जे हमेशा री मौत रे रस्ते पर हिन।"
