"2CO","4","4","शैतान, जे इस दुनिया रे लोक्कां रा शासक है, तिनिये मसीह यीशु बिच विश्वास ना करणे वाले लोक्कां री समझ जो मंद करी रख्खे रा है, ताकी से लोक शुभ संदेश री महीमामय रौशनी जो नी दिख्खी सके। से लोक मसीह यीशु रे इस महिमा रे संदेश जो नी समझदे जे परमेश्‍वर रे प्रतीरुप हिन।"
"2CO","4","5","दिख्खो, असी लोक्कां बिच जाई-जाई करी अपणे बारे बिच प्रचार नी करेया करदे हिन। असी मसीह यीशु रा प्रचार करेया करदे हिन, ते मसीह रे खातिर असी तुसी रे सेवक हिन।"
"2CO","4","6","किजोकी परमेश्‍वर ने ही बोल्ले रा है, “न्याहरे बिच रौशनी चमके”, ते से ही असां रे दिल बिच चमकी, ताकी असी मसीह बिच परमेश्‍वर री महिमा जो दिख्खी सकण।"
"2CO","4","7","असी मिट्टी रे भांडेया सांइ हिन जिन्हा बिच इस धन्न जो जमा करी के रख्खेया गे रा है, किजोकी ए असीम ताकत असां रे पास्से का नी पर परमेश्‍वर रे पास्से का है।"
"2CO","4","8","असी चौं पास्से का तकलीफां ता भोगदे, पर असी खतरे बिच नी पैंदे। असी घबराये रे ता हिन, पर निराश नी हिन।"
"2CO","4","9","सताए ता जान्दे, पर छड्डे नी जांदे, झुकाये तां जांदे, पर नास नी होये हिन"
"2CO","4","10","असी हर बेल्ले मसीह यीशु री तकलिफां ते मरणे रे अनुभव जो अपणे शरीर बिच महसूस करदे ताकी लोक मसीह यीशु रे जिन्दगी जो असां रे कम्मां रे जरिये जाणी सकण।"
"2CO","4","11","हां, असी हमेशा मौत रे खतरे बिच रैहन्दे किजोकी असी मसीह यीशु रा शुभ संदेश सुणांदे ताकी मसीह यीशु री जिन्दगी असां रे कम्मां रे जरिये लोक्कां पर ज़ाहिर हो।"
"2CO","4","12","तां असी मौत रे खतरे बिच रैहन्दे पर इसेरा नतीज्जा ए होया कि तुसी जो हमेशा रा जीवन मिल्लेया।"
"2CO","4","13","पर असी प्रचार करणा जारी रखदे किजो असां बिच तैसा ही विश्वास है जैसा तिस भजनकार बिच थिया जां तिनिये ए लिख्खेया, “मै परमेश्‍वर पर विश्वास कित्तेया, इधेरे तांइ मै बोल्लेया, इधेरे तांइ असी भी विश्वास करदे ते बोलदे।”"
"2CO","4","14","अते ए जाणदे कि जिनिये प्रभु यीशु जो मरे रे लोक्कां बिच का जिंदा कित्तेया, तिन्हा ने ही असां जो भी तिय्यां ही जिंदा करणा, ते परमेश्‍वर ने असां जो तुसां कने कठ्ठे करी के लेई आणा ते असी तिन्हेरी मौजुदगी बिच हाजिर रैह्‍ण।"
"2CO","4","15","जे किच्‍छ असां कने घटे रा है, से तुसी रे फायदे तांइ ही हिन ताकी जिय्यां परमेश्‍वर रा अनुग्रह जादा का जादा लोक्कां जो मसीह बिच लेई आया करदा है तिस कने मते लोक्कां ने परमेश्‍वर रा तिन्हेरी महिमा तांइ शुकर करणा।"
"2CO","4","16","इधेरे तांइ असी हिम्मत नी हारदे, हालांकी असां रा शरीर मुकेया करदा है पर असां अंदर असां री आत्‍मा हर रोज नौई हुंदी जांदी।"
"2CO","4","17","किजोकी असां री मुसीबतां छोटी हिन ते तिन्हा ने जादा हाण तांइ नी रैह्णा किजोकी तिन्हेरे अंजाम “हमेशा री महीमा” होणा, जे तिस हर कुसकी चीज का बड्डी भी है, जिसेरे बारे बिच असी कदी सोच्ची भी नी सकदे।"
"2CO","4","18","अते असां तां दिख्खी री चिज्जां जो नी पर अण-दिख्खी चिज्जां जो दिखदे रैह्‍न्दे, किजोकी दिख्खी री चिज्जां थोड़े ही रोज री हिन, पर अणदिख्खी चिज्जां हमेशा बणी रैह्न्दी।"
"2CO","5","1","जिय्यां कि असी जाणदे कि इस दुनिया बिच असां रा शरीर इक्क तम्बु सांइ है जित्ते असी रैहन्दे। जां असी मरी जाणा तां असां जो परमेश्‍वर रे पास्से का स्वर्ग का इक्क इदेया शरीर मिलणा जे हत्थां रा बणे रा नी पर हमेशा तीकर रैह्णे वाला है।"
"2CO","5","2","इस शरीर बिच ता असी पिड़ां कने किल्दे रैहन्दे ते बड़ी तमन्‍ना रखदे की अपणे स्वर्गीय शरीर जो पाई लैण।"
"2CO","5","3","ताकी जां असी अपणे स्वर्गीय शरीर जो पाई लेण तां असी तिसेरे बगैर ना पाए जाण।"
"2CO","5","4","ते असी इस शरीर बिच रैहन्दे होए जे इस दुनिया बिच असां रे तम्बु सांइ है, बोझ कने किल्दे रैहन्दे, किजोकी असी अपणे इस दुनिया रे शरीर जो उतारणा नी चाह्‍ंदे पर स्वर्गीय शरीर जो भी पाई लैणा चाह्‍ंदे, ताकी असां रे नौए स्वर्गीय शरीर असां रे इन्हा शरीरां कने बदली जाए जे इक्क दिन मुकी जाणे।"
"2CO","5","5","जिन्हा ने असां जो स्वर्गीय शरीर जो पाणे तांइ तयार कित्ते रा है, से परमेश्‍वर है, जिन्हा ने असां जो अमानत बिच पवित्रात्मा भी दित्ते रा है।"
"2CO","5","6","अते असी हमेशा हिम्मत बणाई रखदे ते ए जाणदे की जां तीकर असी शरीर बिच रैहन्दे, तां तांइ असी प्रभु कने नी स्वर्ग बिच नी रेया करदे हिन।"
"2CO","5","7","हल्ले जां असी इस दुनिया बिच जिया करदे हिन, तां असी प्रभु रा अनुसरण तिन्हा जो दिख्खी करी नी पर विश्वास करणे रे जरिये करेया करदे हिन।"
"2CO","5","8","इस तांइ असी हिम्मत बणाई रखदे कि मरणे रे बाद शरीर जो छड्डी करी प्रभु कने रैह्णा होर भी जादा खरा समझदे।"
"2CO","5","9","इस तांइ असां रे मन री खुशी ए है कि चाए असी तिन्हा कन्ने स्वर्ग बिच रैह्‍ण या चाए तिन्हा का दूर इस दुनिया बिच रैह्‍ण, पर असी तिन्हा जो पसंद आंदे रैह्‍ण।"
"2CO","5","10","किजोकी जरुरी है असां सारेयां रा हाल मसीह यीशु रे असां रा हिसाब-किताब करदे बेल्ले खुली जाए, की हर इक्क मणु अपणे भले-बुरें कम्मां रा बदला पाए जे तिन्हा ने शरीर रे जरिए कित्ते होण।"
"2CO","5","11","इस तांइ परमेश्‍वर रा डर मन्नी करी असी लोक्कां जो छंदे करी के परमेश्‍वर रे सच पर विश्वास करणे तांइ समझांदे ते तिन्हेरे सामणे असां रा हाल प्रकट है, ते मेरे जो ए आस है की तुसी रे विवेक पर भी असां रा हाल प्रकट होया होणा।"
"2CO","5","12","असी फिरी भी अपणी तारीफ तुसी अग्गे नी करदे, पर असी तुसी जो असां रे बारे बिच गर्व करणे रा मौक्का दिदें, तुसी तिन्हा जो जवाब देइ सको, जे मन पर नी पर दिखावटी गल्लां पर घमंड करदे।"
"2CO","5","13","जे अगर कोई बोल्ले कि असी बेसुध हिन तां सिर्फ परमेश्‍वर तांइ हिन, ते जे अगर असी होश बिच हिन, तां तुसी तांइ हिन।"
"2CO","5","14","किजोकी मसीह यीशु रा प्यार असां जो मजबूर करी दिंदा, किजोकी असी ए समझदे की जां इक्क मणु सारे लोक्कां तांइ मरेया तां सारे मरी गे।"
"2CO","5","15","ते मसीह इधेरे तांइ सारेयां तांइ मरेया कि जे लोक जिन्दे हिन, से अग्गे जो अपणे तांइ ना जिन्दगी ना जीण पर तिन्हेरे तांइ जीण जे तिन्हेरे तांइ मरेया ते फिरी मरे रे लोक्कां बिच का जिन्दा होई गेया।"
"2CO","5","16","अते अवे असी कुसकी होर जो इन्सानी तौर-तरिक्के रे हिसाब कने नी समझगे हालांकी असां ने भी मसीह यीशु जो इन्सानी तौर-तरिक्के रे हिसाब कने समझेया, तां भी अब्बे का असी तिन्हा जो इदेया नी जाणगे।"
"2CO","5","17","इस तांइ जे कोई मसीह यीशु बिच विश्वास रखदा तां से नौई रचना है: पुराणी जिन्दगी बिती गे री है, अवे नौई जिन्दगी री शुरुआत होए री है।"
"2CO","5","18","ए सारी गल्लां परमेश्‍वर रे पास्से का है, जिन्हा ने मसीह यीशु रे जरीए असां रा अप्पु कने मेल जोल करी दित्ता, ते अप्पु कने लोक्कां रा मेल जोल करणे री सेवा असां जो सौंप्पि दित्ती।"
"2CO","5","19","इसेरा मतलब ए है कि परमेश्‍वर ने मसीह यीशु बिच होई करी अपणे कन्ने दुनिया रा मेल जोल करी लित्ता, ते लोक्कां रे पाप्पां रा इल्जाम तिन्हा पर नी लाया। ते ए ही मेल जोल कराणे रा से संदेश है, जे परमेश्‍वर ने लोक्कां जो सुनाणे तांइ असां जो सौंप्पे रा है।"
"2CO","5","20","इस तांइ असी मसीह यीशु रे राजदूत हिन मन्नों परमेश्‍वर असां रे जरिए बिनती करेया करदे हिन; असी मसीह यीशु रे पास्से का बिनती करेया करदे हिन की परमेश्‍वर कने मेल जोल करी लेयो।"
"2CO","5","21","मसीह जे पाप का अनजान थिये, तिन्हा ही जो परमेश्‍वर ने असां तांइ पाप्पि ठैहराया ताकी परमेश्‍वर असां जो मसीह रे कित्ते रे कम्मां रे जरिये धार्मिक ठैहराण।"
"2CO","6","1","असी जे परमेश्‍वर रे सहकर्मी हिन, छंदे करी के समझादें की परमेश्‍वर री अनुग्रह जे तुसी पर है, तिसजो बेकार मत जाणा देयो।"
"2CO","6","2","किजोकी पवित्रशास्त्र बिच परमेश्‍वर ता ए बोलदे, “ठीक समय पर मै तेरी सुणी लित्ती, ते छुटकारे वाले दिन मै तेरी मदद कित्ती, सुणो, अब्बे ए से ठीक समय है; सुणो, अब्बे से छुटकारे रा दिन है।”"
"2CO","6","3","परमेश्‍वर रे सहकर्मी होणे रे नात्ते असी कुसकी गल्ल बिच ठोक्कर खाणे रा कोई भी मौक्का नी दिदें, ताकी असां री सेवा पर कोई इल्जाम ना आये।"
"2CO","6","4","हर तरिक्के कने असी ए ज़ाहिर करदे कि असी परमेश्‍वर रे चुणे रे दास हिन, असी बड़े सबर कने दुखां, कमी-घटियां ते मुसिबतां जो सैह्‍ंदे।"
"2CO","6","5-6","ते असी कौड़े खाणे कने, कैद होणे कने, हगांमेया कने, मेहनत करदे होए, जागदे रैह्णे कने, भुख्ख बिच, पवित्रता कने, ज्ञान कने, सबर कने, रहम कने, पवित्रात्मा कने अप्पु जो परमेश्‍वर रे चुणे रे दास साबित करदे।"
"2CO","6","7-8","असी सच्चे प्यार कने, सच्चाई रे वचनां कने, परमेश्‍वर री ताकत कने, धार्मिकता रे हथियारां कने जे हमला करणे ते अपणी रक्षा करणे तांइ हिन, ते लोक्कां रा असां री इज्जत या बेइज्जती करणे रे जरिये, ते तिन्हेरे असां रे बारे बिच ठीक या बुरी गल्लां बोलणे रे जरिये भी अप्पु जो परमेश्‍वर रे चुणे रे दास साबित करदे। ते हालांकी असां जो ढोंगी समझेया गेया, पर असी सच ही बोलदे।"
"2CO","6","9-10","किच्‍छ लोक असां जो ठीक जाण-पैछाण वालेयां सांइ मिलदे, पर किच्‍छ लोक असां जो अनजान लोक्कां सांइ नजरंदाज करी दिंदे। असी मरणे रे करीब रैहन्दे, पर असी फिरी भी जिन्दे हिन। असां जो कुट्टेया गेया, पर असी फिरी भी नी मरे। असां रे दुखी होणे रा समय भी आया पर असी फिरी खुशी मनांदे। असी गरीब हिन, पर मते जणेया जो आत्मिक रूप बिच अमीर बणाई दिदें, असी इदेय हिन कि जिय्यां असां का किच्‍छ भी नी है, पर फिरी भी असी सब किच्‍छ रखदे। ते इन्हा ही सारे तरिक्के कने असी ए ज़ाहिर करदे कि असी परमेश्‍वर रे चुणे रे दास हिन।"
"2CO","6","11","हे कुरिन्थियों शहर रे विश्वासियों, असी तुसी कने खुली करी गल्लां कित्ती री हिन, असी तुसी जो खुले दिल कने प्यार करदे।"
"2CO","6","12","असां रे दिल बिच तुसी तांइ प्यार री कोई कमी नी है, पर तुसी ने असां तांइ अपणे प्यार जो रोक्की रख्खे रा है।"
"2CO","6","13","पर तुसी जो अपणे बच्चे समझी करी मै तुसी जो बोलदा की तुसी भी असां रे प्यार रे बदले बिच पर अपणे प्यार जो मत रोक्की रख्खो।"
"2CO","6","14","अविश्वासी लोक्कां रे सहभागी मत बणो। किजोकी धार्मिकता ते अधार्मिकता रा कोई मेल जोल नी है, रौशनी या न्याहरे री कोई सगंती नी है।"
"2CO","6","15","ते मसीह यीशु जी रा शैतान कने कोई लैणा-दैणा नी है, ते विश्वासी कने अविश्वासी रा कोई नात्ता नी है।"
"2CO","6","16","ते मूर्तां कने परमेश्‍वर रे मन्दिर रा कोई रिश्ता नी। किजोकी असी ता जिन्दे परमेश्‍वर रे मन्दिर हिन, जिय्यां परमेश्‍वर ने बोल्ले रा है, “मै तिन्हा लोक्कां बिच बसणा ते तिन्हा बिच चलणा-फिरणा, मै तिन्हेरा परमेश्‍वर होण ते से मेरे लोक होणे।”"
"2CO","6","17","इस तांइ परमेश्‍वर पवित्रशास्त्र बिच असां जो बोलदे, “अविश्वासी लोक्कां रे बिच का निकलो ते बखरे रेयो ते भिठ्ठी चिज्जां री अराधना मत करो, तां मै तुसी जो अपनाणा।"
"2CO","6","18","ते मै तुसी रा प्यो होणा ते तुसी मेरे बच्चे-बच्चियां होणे, ए सर्वशक्तिमान प्रभु परमेश्‍वर रा वचन है।”"
"2CO","7","1","अते हे प्यारे संगी विश्वासियों, जां परमेश्‍वर ने असां कने ए वादा कित्ते रा है कि तिन्हा ने असां जो अपणे बच्चेयां रे रूप बिच अपणाई लैणा, इधेरे तांइ, आओ असी हर तरिक्के री बुराई जो छड्डी देण, ते इक्क पवित्र जिन्दगी जीणे री कोशीश करदे रैह्‍ण।"
"2CO","7","2","असां कने प्यार बणाई रख्खो, असी ना कुसकी कने नाईंसाफी कित्ती ते ना कुसकी रा किच्‍छ बिगाड़े रा है ते ना ही कुसकी जो ठग्गे रा है।"
"2CO","7","3","मै तुसी जो दोषी ठैहराणे तांइ ए नी बोलदा, किजोकी मै पैल्ले ही बोल्ली चुक्के रा है कि असी तुसी जो इन्ना प्यार करदे कि असी तुसी कने जीणे-मरणे तांइ भी तयार हिन।"
"2CO","7","4","मै तुसी कने बड़ी हिम्मत कने बोलदा कि मेरे जो तुसी पर बड़ा गर्व है, मै बड़ा भारी उत्साहित है, अपणे सारे दुख बिच भी मै खुशी कने भरी रैहन्दा।"
"2CO","7","5","किजोकी जां असी त्रोआस शहर का निकली करी मकिदुनिया प्रदेश बिच आए थिये तां भी असां जो अराम नी मिल्लेया, पर असां जो चारो पास्से का मुसीबतां कने घिरे रे थिये, बाहर लड़ाईयां थी ते अन्दर ड्रौणी गल्लां थी।"
"2CO","7","6","तां भी दुखी मणुआं जो तसल्ली दैणे वाले परमेश्‍वर ने तीतुस रे आणे कने असां जो तसल्ली दित्ती।"
"2CO","7","7","ते तिसेरे आणे कने मेरे जो तिन्नी तसल्ली मेरे जो नी, जिन्नी तसल्ली मेरे जो तां मिल्ली जां तिनिये मेरे जो दस्सेया कि तुसी मेरे तांइ किन्ने फिकरमंद थिये ते तुसी जो मेरा बड़ा चाह होए रा थिया, ते तुसी जो असां री मुसिबतां रे बारे बिच जाणी करी किन्ना जादा दुख होया थिया।"
