"2CO","10","7","तुसी बाहरी दिखावट पर ध्यान दिंदे। जे अगर कुसकी मणु जो अप्पु पर ए भरोस्सा हो, कि से मसीह यीशु रा है, तां से ए भी जाणी लेयो कि जिय्यां से मसीह यीशु रा है, तिय्यां ही असी भी मसीह यीशु रे हिन।"
"2CO","10","8","किजोकी अगर मै तिस हक रे बारे बिच होर भी गर्व करां, जे प्रभु ने असां जो तुसी रे विश्वास जो घटाणे तांइ नी पर तुसी रे विश्वास जो बधाणे तांइ दित्ते रा है, तां मै शर्मिंदा नी होणा।"
"2CO","10","9","मै अपणी चिठ्ठियां रे जरिये तुसी जो डराणे री कोशीश नी है करेया करदा।"
"2CO","10","10","किजोकी तुसी बिच का मते जणे बोलदे, कि मेरी चिठ्ठियां तां बड़ी कड़क ते जोरदार हिन, पर जिस बेल्ले मै आमणे-सामणे मिलदा, तां कमजोर ते गल्ल-बात करणे बिच बेकार लगदा।"
"2CO","10","11","जे इय्यां बोलदे, से ए समझी रख्खे कि जिय्यां पिठ्ठी पिच्छे चिठ्ठियां बिच असां रे संदेश हिन, तिय्यां ही तुसी सामणे असां रे कम्म भी होणे।"
"2CO","10","12","किजोकी असां जो ए हिम्मत नी है कि असी अप्पु जो तिन्हा बिच का किच्‍छ इदेय जणेया कने गिणन या तिन्हा बिच अप्पु जो मिलाण, जे अपणी तारीफ अप्पु करदे, ते अपणे आप जो अप्पु-मिते नाप्पि-तोल्ली करी इक्क-दुज्जे कने बराबरी करी के बेवकूफ ठेहरदे।"
"2CO","10","13","असी तां तिस कम्म री सीमा का बाहर कदी भी गर्व नी करणा जे कम्म परमेश्‍वर ने असां जो दित्ते रा है, पर तिस्सी सीमा तक जे परमेश्‍वर ने असां तांइ ठेहराई दित्ते री है, ते तिस बिच तुसी भी आई गे रे हिन, ते तिन्हा कम्मां री सीमा बिच ही गर्व भी करणा।"
"2CO","10","14","जां असी पैल्ली बारी तुसी का पुज्जे, तां असी गर्व करणे बिच तिस सीमा जो नी टप्पेया, जित्ते परमेश्‍वर ने असां जो कम्म करणे तांइ नी ठेहराया थिया। तिन्हा ने असां जो तुसी रे इलाक्के बिच कम्म करणे तांइ ठेहराया थिया, ते असी तुसी जो मसीह रा शुभ संदेश दसणे वाले पैल्ले लोक थिये।"
"2CO","10","15","असी सीमा का बाहर दुज्जेयाँ री मेहनत पर गर्व नी करदे, पर असां जो आस है कि जिस तरिक्के कने तुसी रा विश्वास बधदा जाणा तिस तरिक्के कने असी अपणी सीमा रे हिसाब कने तुसी री वजह कने होर भी जादा लोक्कां जो मसीह रा शुभ संदेश सुणाई सकणा।"
"2CO","10","16","ताकी असी तुसी रे इलाके री सीमा का अग्गे बधी करी, होर इलाक्केयां बिच भी शुभ संदेश सुनाण, ते ए ही नी कि असी दुज्जेयां री सीमा रे अन्दर बणे-बणाए कम्मां पर गर्व करण।"
"2CO","10","17","पर जिय्यां कि पवित्रशास्त्र बिच लिख्खे रा है, “जे अगर कोई गर्व करो, से प्रभु पर ही गर्व करो।”"
"2CO","10","18","किजोकी जे अपणी तारीफ करदा, से नी, पर जिसेरी तारीफ प्रभु करदे, से ही प्रभु री नजरां बिच सही है।"
"2CO","11","1","मेरी चाह्‍त है कि जां मै थोड़ी-मती बेवकुफी री गल्लां करदा, तां तुसी मेरे जो सहन करी लेयो।"
"2CO","11","2","मै भी तिय्यां ही तुसी री फिकर करदा जिय्यां परमेश्‍वर तुसी री फिकर करदे। किजोकी मै तुसी जो मसीह यीशु जो सौंपणे रा इराद्दा कित्ते रा है। ए तिय्यां ही है कि जिय्यां इक्क प्यो अपणी कुँवारी कुड़ी जो तिसेरे लाड़े जो ब्याह का बाद सौंपी दिंदा।"
"2CO","11","3","पर मै डरदा कि जिय्यां शैतान ने सप्प रे रूप बिच, अपणी चलाकी कने हव्वा जो बैह्काया थिया, तिय्यां ही तुसां रे मन तिस सिधाई ते पवित्रता, जिस कने तुसां जो मसीह यीशु रा आदरमान करणा चाएदा, कुदखी भ्रष्ट नी कित्ते जान।"
"2CO","11","4","अगर कोई तुसी का आई करी यीशु रे बारे बिच गलत ही प्रचार करो, जे असां रे प्रचार का बखरा हो, या जे पवित्रात्मा तुसी जो पैल्ले का मिल्ले रा है, तिसेरे अलावा होर कोई आत्‍मा तुसी जो मिलदा, या जां तुसी कुसकी होर संदेश जो अपणाई लिंदे जे असां रे सुणाए रे संदेश का बखरा है, तां तुसी तिसजो अपनाणे बिच गलत हिन।"
"2CO","11","5","मै नी समझदा कि से झुठी शिक्षा दैणे वाले लोक, जे अप्पु जो बड़े बड्डे प्रेरित समझदे, मेरे का जादा बदिया हिन।"
"2CO","11","6","भले ही मै बोल-चाल अन्दर अनाड़ी है, पर मेरे जो ज्ञान री कमी नी है; बल्कि मै तुसी जो हर बेल्ले ते हर तरिक्के री हालात बिच शिक्षा दैणे रे जरिये इस गल्ल जो साबित कित्ते रा है।"
"2CO","11","7","मै तुसी जो सम्मान दैणे तांइ अप्पु जो दीन-हीन बणाई करी ते कुसकी का बगैर किच्‍छ लित्ते, तुसी लोक्कां बिच परमेश्‍वर रे शुभ संदेश रा प्रचार कित्तेया। इस गल्ल बिच मेरी कोई गलती नी है।"
"2CO","11","8","मेरे जो होर कलीसियां रे विश्वासियां का आर्थिक मदद मिल्ली ताकी मै तुसी बिच सेवा करी सकां। तुसी इय्यां नी बोल्ली सकदे से करणा गलत थिया।"
"2CO","11","9","ते जिस बेल्ले मै तुसी कने थिया ते मेरे जो पैसे री कमी होई, तां मै कुसकी पर भार नी पाया, किजोकी विश्वासी भ्यालां ने मकिदुनिया प्रदेश का आई करी मेरे कमी जो पूरा कित्तेया, ते मै हर गल्ल बिच अप्पु जो तुसी पर भार बनणे का रोक्केया, ते तिय्यां ही रोक्की रैह्णा।"
"2CO","11","10","जिस सच्चाई कने मै तुसी जो मसीह रे बारे बिच दसदा तिय्यां ही मै तुसी जो बोलदा कि अखाया प्रदेश बिच का कुसकी ने भी मेरे जो इस गल्ल पर गर्व करणे का रोक्की नी सकणा, कि मै कदी तिन्हा बिच का कुसकी का आर्थिक मदद नी लित्ती।"
"2CO","11","11","मै किजो कदी पैसे नी लित्ते? क्‍या इधेरे तांइ तुसी का दान नी लित्ता कि मै तुसी कने प्यार नी रखदा? पर परमेश्‍वर ए जाणदे कि मै तुसी कने प्यार रखदा।"
"2CO","11","12","पर मै तुसी का कदी दान नी लैणा, ताकी दुज्जेयां जो इस गल्ल बिच घमंड करणे रा मौक्का ना मिल्ले कि तिन्हा ने भी तिस्सी तरिक्के कने सेवा करदे जिय्यां असी करदे।"
"2CO","11","13","इदेय लोक झुठ्ठे प्रेरित हिन। से लोक प्रेरितां रे भेस बिच ठग्गि रे कम्म करणे वाले मणु हिन।"
"2CO","11","14","पर ए कोई हैरानी वाली गल्ल नी है! किजोकी शैतान ता अप्पु भी परमेश्‍वर रे स्वर्गदूत रे भेस बिच रैहन्दा।"
"2CO","11","15","इधेरे तांइ इस गल्ल बिच कोई हैरानी नी है कि शैतान रे दास भी परमेश्‍वर री सेवा करणे वालेयां रे भेस बिच आंदे। तिन्हेरे कम्मां रे हिसाब कने तिन्हेरा खातमा होई जाणा।"
"2CO","11","16","मै फिरी बोलदा कि कोई ए मत समझो कि मै बेवकुफ है, पर भले ही तुसी इय्यां सोचदे भी हुंगे, ते जां मै इय्यां घमंड भी करां, तां मेरे जो इक्क बेवकुफ समझी करी ही मेरी गल्लां जो सुणी लेया करो।"
"2CO","11","17","पर मेरा इय्यां बेधड़क होई करी गल्ल करणा परमेश्‍वर रे पास्से का नी है, पर मै इक्क बेवकुफ मणु सांइ गल्ल करेया करदा है।"
"2CO","11","18","हालांकी जिय्यां मते लोक इस दुनिया रे लोक्कां सांइ घमंड करदे, तिय्यां ही मै भी घमंड करदा।"
"2CO","11","19","तुसी अप्पु जो समझदार समझी करी, खुशी-खुशी बेवकूफ मणुआं री गल्लां सही लिन्दे।"
"2CO","11","20","किजोकी जां तुसी जो कोई नौक्कर बणाई लिन्दा, या लुट्टी लिंदा, या फसाई लिन्दा, या अप्पु जो बड्डा समझदा, या तुसी रे मुँह पर चंड मारदा, तां तुसी सही लिन्दे।"
"2CO","11","21","असां जो तुसी कने तिय्यां बर्ताव करणे री हिम्मत नी होई, किजोकी तिय्यां करणे बिच मेरे जो बड़ी शर्मिंदगी हुंदी। पर जे अगर कोई मणु कुसकी गल्ल बिच घमंड करणे री हिम्मत करदा, तां मै भी इक्क बेवकुफ मणु सांइ बोलदा, कि मै तिस गल्ल बिच घमंड करणे री जादा हिम्मत रखदा।"
"2CO","11","22","क्‍या से इब्रानी मणु हिन? मै भी इब्रानी मणु है। क्‍या से इस्राएली मणु हिन? मै भी इस्राएली मणु है। क्‍या से अब्राहम रे वंश रे हिन? मै भी अब्राहम रे वंश रा है।"
"2CO","11","23","क्‍या से ही मसीह यीशु री सेवा करणे वाले लोक हिन? मै बोलदा कि मै तिन्हा का बधी करी है! मै पागल मणु सांइ बोलदा कि मै तिन्हा का जादा मेहनत कित्ते री है, मै तिन्हा का जादा कैद होए रा है, मै तिन्हा का जादा कोड़े खाए, ते मै तिन्हा का जादा मौत रे खतरे बिच पये रा है।"
"2CO","11","24","यहुदी अधिकारियां ने मेरे जो पांज बारी उन्ताली-उन्ताली कोड़े लगवाये।"
"2CO","11","25","त्रै बारी मेरे जो डंडे कने कुट्टेया गेया। इक्क बारी मेरे जो बट्टे मारे गे। त्रै बारी ता जिन्हा जहाज पर मै सफर कित्तेया थिया, से टुटी गे। इक्क बारी ता पुरा दिन ते रात ता मै समुन्द्र बिच ही कट्टी।"
"2CO","11","26","मै घड़ी-घड़ी यात्रा अन्दर दरिया रे जोखिमां अन्दर, ड़ाकुआं रे जोखिमां अन्दर, अपणी जात वाले मणुआं रे जोखिमां अन्दर, गैर यहुदियां रे जोखिमां अन्दर, शहरां रे जोखिमां, अन्दर बणां रे जोखिमां अन्दर, समुन्दर रे जोखिमां अन्दर, झूठे विश्वासियां रे मझाटे जोखिमां अन्दर रेया।"
"2CO","11","27","मेहनत ते दुख अन्दर, घड़ी-घड़ी जागदे रैह्णे बिच ते भुख्ख-प्यास बिच भी रेया ते सर्दी बिच बगैर निग्गे कपड़े रे भी रेया।"
"2CO","11","28","इन्हा गल्लां रा ता मै जिकर नी करदा, पर इन्हेरे अलावा सबणी कलीसिया री फिकर रोज मेरे जो खाया करदी है।"
"2CO","11","29","जां कोई विश्वासी भ्याल कमजोर महसूस करदा, तां मै भी कमजोर महसूस करदा। जां कोई मणु पाप री जिन्दगी बिच फिरी हटी जांदा, तां मेरे जो बड़ा दुख हुंदा।"
"2CO","11","30","अगर घमंड करणा जरूरी है, तां मै अपणी कमजोरी री गल्लां पर घमंड करणा।"
"2CO","11","31","परमेश्‍वर, असां रे प्रभु यीशु मसीह रे पिता, हमेशा धन्न हिन, ते से जाणदे कि मै झूठ नी बोलदा।"
"2CO","11","32","दमिश्क शहर बिच, अरितास राज्जे रे राज्यपाल ने मेरे जो पकड़णे तांइ दमिश्क शहर पर पैहरा बिठाई रख्खे रा थिया,"
"2CO","11","33","पर मेरे जो टोकरे बिच खिड़की रे रस्ते का शहर री दुआल का उतारेया गेया, ते तिस हाकिम रे हत्थां का बची निकलेया।"
"2CO","12","1","हालांकी मेरे तांइ घमंड करणा फायदेमंद ता नी है, पर मेरे जो घमंड करणा पैंदा। पर अवे मै परमेश्‍वर रे पास्से का मिल्ले रे दर्शनां ते दस्से री गल्लां रे बारे बिच चर्चा करणी।"
"2CO","12","2","मै मसीह यीशु बिच विश्वास करणे वाले इक्क मणु जो जाणदा जिस जो चौदह साल पैल्ले स्वर्ग तीकर चुक्की लित्तेया गेया थिया। मै ए नी जाणदा कि से मणु अपणे शरीर बिच ही थिया जां ए होया, पर सिर्फ परमेश्‍वर ही जाणदे।"
"2CO","12","3","मै फिरी दोहरांदा, मै जाणदा कि से मणु स्वर्ग पर चुक्की लित्तेया गेया थिया। फिरी, मै नी जाणदा पर सिर्फ परमेश्‍वर ही जाणदे कि से मणु अपणे शरीर बिच थिया या नी।"
"2CO","12","4","से स्वर्ग लोक जो चुक्की लित्तेया गेया, ते इदेय गल्लां सुणी, जिन्हा जो बोलणा ठीक नी ते इदेइ कुसकी होर मणु जो दसणे री इजाज़त नी है।"
"2CO","12","5","इदेय मणु पर तां मै गर्व करणा, पर अप्पु पर अपणी कमजोरियां जो छड्डी करी, अपणी होर कुसकी गल्ल रे बारे बिच गर्व नी करणा।"
"2CO","12","6","किजोकी जे अगर मै गर्व करणा चां, तां भी मै बेवकूफ नी ठैहरणा, किजोकी मै ता सच बोलणा, पर तां भी मै गर्व करणे का बचदा, कुते इय्यां ना हो कि जिय्यां कोई मेरे जो दिखदा या मेरे का सुणदा हो, ते मेरे जो तिन्हा गल्लां का बधी करी समझो।"
"2CO","12","7","मेरे शरीर बिच इक्क बड़ी भारी पीड़ कुसकी कंडे सांइ लग्गे री है, ते शैतान रा इक्क दूत मेरे जो तड़पांदा रैहन्दा, ताकी मै परमेश्‍वर का मिल्ले रे बड़े सारे प्रकाशन पाणे री वजह कने घमंडी ना बणी जां।"
"2CO","12","8","इसेरे बारे बिच मै प्रभु का त्रै बारी छन्दे कित्ते कि मेरे का ए दूर होई जाओ।"
"2CO","12","9","पर तिन्हा ने मेरे जो बोल्लेया, मेरा अनुग्रह तेरे तांइ मता है। इधेरे तांइ अवे मै कमजोरियां पर गर्व करणे तांइ खुश है ताकी मसीह यीशु मेरे जो अपणी ताकत दिंदे रे।"
"2CO","12","10","इधेरे तांइ मै मसीह यीशु जी तांइ कमजोरियाँ अन्दर, ते निन्दा होणे अन्दर, ते दरिद्रता अन्दर, ते जुल्मां अन्दर अते बुरे समय अंदर भी खुश है, किजोकी जां मै कमजोर हुन्दा, तां मसीह मेरे जो ताकत दिंदे।"
"2CO","12","11","मै इक्क बेवकूफ मणु सांइ ता बणेया, पर तुसी ने ही मेरे जो ए करणे पर मजबूर कित्तेया, तुसी जो तां मेरी तारीफ करणी चाएदी थी, हालांकि मै किच्‍छ भी नी है, तां भी तिन्हा प्रेरितां का जादा बदिया ही है जे अप्पु जो बड़ा बड्डा समझदे।"
"2CO","12","12","जां मै तुसी कने थिया, तां मै तुसी रे सामणे इस गल्ल जो साबित कित्तेया थिया कि मै मसीह यीशु रा सच्चा प्रेरित है। किजोकी मै बड़े सबर कने तुसी बिच चिन्ह-चमत्कार कित्ते।"
"2CO","12","13","मै तुसी कने बस इक्क चीज नी कित्ती जे मै दुज्जे कलीसियां रे लोक्कां कने कित्ती, कि मै तुसी पर आर्थिक तौर पर बोझ नी बणेया, तुसी जो अगर ए लगदा कि मै इय्यां करी के तुसी कने किच्‍छ गलत कित्ते रा है, तां मेरे जो माफ करी देयो।"
"2CO","12","14","अवे मै तिज्जी बारी तुसी का आणे जो तयार है, ते मै तुसी पर कोई बोझ नी बनणा, किजोकी मेरे जो तुसी री धन-दौलत नी चाएदी, पर मेरे जो तुसी चाएदे। किजोकी बच्चेयां जो अपणे माँ-प्यो तांइ धन्न नी कठेरणा चाएदे, बल्कि माँ-प्यो जो बच्चेयां तांइ धन्न कठेरणा चाएदा।"
