"MRK","8","21","तैबै यीशुऐ तिउंलै बोलौ, “का तुमै इबी झ़ांऊ भी ना सौमुझ़दै? हाऊं रोटी रै बारै दी नाईं बोला थौ पर हाऊं बोला थौ तुमुलै इणौ कि तुमै फरीसी लोगु और हेरोदेसा रै बुरै विच़ार और शिक्षा कु बौच़ियौ रौऔ।”"
"MRK","8","22","यीशु किशती कु उतरियौ आपणै च़ेलेऊ आइलै बैतसैदा गाँवा दी आशौ। तिऐ लोगुऐ एक शेड़ौ यीशु काऐ आणौ। तिंउऐ तेसकु औरज़ कौरी कि, “छ़ौंअटी, तू एस शेड़ौ आपणै हाथै छ़ूं एरी।”"
"MRK","8","23","यीशुऐ सौ शेड़ौ हाथा कु पाकड़ियौ गाँवा कु बाइरै नियौं, तेसरी आखिऊ दी थूक लाइयौ और तेस माथै हाथा छ़ाड़ियौ बोलौ, “का ताउंकै दिशदै लागौ औन्दौ?”"
"MRK","8","24","तिणिऐ उपरै देखीयौ बोलौ कि, “मुकै आदमी दिशदै ई लागै औन्दै। पर इऐ आदमी इणै दिशा ई ज़िणै च़ालदै-फिरदै पेड़ ई।”"
"MRK","8","25","यीशुऐ दुबारौ तेसरी आखिऊ माथै हाथ छ़ाड़ौ। तिणी शेड़ौ बौड़ै ध्याना कौरीऐ देखौ और ठीक हुऔ। तेसरी आखी आच़्छ़ै कौरीऐ देखदै लागी।"
"MRK","8","26","यीशुऐ सौ आदमी इणै बोलीयौ घौरै छ़ाड़ौ कि, “तू गाँवा दी ना डेवै।”"
"MRK","8","27","तैबै यीशु और तेसरै च़ेलै बैतसैदा छ़ाड़ियौ कैसरिया फिलिप्पी रै नीज़ुका रै गाँवा भिलै डेउंदै लागै। बाटा दी यीशुऐ आपणै च़ेलेऊ कु पुछ़ौ, “लोग मुलै का बोलाई कि ‘हाऊं कुण ऊ?’ ”"
"MRK","8","28","च़ेलेउऐ यीशु लै ज़वाब देइयौ बोलौ, “लोग तुमुलै यहुन्ना बपतिस्मौ दैणै वाल़ौ, या एलियाह, या कोई पुराणै बौगता रौ भविष्यवक्ता सौमझ़ा ई, ज़ुण मारीयौ ज़िउंदै हुऐ ई।”"
"MRK","8","29","यीशुऐ बोलौ, “तुमै का बोलाई कि हाऊं कुण ऊ?” पतरसै ज़वाब दैऔ, “तुमै मसीहा ई। ज़ुण परमेश्‍वरै ई चुनौ औन्दै।”"
"MRK","8","30","यीशुऐ तिउंकै च़ितल़ाऔ, “तुमुऐ ठीक बोलौ आ पर तुमै एज़ी बूश लोगु काऐ ना बोलेऊ।”"
"MRK","8","31","तैबै यीशु तिउंलै शिखाउंदै लागौ, “मुं आदमी रै छ़ोहरु लै इणौ ज़रूरी आ कि लोग मुं भौरी सतावा। और इणौ भी ज़रुरी आ कि यहुदी स्याणै लोग, बौड़ै याजक और यहुदी शास्त्री मेरी इज़्ज़त ना कौरा। और सै मुं ज़ुरुर झ़ांगा। तेत बासिऐ हाऊं चिजै दिनै ज़िउंदौ हुआ ऊ।”"
"MRK","8","32","एज़ी बूश यीशुऐ आपणै च़ेलेऊ कै साफ-साफ बोली। तैबै पतरसै यीशु एकी भिलै नियौं और तेसलै डांटियौ बोलौ, “तांऐ इणौ नाईं जा थौ बोलणौ।”"
"MRK","8","33","तैबै यीशुऐ पिछ़ाऊं मुड़ियौ आपणै च़ेलेऊ भिलै देखदी बारै पतरसा लै डांटियौ बोलौ, “मुकाऐ कु दूर डेऊ कैलैकि शैतान ताऊं कु इणी बूशै आ बोलाउंदै लागौ औन्दौ। तेरी सोच़-विच़ार परमेश्‍वरा ज़िणी नाईं आ, पर लोगु ज़िणी आ।”"
"MRK","8","34","यीशुऐ आपणै च़ेलै और दुजै लोग आपु काऐ औटाइयौ बोलौ, “ज़ुण भी मैरौ च़ेलौ बौणनौ च़ाहा लौ, सेऊ आपणी इच़्छ़ा छ़ाड़ा लौ, आपणौ क्रूस च़ुंगा लौ, और मुं पिछ़ु आशा लौ। (मतलब कि निन्दा और दु:ख सहन कौरालौ, और आपणै प्राणा दैणा लै भी त्यार रौआ।) तैबै पा बौणा सौ मैरौ च़ेलौ।"
"MRK","8","35","कैलैकि ज़ो आपणौ प्राण बौच़ाउणौ च़ाहा लौ तेसलै परमेश्‍वरा आइलै सौदा री ज़िन्दगी नाईं मिलदी। पर ज़ो मुकालै और मैरौ खुशी री खौबर शुणाउणै री बज़ाह कु आपणै प्राण दैणा लै तैयार औलौ, तेसलै परमेश्‍वरा आइलै सौदा री ज़िन्दगी मिला आ।"
"MRK","8","36","लोग पुरी धौतरी री खुशी पाई बौल़ा ई, पर एथरौ का फाइदौ आ आपणौ प्राण खोआलौ पोरु?"
"MRK","8","37","परमेश्‍वरा आइलै सौदा री ज़िन्दगी पाइणा लै आमै परमेश्‍वरा लै कुछ़ भी नाईं देई बौल़दै।"
"MRK","8","38","ज़ुण इऊं गान्दै काम कौरणै वाल़ेऊ, और पापी लोगु काऐ मुं आदमी रौ छ़ोहरु और मेरी शिक्षा नाईं अपणावा लौ, ता ज़ेबी हाऊं भी आपणै पवित्र प्रभु रै दूता आइलै आपणै बाबा री शाना देखाइयौ आशु लै, तैबै हाऊं भी तिऊं नाईं अपणाउंदौ।”"
"MRK","9","1","यीशुऐ इणौ भी बोलौ, “हाऊं तुमुलै सौच़्च़ौ बोलाऊ कि इदै इऊं खौड़ै लोगु मांझ़िऐ कु कुछ़ आदमी ज़ुरूर आपणी ज़िन्दगी दी देखा लै कि परमेश्‍वर शक्ति भौलौ राज़ कौरना लै आशौ आ मौरणै कु पैहलै।”"
"MRK","9","2","छ़ौ: दिना बासिऐ यीशुऐ पतरस, याकूब और यहुन्ना आपु आइलै निऐं। तैबै सै एक उंच़ी पहाड़ी माथै डेऐ। तिऐ एखुली दी तिऊं चिन च़ेलेऊ काऐ यीशु रौ रूप बौदलु औन्दौ दिशौ।"
"MRK","9","3","यीशु रै जुड़कै इणै प्याशै ज़िणै और शेतै बौणै कि इऐं धौतरी दी केज़ौ भी धोबी तिणै प्याशै ज़िणै और शेतै जुड़कै नाईं धोई बौल़दौ।"
"MRK","9","4","तिंया ताकै तिऐ यहुदी लोगु रै पुराणै ज़मानै रै दुई भविष्यवक्ता पौगड़ौ हुऐ ज़ासरै नाऊं मुसा और एलियाह थै। सै दुई थै लागै औन्दै यीशु आइलै बुशै लाइंदै।"
"MRK","9","5","तैबै पतरसै यीशु लै बोलौ, “गुरुजी एऊ केती आच़्छ़ौ आ कि आमै इदै ई, आमै चीन ताम्बु लाई, एक तुमु कालै, एक एलियाह कालै, एक मुसा कालै।”"
"MRK","9","6","पतरसा कै सौमझ़िंदै नाईं थौ लागौ औन्दौ, “कि हाऊं का बोलु” कैलैकि सै इणौ देखीयौ डौरी गौऐ थै।"
"MRK","9","7","तैबै तिऊं माथै एक बादल छ़ाऔ, तेस बादल़ा मांझ़िऐ कु परमेश्‍वरा री हाक शुणुई कि, “इयौ मैरौ प्यारौ छ़ोहरु आ। एसरी बुशै शुणौ।”"
"MRK","9","8","तैबै एकदम तिऊं च़ेलेउऐ च़ारौ तौरफा ई देखौ, ता यीशु रै सिवाऐ तिऊं आइलै कोई नाईं थौ।"
"MRK","9","9","ज़ैबै सै पहाड़ी कु तौल़ै थै लागै औन्दै आशदै, तेबी यीशुऐ आपणै च़ेलेउलै हुकम दैऔ कि, “ज़ो तुमुऐ देखौ आ, तेथरै बारै दी लोगु काऐ तेबी झ़ांऊ कुछ़ ना बोलेऊ ज़ेबी झ़ांऊ हाऊं, ज़ुण परमेश्‍वरा री तौरफा कु भेज़ौ औन्दौ ऊ, मौरीयौ ज़िउंदौ ना हुउलौ।”"
"MRK","9","10","तैबै च़ेलेउऐ इऐ बूश आपणै ज़िवा दी छ़ाड़ी, और आपु मांझ़िऐ चौपड़िंदै लागै कि मौरीयौ ज़िउंदौ हुणै रौ का मतलब हौलौ।"
"MRK","9","11","तैबै तिंउऐ यीशु कु पुछ़ौ, “यहुदी रै शास्त्री लोग बोलाई कि एलियाह भविष्यवक्ता रौ मसीह कु पैहलै आशणौ ज़ुरुरी आ। सै इणौ कैलै बोलाई?”"
"MRK","9","12-13","यीशुऐ ज़वाब दैऔ, “इणौ सौच़्च़ौ आ कि एलियाह गुरु पैहलै आशौ आ और मसीहा लै बाट तैयार कौरा आ। हाऊं ज़ुण आदमी रौ छ़ोहरु ऊ, तुमुलै बोलाऊ, यहुन्ना बपतिस्मौ दैणै वाल़ौ एलियाह री ज़ागाह दी मुकु पैहलै आशी गौ आ। लोगुऐ आपणी मौरज़ी कौरीऐ सेऊ सौताऔ ज़िणौ तेसरै बारै दी लिखौ औन्दौ थौ। ऐबै तुमै सुंच़ौ कि मैरै बारै दी भी, ज़ुण परमेश्‍वरा री तौरफा कु आ भेज़ौ औन्दौ, धौर्म शास्त्रा दी इणौ लिखौ औन्दौ कि लोग मुलै भौरी दु:ख दिआई, नफरत कौरा ई, मुं नाईं मानदै।”"
"MRK","9","14","ज़ेबी यीशु और चिन च़ेलै बाकी च़ेलेउ काऐ पौउंच़ै, तैबै तिंउऐ देखौ कि तिऐ एक बौड़ी भिड़ै सै बाकी च़ेलै घेरै औन्दै थै और यहुदी शास्त्री थै लागै औन्दै तिऊं आइलै बैहंस कौरदै।"
"MRK","9","15","खरकच़ार सारै लोग यीशु देखीयौ हैरान हुऐ। तैबै दूड़िऔ तिंउऐ यीशु काऐ आशीयौ तेसरौ स्वागत कियौ।"
"MRK","9","16","यीशुऐ तिऊंकु पुछ़ौ, “तुमै मैरै च़ेलेउ आइलै का थै लागै औन्दै बैहंस कौरदै?”"
"MRK","9","17","तैबै भीड़ा मांझ़िऐ कु एक आदमीऐ ज़वाब दैऔ, “गुरुजी! मुंइऐ आपणौ छ़ोहरु थौ इदै आणौ औन्दौ। कैलैकि मैरै छ़ोहरु दी एक बुरी आत्मा सा ज़ुणिऐ एऊ ज़बाना रौ लाटौ चाणी गौ आ।"
"MRK","9","18","ज़िऐ किऐ एस बुरी आत्मा पाकड़ा सा, तिऐ बुरी आत्मा एस धौनी लोटाल़ा। और एसरै मुआंदी निकल़ा ई शेफै। आपु लागा दांदु कुट-कुटाउंदै। तैबै बौणा डौकडौकौ। मुंइऐ तुमारै च़ेलेउलै बोलौ, ‘एस मांऊ कु बुरी आत्मा पोरु गाड़ौ’ पर इउंकै नाईं गाड़ुई।”"
"MRK","9","19","इणौ सब शुणियौ यीशुऐ ज़वाब दैऔ, “का कौरुलै। तुमुकै मुं माथै इबी झ़ांऊ विश्वास नाईं आ? हाऊं केभी झ़ांऊ रौआऊ तुमु आइलै? तुमारौ एस अविश्वास किणै कौरीऐ कौरु सहन? एस छ़ोहरु मुकाऐ आणौ।”"
"MRK","9","20","तैबै लोगुऐ सेऊ छ़ोहरु यीशु काऐ आणौ। ज़ैबै बुरी आत्मै यीशु देखौ, खरकच़ार बुरी आत्मै छ़ोहरु बांथ रौंगा रौ मेकिऔ धौनी लोटाल़ौ। तेसरै मूंआ कु शेफै निकल़ी और सेऊ माटै मांझ़ी लागौ खोरोल़िंदै।"
"MRK","9","21","यीशुऐ तेस छ़ोहरु रै बाबा कु पुछ़ौ, “एसरी हालत केभी ओउलै इणी?” तिणीऐ बोलौ, “लोल़डी ओउलै आ।"
"MRK","9","22","एती नाईं बल्कि बुरी आत्मा एस झ़ांगणा लै केभी टाला आगी मांझ़िऐ, केभी टाला पाणी मांझ़िऐ। तुमै कौरी बौल़ा ई ता दया कौरीऐ आमारी मज़द कौरौ एरी।”"
"MRK","9","23","यीशुऐ तेसलै बोलौ, “ताइंऐ का बोलौ कि, ‘तुमै कौरी बौल़ा ई ता?’ शुण! ज़ुण मुं माथै विश्वास कौरा आ तेसलै हाऊं सारौ-कुछ़ कौराऊ।”"
"MRK","9","24","खरकच़ार तेस छ़ोहरु रै बाबै ज़ोरै बोलौ, “मुकै दख ज़ेई विश्वास आ। मैरौ विश्वास बौढ़ाऔ एरी।”"
"MRK","9","25","ज़ैबै यीशुऐ देखौ कि भीड़ बौड़दै सा लागी औन्दी तैबै तिणीऐ तिऐं बुरी आत्मा लै डांटियौ बोलौ, “ओ लाटौ-टौणौ कौरणै वाल़ी बुरी आत्मा! हाऊं ताउंलै हुकम दिआउ, एस छ़ोहरु भितै कु पोरु निकुल़! ऐबै केभी ना आशै एस छ़ोहरु दी।”"
"MRK","9","26","तैबै सै बुरी आत्मा ज़ोरै राड़ै मारीयौ छ़ोहरु भितरा कु निकल़ी। और सेऊ छ़ोहरु मौरौ औन्दौ ज़िणौ बौणौ। कई लोग ता इणौ लागै बोलदै, “एऊ गौ मौरी।”"
"MRK","9","27","पर यीशुऐ तेस छ़ोहरु रौ हाथ पाकड़ौ और सेऊ खौड़ी उठाऔ। सेऊ छ़ोहरु खौड़ी उठौ और बिल्कुल ठीक हुऔ।"
"MRK","9","28","यीशु और तेसरै च़ेलै ज़ेबी घौरा भितै एखुलै दी थै, तैबै च़ेलेउऐ यीशु कु पुछ़ौ, “आमुकै सै बुरी आत्मा कैलै ना गाड़ुई?”"
"MRK","9","29","यीशुऐ ज़वाब दैऔ, “इणै रौंगा री बुरी आत्मा प्राथना और ब्रौता कौरी गाड़िया सा। कैलैकि एज़ी आत्मा गाड़नै रौ दुजौ तरीकौ कुछ़ नाईं।”"
"MRK","9","30","यीशु और तेसरै च़ेलै तिऐं ज़ागाह छ़ाड़िऔ गलील परदेशा दी बाटीऐ लागै औन्दै डेउंदै। यीशु नाईं च़ाहा थौ कि कासी कै भी पौतौ लागा कि सै कियै ई डेऊंदै लागै औन्दै,"
"MRK","9","31","कैलैकि सेऊ एखुलै दी आपणै च़ेलेउलै शिक्षा दैणौ च़ाहा थौ। यीशुऐ च़ेलेउलै बोलौ, “आदमी रौ छ़ोहरु, लोगु रै हाथै पकड़वाइणौ आ, सै मुं झ़ांगाई, पर मौरियौ हाऊं च़िज़ै दिना दी तौंइऐ ज़िउंदौ हुआ ऊ।”"
"MRK","9","32","च़ेलै यीशु री एज़ी बूश सौमझु़दै नाईं थै लागै औन्दै। सै यीशु कु एज़ै बारै दी पुछ़णा लै डौरा थै।"
"MRK","9","33","यीशु तौंइऐ आपणै च़ेलेउ आइलै कफरनहूम गांउ दी आशौ। घौरा भितै डेइऔ यीशुऐ आपणै च़ेलेउ कु पुछ़ौ, “तुमै बाटा दी केथरै बारै दी थै चौपड़िंदै लागै औन्दै?”"
"MRK","9","34","सै च़ेलै शौरमा रै मारै च़ुटुक थाकै। कैलैकि सै बाटा दी इणौ थै लागै औन्दै चौपड़िंदै, “आमु मांझ़िया कु सारेउ कु बौड़ौ कुण आ?”"
"MRK","9","35","तैबै यीशुऐ बोशियौ सै बारह च़ेलै आपु काऐ औटाइयौ बोलौ, “तुमु मांझ़िआ कु कुण च़ाहा बौड़ौ बौणनौ, सेऊ सारेउ कु छ़ोटौ और सारेउ रौ सेवादार बौणा लौ।” (सेज़ौ आदमी परमेश्‍वरा री नौज़री दी सारेउ कु बौड़ौ हुआ सा।)"
"MRK","9","36","तैबै तिणीऐ एक मांऊ तिऊं च़ेलेउ काऐ आणौ। सेज़ौ मांऊ यीशुऐ आपणी उंगाल़ी ऐ च़ुंगौ और च़ेलेउलै बोलौ,"
"MRK","9","37","“केज़ौ भी आदमी ज़ुण मुं आइलै प्यार कौरा सा, कास छ़ोटौ मांऊ अपणावा लौ तैबै सौमझ़ौ कि सेऊ मुं आ लागौ औन्दौ अपणाऊ दै। ज़ेज़ौ मुं अपणावा लौ, सेज़ौ आदमी परमेश्‍वर अपणावा सा, ज़ुणिऐ हाऊं भेज़ौ औन्दौ।”"
"MRK","9","38","तैबै यहुन्ना नावां रै च़ेलै ऐ यीशु लै बोलौ, “गुरुजी, आमुऐ एक आदमी देखौ आ ज़ुण तुमारै नाऊं कौरी बुरी आत्मा थौ लागौ औन्दौ गाड़दै। आमुऐ कौरी तेसलै मौना, कैलैकि सेऊ तुमारै च़ुनै औन्दै च़ेलेउ मांझ़िआ रौ नाईं थौ।”"
"MRK","9","39","यीशुऐ बोलौ, “तेस आदमी लै मौना ना कौरौ। कैलैकि कि ज़ुण मैरै नाऊं कौरीऐ हैरानी वाल़ै काम कौरा आ, सेऊ फेटी मुलै बुरौ नाईं बोलदौ।"
"MRK","9","40","ज़ुण आमारै विरोधा ई नाईं आ सै आमारै तौरफा ई।"
"MRK","9","41","इणौ सौच़्च़ौ आ कि ज़ेज़ौ आदमी तुमु मैरै च़ेलै ज़ाणीऔ एक ग्लास पाणी पिलावा लौ तैबै परमेश्‍वर तेसलै ज़ुरुर इनाम दिआ आ।”"
"MRK","9","42","यीशुऐ इणौ भी बोलौ, “मुं माथै विश्वास छ़ाड़नै वाल़ौ, च़ाऊ सेऊ छ़ोहरु औलौ, केज़ौ भी आदमी तेस पापा री बाटा दी नीईंयौ तेस विश्वासा दी डगमगावा लौ, ता परमेश्‍वर तेसलै ज़ुरुर सौज़ा दिआ आ। इणै आदमी लै परमेश्‍वरा री सौज़ा मिलणै कु आच़्छ़ौ थौ कि तेसरै गौल़ै दी घौरटा रौ ज़ौंदर बानिऔ तेस गैहरी झ़िला दी डुबावा।"
"MRK","9","43","अगर तू आपणै हाथै इणौ काम कौरालौ, ज़ो ताऊं पापा री बाटा दी नीईंयौ विश्वासा दी डगमगावा लौ, तैबै ताऊं लै आच़्छ़ौ आ कि तेस हाथ पोरु काटै। आच़्छ़ौ आ कि टुंडै रौइयौ सौरगा दी डिआ, एथकु कि दुई हाथा कौरी नौरका दी डिया लौ,"
"MRK","9","44","‘ज़िऐ आदमी दी किड़ै लागा ई ज़ो केबी ना मौरदै, और तिदली आग केभी ना इशदी।’"
"MRK","9","45","अगर तैरौ बांगणौ ताऊं बुरी बाटा दी नियां लौ ता ताऊं लै आच़्छ़ौ आ कि तेस बांगणौ पोरु काटै। आच़्छ़ौ आ कि लौंगड़ै रौइयौ सौरगा दी डिआ, एथकु कि दुई बांगणै कौरी नौरका दी डिया,"
"MRK","9","46","‘ज़िऐ आदमी दी किड़ै लागा ई ज़ो केबी ना मौरदै, और तिदली आग केभी ना इशदी।’"
