Book, Chapter, Verse, Text
"MRK","1","1","एज़ी खुशी री खौबर यीशु मसीहा रै बारै दी आ, ज़ुण परमेश्‍वरा रौ छ़ोहरु आ। एज़ी खुशी री खौबर इणी शुरु हुई।"
"MRK","1","2","ज़िणौ भविष्यवक्ता री किताबी दी आ लिखौ औन्दौ कि परमेश्‍वरै आपणै छ़ोहरु लै इणौ बोलौ आ कि, “शुण! हाऊं ताऊं कु औगाड़िऐ आपणौ एक दूत भेज़ाऊ। सेऊ ताऊं कालै बाट त्यार कौरा सा।”"
"MRK","1","3","यशायाह भविष्यवक्तै इणौ थौ लिखौ औन्दौ कि, “शुनशान ज़ागाह दी एक आदमी री हाकै ई लागी औन्दी शुणिदै, ‘प्रभु कालै आशणा लै बाट त्यार कौरौ, ज़ो बिल्कुल साफ और सिधी आ।’ ”"
"MRK","1","4","तिऐं भविष्यवाणी पुरी कौरीयौ एक आदमी आशौ ज़ासरौ नाऊं यहुन्ना थौ। सेऊ यरदन नौईं पारभिलै बंज़र ज़मीना दी आशौ। और परचार कौरदै लागौ कि, “सारै लोग आपणै-आपणै पापा कु माफी पाइणा लै बुरै कामा कु मन बौदल़ौ और बपतिस्मौ निऔं।”"
"MRK","1","5","सारै यहुदा परदेशा रै लोग और यरुशलेम शहरा दी रौइणै वाल़ै सारै लोग यहुन्ना काऐ आशै, और आपणै-आपणै पाप मानियौ यरदन नौईं दी यहुन्ना कु बपतिस्मौ नियौं।"
"MRK","1","6","यहुन्ना ऊंटा रै बाल़ा रै चाणै औन्दै जुड़कै भिड़ा थौ, और कमरा दी भिड़ा थौ च़ामड़ा री गाची। यहुन्ना सिरफ थाड़ै और बौणा री माक्खी रौ मौ खा थौ।"
"MRK","1","7","यहुन्ना बोला थौ, “मुं बासिऐ ज़ुण आशणै वाल़ौ आ, ज़ो मुकु ज़ादौ शक्ति वाल़ौ आ। हाऊं ता एस लायक भी नाईं कि धौनी झ़ुकियौ तेसरै बुटा रै तौसमै खोलु।"
"MRK","1","8","हाऊं दिआऊ तुमुलै पाणी कौरीऐ बपतिस्मौ, पर सेऊ दिया तुमुलै पवित्र आत्मा कौरी बपतिस्मौ।”"
"MRK","1","9","सेज़ै बौगतै यीशु गलील परदेशा रै नासरत गाँवा कु आशीयौ यरदन नौईं काऐ डैऔ। तिऐ यहुन्ना लोगु लै बपतिस्मौ दैंदै थौ लागौ औन्दै। यीशुऐ भी यहुन्ना काऐ डेइयौ बपतिस्मौ निऔं।"
"MRK","1","10","ज़िणी ई यीशु पाणी मांझ़िआ कु खौड़ौ उठौ तिणी ई यीशुऐ सौरग दुई भिलै च़ीरिंदै देखौ और आपु माथै पवित्र आत्मा कबुतरा ज़िणौ उतुरदै देखी।"
"MRK","1","11","और सौरगा कु परमेश्‍वरा री हाक शुणुई कि, “तू मैरौ प्यारौ छ़ोहरु ई। हाऊं ताऊं देखीयौ भौरी खुश ऊ।”"
"MRK","1","12","खरकच़ार पवित्र आत्मै यीशु शुनशान ज़ागाह दी नियौं।"
"MRK","1","13","तिऐ यीशु खतरनाक छ़ोटै-छ़ोटै ज़ीव-जन्तु मांझ़िऐ चालिस दिना झ़ांऊ रौऔ। तिऐ शैतानै यीशु बुशु शुणाइयौ फसाउणौं और परखुणौ च़ाऔ, पर यीशुऐ तेसरी एक बूश भी नाईं मानी। तैबै प्रभु रै दूत सौरगा कु आशीयौ यीशु री सेवा कौरदै लागौ।"
"MRK","1","14","दख बौगतै बासिऐ राज़ै हेरोदेस अंतिपासै यहुन्ना पाकड़ियौ ज़ेला दी टाल़ौ, तैबै यीशु गलील परदेशा दी आशीयौ, परमेश्‍वरा री खुशी री खौबर शुणाउंदै लागौ।"
"MRK","1","15","यीशुऐ बोलौ, “बौगत पुरौ हुऔ परमेश्‍वरा रौ राज़ नज़दीक आशी गौ आ। आबै आपणै मन बौदल़ौ, और इंऐ खुशी री खौबरी माथै विश्वास कौरौ।”"
"MRK","1","16","ज़ेबी यीशु गलीला रै झ़िला रै डीका बाटीऐ थै डेउंदै लागौ औन्दै, तेबी यीशु कै शमौन और तेसरौ भाई आन्द्रियास दिशै। सै झ़ींवर थै। सै थै झ़िला दी ज़ाल़ा टाल़दै लागै औन्दै।"
"MRK","1","17","और यीशुऐ तिउंलै बोलौ, “मुं पिछ़ु आशौ। हाऊं तुमु लोगु मुं काऐ आणनै वाल़ै चाणाऊ।”"
"MRK","1","18","तैबै खरकच़ार तिऊं दुई भाईउऐ ज़ाल़ छ़ाड़ौ पोरु, आपु डेवै यीशु पीछ़ु।"
"MRK","1","19","यीशु तिदरा कु दख दूर डैऔ, तिऐ दिशै यीशु कै जबदी रै दुई छ़ोहरु याकूब और यहुन्ना। सै भी झ़ींवर थै। सै थै लागै औन्दै ज़ाल़ा गांठदै।"
"MRK","1","20","यीशुऐ सै खरकच़ार औटाऐ। तिंउऐ आपणौ बाब छ़ाड़ौ किश्ती दी मुंज़ुरदारु आइलै, और आपु डेवै यीशु पीछ़ु।"
"MRK","1","21","तेत बासिऐ यीशु आपणै च़ेलेऊ आइलै कफरनहूम गाँवा दी आशौ। तिऐ आशीयौ एक आराधनालय दी डैऔ, आरामा वाल़ै दिना दी। तिऐ शिक्षा दैंदै लागौ।"
"MRK","1","22","ज़ेती भी लोग थै तिऐ बोशै औन्दै, यीशु री शिक्षा शुणियौ सारै हैरान हुऐ। कैलैकि यीशु शिक्षा हक्क्का कौरीऐ दिया थौ। यीशु री शिक्षा यहुदी शास्त्री लोगु ज़िणी नाईं थी।"
"MRK","1","23","तिंया ताकै तिंया आराधनालय दी एक आदमी थौ, ज़ासदी बुरी आत्मा थी। तिऐं बुरी आत्मै हाकै मारीयौ बोलौ,"
"MRK","1","24","“ओ, नासरता रै यीशु! हाऊं ज़ाणाऊ कि तू कुण ई। तू परमेश्‍वरा री तौरफा कु भेज़ौ औन्दौ पवित्र ज़ौणौ ई। आमुकै ताऊं कु का काम आ? का तू आमु नाश कौरदै ई आशौ औन्दौ?”"
"MRK","1","25","यीशुऐ तिऐं बुरी आत्मा लै डांटियौ बोलौ, “च़ुटुक थाक! एस आदमी कु बाइरै निकुल़।”"
"MRK","1","26","तिऐं बुरी आत्मै सेऊ आदमी छ़ाटौ-बिछ़ांडौ और राड़ी मारीयौ, तेस आदमी छ़ाड़ियौ बाइरै निकल़ी।"
"MRK","1","27","ज़ेती भी तिऐ लोग थै सै हैरान हुऐ और आपु मांझ़िऐ चौपड़िंदै लागै कि “इऐ का बूश आ? इयौ यीशु हक्क्का कौरीऐ किणी शिक्षा दिया? इदरा झ़ांऊ कि बुरी आत्माऐं भी एसरौ हुकम पोरु माना ई।”"
"MRK","1","28","यीशु रै बारै दी खरकच़ार पुरै गलील परदेशा रै सारै मुलखा दी आगी बाशीऐ फैअली।"
"MRK","1","29","यीशु खरकच़ार आराधनालय कु निकल़ियौ याकूब और यहुन्ना आइलै शमौन और आन्द्रियासा सै घौरा दी डैऔ।"
"MRK","1","30","तिऐ शमौन री शाशु च़ाता ई बुखारा कौरीऐ भौरी बिमार थी। तिऊं घौरा रै लोगुऐ इऐ बूश खरकच़ार यीशु काऐ बोली।"
"MRK","1","31","यीशु शमौना री शाशु काऐ डैऔ, तियांरौ हाथ पाकड़ौ और सै खौड़ी उठाई। तियांरौ बुखार तेबी ठीक हुऔ। तेत बासिऐ सै तिउंरी सेवा कौरदै लागी।"
"MRK","1","32","आरामा रौ दीन खातम हुइयौ ब्याल़कै लोग बीमार और ज़ासदी बुरी आत्मा थी लागी औन्दी यीशु काऐ आणदै लागै।"
"MRK","1","33","गाँवा रै भौरी लोग शमौना रै दारा काऐ भौरुऐ।"
"MRK","1","34","यीशुऐ भौरी लोग ज़ासदी कई रौंगा री बीमारी थी लागी औन्दी च़ांगै कियै। और बुरी आत्मा ज़ासदी लागी औन्दी थी तिऊंकु सै आत्माऐं भी गाड़ी पोरु। तिणीऐ बुरी आत्माऐं लै बोलणै रौ कोई मौकौ ना दैऔ। कैलैकि बुरी आत्माऐं ज़ाणा थी कि यीशु कुण आ।"
"MRK","1","35","आगली दोउती यीशु दोत राची सुतियौ उठौ। और बाइरै निकल़ियौ एखुलै ज़ागाह दी डैऔ और तिऐ प्राथना कौरदै लागौ।"
"MRK","1","36","तैबै शमौन और तेसरै साथी यीशु लोड़दै लागै, कि सेऊ केशी डैऔ औलौ।"
"MRK","1","37","तेत बासिऐ तिउंकै यीशु मिलौ और सै तेसलै बोलदै लागै कि, “भौरी लोग ई तुमु लोड़दै लागै औन्दै।”"
"MRK","1","38","यीशुऐ तिउंलै बोलौ, “ओरु आशौ! आमै नीज़ुका रै गाँवा दी डेई। हाऊं धौतरी दी एथीलै ऊ आशौ औन्दौ कि लोगु कै परचार कौरु।”"
"MRK","1","39","तेत बासिऐ यीशु गलील परदेशा री भौरी ज़ागाह दी आराधनालय दी डेइऔ परचार कौरदै लागौ और ज़ासदी बुरी आत्मा थी तिऊंकु बुरी आत्मा गाड़दै लागौ।"
"MRK","1","40","एकी दिनै यीशु काऐ एक कोढ़ी आशौ। सौ यीशु रै बांगणै बौंधियौ औरज़ कौरदै लागौ, “अगर तुमै मुं च़ांगौ कौरणै च़ाहा लै ता च़ांगौ कौरी बौल़ा ई।”"
"MRK","1","41","यीशुऐ दया कौरीयौ आपणै हाथा बड़ाइयौ सेऊ छ़ुंऔ और तेसलै बोलौ, “हाऊं च़ाहा ऊ कि तू च़ांगौ च़ांई हुऔ।”"
"MRK","1","42","तेभी ई तेसरौ कोढ़ दूर हुऔ और सेऊ च़ांगौ हुऔ।"
"MRK","1","43","यीशुऐ सेऊ सख्ता ई कौरीऐ बोलीऔ भेज़ौ,"
"MRK","1","44","“इऐं बूश कासी काऐ ना बोलै। तू सिधौ याजका काऐ डेऊ। परमेश्‍वरा रै आपणै सेवक मुसा रै ज़ौरिऐ ज़ेज़ै नियम ई दैऔ औन्दै तिऊं अपणाईयौ बौल़ी च़ौड़ाऊ ताकी सै तैरै बारै दी लोगु काऐ बोला कि तू च़ांगौ और शुद्ध हुई गौ आ।”"
"MRK","1","45","पर सेज़ौ आदमी लोगु काऐ डेइऔ इऐं बुशा फैलाउंदै लागौ कि, “यीशुऐ हाऊं च़ांगौ कियौ ऊ।” एज़ै कारण यीशु कै गांव-गाँवा दी नाईं डेउवौ। तैबै यीशु बंज़र ज़मीना दी रौउंदै लागौ। तेती माथै भी लोग गांव-गाँवा कु यीशु काऐ तिऐ आशा थै।"
"MRK","2","1","कुछ़ दिना बासिऐ यीशु कफरनहूम गाँवा दी वापिस आशौ। लोगुऐ शुणौ कि यीशु एकी घौरा दी आ।"
"MRK","2","2","तैबै तिऐ एतरै लोग भौरुऐ कि दारा काऐ भी ज़ागाह नाईं थी। यीशु तिऊं काऐ परमेश्‍वरा रै वचना शुणाउंदै थौ लागौ औन्दौ।"
"MRK","2","3","तैबै तिदै च़ार आदमीउऐ च़ुंगियौ एक इणौ आदमी आणौ ज़ासकै आपणै ज़िसमा रौ केज़ौ भी आंग नाईं हिलाइया थौ।"
"MRK","2","4","भौरी लोगु री भीड़ा ई तिउंकै यीशु काऐ नाईं पउंच़ुऔ। एज़ी ताईं तिंउऐ उपरै स्वाणै पारै च़ौड़ियौ तेस घौरा रै छ़ापरा कु कुछ़ ज़ाण्दै गाड़ियौ बिस्तरै रै च़ार कुणै दी लोऊल़ी बानियौ सेज़ौ बीमार आदमी यीशु काऐ धौनी उतारौ।"
"MRK","2","5","तैबै यीशु तिऊं च़ार लोगु रौ विश्वास देखीयौ बिमार आदमी लै बोलौ, “ओ गोष्टण, तैरै पाप माफ हुई गोऐ ई।”"
"MRK","2","6","तैबै ज़ो तिऐ यहुदी शास्त्री थै बोशै औन्दै, सै आपणै मौना दी सुंच़दै लागै कि,"
"MRK","2","7","“एऊ यीशु इणौ कैलै बोला आ? इयौ परमेश्‍वरा री बुराई कौरा आ! पाप ता सिरफ परमेश्‍वर ई माफ कौरा सा?”"
"MRK","2","8","यीशुऐ खरकच़ार तिउंरै मौना री बुशै ज़ाणीऔ बोलौ, “तुमै आपणै मौना दी का ई लागै औन्दै सुंच़दै?"
"MRK","2","9","आसान का सा? बीमार आदमी लै इणौ बोलणौ कि, ‘तैरै पाप माफ हुई गोऐ’ या इणौ बोलणौ कि, ‘खौड़ौ उठ, आपणौ बिस्तरौ च़ुंग और आण्डदै लाग्ग?’"
"MRK","2","10","एथीलै तुमुकै देखाउणा लै कि पाप माफ कौरणै रौ हक्क्क मुकै आ, ज़ुण परमेश्‍वरा री तौरफा कु भेज़ौ औन्दौ,” तैबै यीशुऐ तेस बीमार आदमी देखीयौ बोलौ,"
"MRK","2","11","“हाऊं ताउंलै बोलाऊ, खौड़ौ उठ, आपणौ बिस्तरौ च़ुंग और घौरै डेऊ।”"
"MRK","2","12","तैबै सेऊ आदमी खरकच़ार सारै लोगु काऐ उठौ और आपणै बिस्तरै च़ुंगियौ बाइरै डैऔ। तिऐ सारै लोग इणै देखीयौ हैरान हुऐ और इणै बोलीयौ परमेश्‍वरा री बौड़ाई कौरी, कि “इणौ आमुऐ पैहलै केभी ना देखौ।”"
"MRK","2","13","यीशु तेस घौरा कु गलील झ़िला रै डीका काऐ डैऔ। तैबै लोगु री भीड़ यीशु काऐ डेई। यीशु लागौ तिऐ तिउंलै शिक्षा दैंदै।"
"MRK","2","14","तेत बासिऐ यीशु दुजी ज़ागाह दी डैऔ। तैबै यीशुऐ हलफई रौ छ़ोहरु देखौ ज़ासरौ नाऊं लेवी थौ। सौ मामलै निणै वाल़ेउ रै आड्डै माथै थौ बोशौ औन्दौ। यीशुऐ तेसलै बोलौ, “मुं पिछ़ु आश।” तैबै सौ उठीयौ यीशु पीछ़ु लागौ आण्डदै।"
"MRK","2","15","एकी दिनै तिणी मामलै निणै वाल़ै लेवीऐ यीशु आपणै घौरा दी रोटी खांदै औटाऔ। मामलै निणै वाल़ै और पापी लोग भी बोशै रोटी खांदै कैलैकि सै यीशु पिछ़ु च़ाला थै, यीशु रै च़ेलेउ आइलै।"
"MRK","2","16","यहुदी शास्त्री ज़ासलै फरीसी भी बोला थै कैलैकि सै आपुलै धौर्मी सौमझ़ा थै, तिंउऐ देखौ कि यीशु मामलै निणै वाल़ेऊ और पापी लोगु आइलै रोटी खांदै लागौ औन्दौ। तैबै तिंउऐ यीशु रै च़ेलेउलै बोलौ, “यीशु कैलै खा सा इऊं मामलै निणै वाल़ेऊ और पापी लोगु आइलै रोटी?”"
"MRK","2","17","यीशुऐ इणै शुणियौ तिउंलै बोलौ, “भौलै-च़ांगेउ लै डाक्टरा री ज़ुरत नाईं औन्दी, पर बिमार लोगु लै डाक्टरा री ज़ुरत हुआ सा। हाऊं धौर्मी लोगु नाईं बल्कि पापी लोगु औटाउंदै ऊ आशौ औन्दौ।”"
"MRK","2","18","यहुन्ना बपतिस्मौ दैणै वाल़ै रै च़ेलै और फरीसी थै ब्रौत कौरदै लागै औन्दै। तैबै सै यीशु काऐ आशीयौ यीशु लै बोलदै लागै, “यहुन्ना रै च़ेलै और फरीसी रै च़ेलै ता कौरा ई ब्रौत। पर तुमारै च़ेलै ब्रौत नाईं कौरदै। इणौ कैलै सा?”"
"MRK","2","19","यीशुऐ तिउंलै बोलौ, “ज़ेबी झ़ांऊ लाड़ौ साथा दी हुआ, का बराती ब्रौत कौरदै लागा ई? ज़ेबी झ़ांऊ लाड़ौ बरातीउ आइलै हुआ, सै खुश हुआई। एथीलै तिउंकै ब्रौत कौरणै री कोई ज़ुरत नाईं"
"MRK","2","20","पर सेज़ै दिन आशालै, ज़ेबी लाड़ौ तिऊंकु अलग कौरालै, सेज़ै बौगता दी सै ब्रौत कौरा ई।”"
"MRK","2","21","यीशुऐ इणौ भी बोलौ, “केज़ौ भी आदमी नौऐं जुड़कै रौ टालकौ पुराणै जुड़कै दी नाईं लाइंदौ। नाईं ता धोइदीं बारै सेऊ नौऐं जुड़कै रौ टालकौ तेस पुराणौ जुड़कौ पोरु थोसियौ ज़ादड़ौ च़ीरा सा।”"
"MRK","2","22","यीशुऐ तिउंलै इणौ औनैणौ भी दैऔ, “कोई भी आदमी अंगुरा री सूर चाणना लै ताज़ै अंगुरा रौ रस पुराणै खाल़ढै दी नाईं छ़ाड़दौ। नाईं ता अंगुरा रौ रस दख बौगता बासिऐ फैलीयौ तेस पुराणौ खाल़ढौ भी पोरु च़ीरा, ज़ेथ कौरीऐ अंगुरा रौ रस और खाल़ढौ दुइया बरबाद हुआई। एथीलै ताज़ै अंगुरा रौ रस नौऐ खाल़ढै दी भौराई।”"
"MRK","2","23","इणौ हुऔ कि एकी दिनै यीशु आपणै च़ेलेऊ आइलै आरामा वाल़ै दिना दी डोखरेउ दी थौ लागौ औन्दौ डेउंदै। यीशु रै च़ेलेऊ कै थी भूख लागी औन्दी। तेस डोखरै दी थै गीऊं बौऔ औन्दै, सै च़ेलै लागै तिऊं गिऊं सै सीला चोड़ियौ खांदै।"
"MRK","2","24","तैबै फरीसीउऐ यीशु लै बोलौ, “देखौ। ज़ेज़ौ काम आरामा रै दिना दी कौरणौ मौना सा, सेज़ौ काम तुमारै च़ेलै कैलै कौरा ई?”"
"MRK","2","25","यीशुऐ तिउंलै बोलौ, “धौर्म शास्त्रा दी तुमुऐ ज़ुरुर पौढ़ौ औलौ कि ज़ेबी राज़ौ दाऊद और तेसरै साथी भुखै थै, तिउंकै खाणा लै कुछ़ भी नाईं थौ, तैबै दाऊदै का कियौ?"
"MRK","2","26","आपणी ज़ुरता लै परमेश्‍वरा रै ताम्बु दी अबियातार नावां रै परधान याजका काऐ डेइयौ और तिऐ परमेश्‍वरा लै चड़ाई औन्दी भोगा री रोटी खाई और आपणै साथीऊ लै भी देई, ज़ो सिरफ याजक ई खा थै।”"
