"1JN","4","8","ज़ो कोई दुज़ै सैंघै झ़ुरी नैंई डाहन्दा सौ परमेश्वरा बै नैंई जाणदा, किबैकि परमेश्वर झ़ुरी सा।"
"1JN","4","9","ज़ो झ़ुरी परमेश्वर आसा सैंघै डाह सा, सौ ऊँई लाईया ऐ जाहिर हुआ कि परमेश्वरै आपणा इकलौता बेटा दुनिया न भेज़ू कि आसै तेइरै ज़रियै हमेशा री ज़िन्दगी पालै ।"
"1JN","4","10","सच़ी झ़ुरी ऊँई न नैंई ऑथि कि आसै परमेश्वरा सैंघै झ़ुरी केरी, पर ऊँई न सा कि तेइयै आसा सैंघै झ़ुरी डाही होर आसरै पापै रै प्रायश्चितै री तैंईंयैं आपणा बेटा भेज़ू।"
"1JN","4","11","हे मेरै प्यारो, ज़ैबै परमेश्वरै आसा सैंघै ऐण्ढी झ़ुरी डाही कि आसाबै भी आपु न झ़ुरी डाहणी चेहिऐ।"
"1JN","4","12","पर परमेश्वर कैधी कोइयै नैंई हेरू; अगर आसै आपु न झ़ुरी डाहलै, ता परमेशवर आसा न बणीया रौहा सा होर तेइरी झ़ुरी आसा न जाहिर होआ सा।"
"1JN","4","13","तैबै आसै जाँणा सी कि आसै परमेश्वरा न बणिया रौहा सी, होर सौ आसा न; किबैकि तेइयै आपणी आत्मा आसाबै धिनी सा।"
"1JN","4","14","आसै बेटा बी हेरू सा कि होर गुआही देआ सी कि बापू परमेश्वरै बेटै बै दुनिया रै लोक रा मुक्तिदाता केरिया भेज़ू सा।"
"1JN","4","15","ज़ो कोई ऐ मना सा कि यीशु परमेश्वरा रा बेटा सा, परमेश्वर तेइन बणीया रौहा सा, होर सौ परमेश्वरा न बणीया रौहा सा।"
"1JN","4","16","ज़ो झ़ुरी परमेश्वर आसा सैंघैं डाह सा, सौ आसै जाणु सा होर आसाबै तेइरा बशाह सा। परमेश्वर झ़ुरी सा, ज़ो झ़ुरी न बणीया रौहा सा, सौ परमेश्वर न बणीया रौहा सा, होर परमेश्वर तेईन बणीया रौहा सा।"
"1JN","4","17","ऊँई सैंघै ही झ़ुरी आसा न सिद्ध हुई सा कि न्याय रै रोज़ आसाबै हौंसला हो; ज़ैण्ढा सौ सा तैण्ढै ही दुनिया न आसै भी सी।"
"1JN","4","18","झ़ुरी न डौर नैंई होन्दी, बल्कि सच़ी झ़ुरी डौरा बै दूर केरा सा; किबैकि डौरा रा नाता सज़ा सैंघै होआ सा, पर ज़ो डौरा सा सौ झ़ुरी न सिद्ध नैंई बणु ।"
"1JN","4","19","आसै ऊँईरी तैंईंयैं झ़ुरी केरा सी, कि पैहलै परमेश्वरै आसा सैंघै झ़ुरी केरी।"
"1JN","4","20","अगर कोई बोले, “हांऊँ परमेश्वरा सैंघै झ़ुरी डाह सा” पर आपणै विश्वासी भाई सैंघै दुश्मनी डाह सा सौ झूठा सा; किबैकि ज़ो आपणै विश्वासी भाई सैंघै ज़ुणियै सौ हेरू सा, झ़ुरी नैंई केरदा, ता सौ परमेश्वरा सैंघै भी ज़ुणियै सौ हेरूदा नैंई झ़ुरी नैंई डाही सकदा।"
"1JN","4","21","ज़ुणीन आसाबै ऐ हुक्म मिलीदी सा कि ज़ो कोई परमेश्वरा सैंघै झ़ुरी डाह सा सौ आपणै विश्वासी भाई सैंघै भी झ़ुरी डाहै।"
"1JN","5","1","ज़ुणिरा ऐ बशाह सा कि यीशु ही मसीह सा, ज़ो परमेश्वर बापू री औलाद सा; होर ज़ो कोई बापू परमेश्वरा सैंघै झ़ुरी डाह सा, सौ तेइरी औलादा सैंघै बी झ़ुरी डाहा सा ।"
"1JN","5","2","ज़ैबै आसै परमेश्वरा सैंघै झ़ुरी डाह सी, हौर परमेश्वरा रै हुक्मा बै मना सी, ता ऊँई न बुझा सी कि आसै परमेश्वरा रै औलादा सैंघै झ़ुरी डाह सी।"
"1JN","5","3","परमेश्वरा सैंघै झ़ुरी डाहणा ऐ सा कि आसै तेइरी हुक्म बै मनलै; होर तेइरा हुक्म मुश्किल नैंई ऑथि।"
"1JN","5","4","किबैकि ज़ो कोई परमेश्वरा री औलाद सा, सौ दुनिया पैंधै जीत पा सा; होर बशाह रै ज़रियै आसै दुनिया पैंधै जीत पा सी ।"
"1JN","5","5","दुनिया न जीत पाणु आल़ा कुण सा? मतलब सौ ज़ुणिरा ऐ बशाह सा कि यीशु, परमेश्वरा रा बेटा सा।"
"1JN","5","6","यीशु मसीह रै बारै न सोच़ा, ज़ो परमेश्वरा री तरफा न आऊ; परमेश्वरै ऐ प्रगट केरु कि परमेश्वरै यीशु मसीह सच़ीऐ भेजु, ज़ैबै यीशुऐ पाणी न बपतिस्मा लेऊ; बल्कि ज़ैबै यीशु मसीह क्रूसा पैंधै मूँआ ता तेइरै शरीरा न लोहू निकता, होर परमेश्वरा री आत्मा गुआही देआ सा कि सच़ीऐ यीशु मसीह परमेश्वरा री तरफा न आऊ ती।"
"1JN","5","7","ऐ गुआही देणु आल़ै त्राई सी,"
"1JN","5","8","आत्मा, पाणी होर लोहू; त्राऐ गैला सा ज़ुणी सैंघै ऐ पता लागा सा कि मसीहा परमेश्वरा न आऊ सा ।"
"1JN","5","9","ज़ैबै आसै मांहणु री गुआही मना सी, ता परमेश्वरा री गुआही ता तेईन बड़ी सा; होर परमेश्वरा री गुआही ऐसा कि तेइयै आपणै बेटै रै बारै न गुआही धिनी सा।"
"1JN","5","10","ज़ो परमेश्वर रै बेटै पैंधै बशाह केरा सी सौ आपु न गुआही डाह सा। ज़ुणियै परमेश्वरा पैंधै बशाह नैंई केरू तेइयै सौ झूठा ठहराऊ, किबैकि तेइयै तेसा गुआही पैंधै बशाह नैंई केरू ज़ो परमेश्वरै आपणै बेटै रै बारै न धिनीदी सा।"
"1JN","5","11","होर सौ गुआही ऐसा कि परमेश्वरै आसाबै हमेशा री ज़िन्दगी धिनी सा, होर ऐ ज़िन्दगी तेई रै बेटै न सा।"
"1JN","5","12","ज़ुणी हागै बेटा सा, तेई हागै हमेशा री ज़िन्दगी सा, होर ज़ुणी हागै परमेश्वरा रा बेटा नैंई ऑथि, तेई हागै हमेशा री ज़िन्दगी भी नैंई ऑथि।"
"1JN","5","13","यूहन्ना बोला सा, मैं तुसाबै, ज़ो परमेश्वरा रै बेटै रै नाँ पैंधै बशाह केरा सी, ऊँईरी तैंईंयैं लिखा सा कि तुसै बुझा कि हमेशा री ज़िन्दगी तुसरी सा।"
"1JN","5","14","होर परमेश्वरा रै सामनै आसाबै ऐ हौंसला होआ सा, सौ ऐ सा; कि अगर आसै तेइरी इच्छा रै मुताबक किछ़ मौंगा सी, सौ आसरी शुणा सा"
"1JN","5","15","ज़ैबै आसै बुझा सी कि ज़ो किछ़ आसै परमेश्वरा न मूँगा सी सौ आसरी शुणा सा, ता ऐ भी बुझा सी कि ज़ो किछ़ आसै तेईन मुँगु, सौ पाऊ सा।"
"1JN","5","16","अगर कोई आपणै विश्वासी भाई बै ऐण्ढा पाप केरदा हेरू ज़ुणिरा नतीज़ा मौऊत नी ऑथि, ता अर्ज़ा केरलै, होर परमेश्वर तेइबै तिन्हरी तैंईंयैं, ज़ुणियै ऐण्ढा पाप केरू सा ज़ुणिरा नतीज़ा मौऊत नी ऑथि, ज़िन्दगी देला। पाप ऐण्ढा भी होआ सा ज़ुणिरा नतीज़ा मौऊत सा; ऊँई रै बारै न हांऊँ अर्ज़ा केरनै री तैंईंयैं नैंई बोलदा।"
"1JN","5","17","सैभी तैरहै रा अधर्म ता पाप सा पर ऐण्ढा पाप भी सा ज़ुणिरा नतीज़ा मौऊत नैंई ऑथि।"
"1JN","5","18","आसै जाँणा सी कि ज़ो कोई परमेश्वरा री औलाद सा, सौ पाप नैंई केरदा; तेइबै प्रभु यीशु बच्चाईया डाह सा, होर शैतान तेइबै छुई नैंई सकदा।"
"1JN","5","19","आसै बूझा सी कि आसै परमेश्वरा री तरफा न सी, होर सारी दुनिया तेई शैताना रै वशा न सा"
"1JN","5","20","आसै ऐ जाँणा सी कि परमेश्वरा रा बेटा यीशु मसीह ऐसा दुनिया न आऊ सा होर तेइयै आसाबै समझ धिनी सा कि आसै तेई सच़ाई बै पहचाणे; होर आसै तेईन ज़ो सच़ सा, मतलब तेई रै बेटै यीशु मसीह न रौहा सी। सच़ा परमेश्वर होर हमेशा री ज़िन्दगी ऐ सा।"
"1JN","5","21","हे शोहरूओ, आपणै आपा बै तिन्हां मूर्ति न बचाईया डाहत्, ज़ो तुसरै दिला न परमेश्वरा री ज़ैगा लेआ सा।"
