Book, Chapter, Verse, Text
"1JN","1","1","हांऊँ यूहन्ना एक मांहणु रै बारै न लिखदा लागा सी। ज़ो ज़िन्दगी रा वचना ती। ज़ो शुरुआता न ती, ज़ो आसै शुणु, होर ज़ुण आसै आपणी औछ़ी सैंघै हेरू, मतलब ज़ो आसै ध्याना सैंघै हेरू; होर हौथा सैंघै छुँगु।"
"1JN","1","2","(सौ धौरती न आऊ, होर आसै सौ हेरू, होर आसै तेइरी गुआही देआ सी, होर तुसाबै तेसा हमेशा री ज़िन्दगी रै बारै न समाद देआ सी, ज़ो बापू सैंघै ती, होर आसा पैंधै प्रगट हुआ।)"
"1JN","1","3","ज़ो किछ़ आसै यीशु रै बारै न हेरू होर शुणु सा तेथा रा समाद तुसाबै भी देआ सी, ऊँईरी तैंईंयैं कि तुसै भी आसै रै सैंघी सी; होर आसरा मेल–मिलाप बापू सैंघै, होर तेई रै बेटै यीशु मसीह सैंघै सा।"
"1JN","1","4","होर ऐ गैला आसै एथा री तैंईंयैं लिखी सा, कि तुसरी खुशी पूरी होली।"
"1JN","1","5","ज़ो समाद आसै यीशु न शुणु होर तुसाबै शणा सी, सौ ऐ सा; कि परमेश्वर प्याशा सा होर तेईन किछ़ भी निहारा नी ऑथि।"
"1JN","1","6","अगर आसै बोललै, कि तेई सैंघै आसरा मेल-मिलाप सा, होर फिरी निहारै न चललै, ता तैबै आसै झ़ूठै सी; होर सच़ाई पैंधै नैंई च़लदै;"
"1JN","1","7","पर अगर ज़ैण्ढा परमेश्वर प्याशै न सा, तैण्ढाऐ आसै भी प्याशे न चललै, ता आसै एकी दुज़ै न मेल मिलाप रखा सी; होर तेइरै बेटै यीशु मसीह रा लोहू आसरै सैभ पापा बै च़ोखै केरा सी।"
"1JN","1","8","अगर आसै बोललै, कि आसै किछ़ भी पाप नेऊ केरू ता आसै आपणै आपा बै धोखा देआ सी; होर आसा न सच़ाई नी ऑथि"
"1JN","1","9","अगर आसै आपणै पापा बै मनलै ता सौ आसरै पापा बै माफ केरनै, होर आसरी सैभ बुराई न च़ोखै केरनै बै बिश्वासयोग्य होर धर्मी सा"
"1JN","1","10","अगर बोललै कि आसै पाप नी केरू ता परमेश्वरा बै झूठा ठहरा सी, होर तेइरा वचन आसा न नैंई ऑथि।"
"1JN","2","1","हे मेरै शोहरुओ, हांऊँ इन्हां गैला बै तुसरी तैंईंयैं एथै री तैंईंयैं लिखदा लागा सा कि तुसै पाप नी लोड़ी केरू होर अगर कोई पाप केरलै ता परमेश्वर बापू हागै आसरा पक्ष लेणु आल़ा एक सा, “यीशु मसीह ज़ो धर्मी सा।”"
"1JN","2","2","होर सौहै आसरै पापा रा प्रायश्चिता री बलि सा सिर्फ़ आसरै केल्ही नी बल्कि सारी दुनियै रै लोकै रै पापा रा बी।"
"1JN","2","3","आसै तेइरै हुक्मा बै मनलै ता एथा न आसा ज़ाणना कि आसै यीशु बै जाँणा सी।"
"1JN","2","4","ज़ो कोई ऐ बोला सा कि “हांऊँ तेइबै जाँणा सा” होर तेइरी हुक्म बै नी मनला सौ झ़ूठा सा होर तेईन सच़ाई नी ऑथि।"
"1JN","2","5","पर ज़ो परमेश्वरा रै वचना बै मनला, तेई पैंधै परमेश्वरा री झ़ुरी सच़ सिद्ध होआ सा एथा न ऐ पता च़ला सा कि आसै तेईन सी"
"1JN","2","6","अगर कोई बोला सा कि हांऊँ तेईन बणी रौहा सा ता तेइरी तैंईंयैं ऐ ज़रूरी सा कि आपु बी तैण्ढाऐ च़लला ज़ैण्ढा यीशु च़ला ती।"
"1JN","2","7","हे मेरै प्यारे भाइयो, हांऊँ तुसाबै कोई नोंऊँआं हुक्म नी लिखदा, पर पराणा हुक्म सा ज़ो तुसाबै शुरू न मिलू सा; ऐ पराणा हुक्म सौ वचन सा, ज़ैबै तुसै यीशु मसीह पैंधै बशाह केरू।"
"1JN","2","8","फिरी बी हांऊँ तुसाबै नोंऊँआं हुक्म लिखा सा किबैकि एथा रा सच़ मसीह न हेरूआ होर तुसा न बी; किबैकि निहारा बुराई बै रिहा सा होर प्याशा अच्छाई बै रिहा सा।"
"1JN","2","9","ज़ुण कोई ऐण्ढा बोला सा कि हांऊँ प्याशै न च़ला सा पर आपणै बिश्वासी भाई सैंघै बैर रखा सा, सौ हाज़ी तैंईंयैं निहारै न च़ला सा।"
"1JN","2","10","ज़ुण कोई आपणै भाई सैंघै झ़ुरी रखा सा सौ प्याशै न सा होर ठोकर नी खाई सकदा।"
"1JN","2","11","पर, ज़ुण आपणै भाई सैंघै बैर रखा सा, सौ निहारै न सा होर निहारै न च़ला सा होर ऐ नी ज़ाँणदा कि कौखै च़ौलू सा, किबैकि निहारै तेइरी औछ़ी कांणी केरी सी।"
"1JN","2","12","हे शोहरुओ, हांऊँ तुसाबै एथै री तैंईंयैं लिखा सा कि यीशु मसीह रै नाँ न तुसरै पाप माफ हुऐ।"
"1JN","2","13","ओ बापूओ, हांऊँ तुसाबै एथै री तैंईंयैं लिखा सा, कि ज़ो शुरू न लेइया सा तुसैई तेइबै जाँणा सी, हे ज़ुआनो हांऊँ तुसाबै एथै री तक लिखा सा, कि तुसै तेई शैताना पैंधै जय पाई सा, हे शोहरूओ, मैं तुसाबै एथै री तैंईंयैं लिखू सा कि तुसै परमेश्वर बापू बै जाँणा सी"
"1JN","2","14","ओ बापूओ, मैं तुसाबै एथै री तैंईंयैं लिखू सा कि, ज़ो शुरू न सा तुसै सौ ज़ाणू सा, हे ज़ुआनो, मैं तुसरी तक एथै री तैंईंयैं लिखू, कि तुसै मज़बूत होलै, होर परमेश्वरा रा वचन तुसा न बणी रौहला, होर तुसै तेई शैताना पैंधै जय पाई सा।"
"1JN","2","15","तुसै न ता दुनिया सैंघै होर न ही दुनिया री चीज़ा सैंघै झ़ुरी डाह, अगर कोई दुनिया न झ़ुरी डाआ सा, ता तेइन पिता परमेश्वरा री झ़ुरी नैंई ऑथि।"
"1JN","2","16","किबैकि ज़ो किछ़ दुनिया न सा, मतलब शरीरा री अभिलाषा होर औछ़ी री अभिलाषा होर कमाई रा घमण्ड, सौ पिता परमेश्वरा री तरफा न नैंई सा पर दुनिया री तरफा न सा।"
"1JN","2","17","दुनिया होर दुनिया री इच्छा सैभ दूऐ खत्म होंणी सा, पर ज़ो परमेश्वर री इच्छा पैंधै चला सा तेई हमेशा बणीया रौहणा।"
"1JN","2","18","ओ शोहरूओ, ऐ मसीह रै वापस ऐणै रा आखरी बौगत सा; होर तुसै शुणुदा सा कि मसीह रा बरोधी ऐणु आल़ा सा, तुंई रै मुताबक ऐबै भी बोहू मसीह रै बरोधी खड़ै हुऐंदे सी; ऊँई न आसा बुझणा कि ऐ आखरी बौगत सा।"
"1JN","2","19","तै मसीह बरोधी ज़ो निकतै ता आसा मौंझ़ै न, पर आसा मौंझ़ै नी ती ऑथि; किबैकि अगर आसा मौंझ़लै होलै, ता आसा सैंघै रौंहदै; पर निकतै तैबै कि ऐ जाहिर हो कि सौ सैभ आसा मौंझ़लै नी ती ऑथि।"
"1JN","2","20","पर तूसरा ता तेई पवित्र आत्मा सैंघै अभिषेक हुआ सा, होर तुसै सैभ किछ़ जाँणा सी।"
"1JN","2","21","मैं तुसाबै तैबै नैंई लिखू कि तुसै सच़ाई बै नैंई जाणदै, पर तैबै कि तुसै जाँणा सी, होर तैबै कि झूठ, सच़ा री तरफा न नैंई।"
"1JN","2","22","झूठा कुण सा? सिर्फ़ सौ ऐ ज़ुण यीशु रै मसीह होंणै रा नाँ केरा सा; होर मसीह रा बरोधी सौ ऐसा, ज़ो पिता परमेश्वर होर बेटै यीशु मसीह रा नाँ केरा सा।"
"1JN","2","23","ज़ो कोई बेटै रा नाँह केरा सा तेई हागै पिता परमेश्वर बी नैंई ज़ो बेटै बै मना सा, तेई हागै बापू परमेश्वर भी सा।"
"1JN","2","24","ज़ैबै तुसै मसीह न बशाह केरू ती, तुसै ज़ो सच़ा सन्देश शुणु सा, अगर सौ तुसा न बणीया रौहु ता तुसै भी बेटै, होर पिता परमेश्वरा न बणीया रौहणा।"
"1JN","2","25","होर ज़ुणिरा तेइयै (प्रभु यीशुऐ) आसा सैंघै वायदा केरू सा कि सौ आसाबै हमेशा री ज़िन्दगी देला ।"
"1JN","2","26","हांऊँ तुसाबै तिन्हां लोका रै बारै न चेताऊणी देआ सा कि ज़ो तुसाबै झ़ूठी शिक्षा देइआ धोखा देणै री कोशिश केरा सी।"
"1JN","2","27","होर तुसरी तैंईंयैं पवित्र आत्मा सैंघै अभिषेक केरू सा, ज़ो तुसै मसीह न पाई सा, तुसा न सा होर तैबै ऐ कोई बै जरूरत नी ऑथि कि तुसाबै सच़ाई रै बारै न शिक्षा दै, एथा रै बदलै न पवित्र आत्मा (ज़ो मसीहै तुसाबै धिनी सा) तिन्हां गैला री सच़ाई रै बारै न ज़ाणनै बै तुसरी मज़त केरला, होर ज़ो पवित्र आत्मा तुसाबै सिखा सा सौ पूरा सच़ सा, एथा न किछ़ बी झ़ुठ नी ऑथि। तैबै मसीह सैंघै बणिया रौहा, ज़ैण्ढा पवित्र आत्मै तुसाबै केरनै री तैंईंयैं बोलू सा।"
"1JN","2","28","तैबै हे शोहरूओ, तेईन बणिया रौहा ज़ैबै सौ जाहिर होला ता आसाबै हौंसला हो, होर आसै तेई रै वापस ऐणै पैंधै तेइरै सामणे शर्मिंदा न हो"
"1JN","2","29","अगर तुसै जाँणा सी कि मसीह धर्मी सा, ता ऐ भी जाँणा सी कि ज़ो कोई धर्मा रा कोम केरा सा सौ परमेश्वरा री औलाद सा।"
"1JN","3","1","हेरा, बापूऐ आसा सैंघै कैण्ढी झ़ुरी डाही कि आसै परमेश्वरा रै औलाद कहलाऐ; होर आसै सी भी ऐई बजहा दुनिया आसाबै नैंई जाणदी, किबैकि दुनिया रै लोके भी प्रभु यीशु बै नैंई जाणु।"
"1JN","3","2","हे प्यारो, ऐबै आसै परमेश्वरा रै औलाद सी, होर हाज़ी तैंईंयैं ऐ जाहिर नैंई हुआ कि आसै कि किछ़ होलै! ऐतरा जाँणा सी कि ज़ैबै प्रभु यीशु प्रकट होला ता आसै तेई सांही होंणा, किबैकि तेइबै तैण्ढाऐ हेरणा ज़ैण्ढा सौ सा।"
"1JN","3","3","होर ज़ो कोई मसीह पैंधै ऐ आशा डाआ सा, सौ आपणै आपा बै तैण्ढाऐ पबित्र केरा सा ज़ैण्ढा सौ सा।"
"1JN","3","4","ज़ो कोई पाप केरा सा, सौ बिधाना रा बरोध केरा सा; होर पाप ता बिधाना रा बरोध केरा सा।"
"1JN","3","5","तुसै जाँणा सी कि यीशु मसीह, तैबै आऊ कि आसरै पापा बै खत्म केरै; होर तेई रै ज़िन्दगी न कोई पाप नैंई ऑथि।"
"1JN","3","6","होर ज़ो कोई प्रभु यीशु न बणीया रौहा सा, सौ पाप नैंई केरदा ज़ो कोई पाप केरा सा तेइयै सौ न भाल़ुदा सा होर न तेइबै जाँणा सा।"
"1JN","3","7","प्यारे शोहरूओ, कोई रै भरमाणै न मता ऐन्दै; ज़ो धर्मा रै कोम केरा सा, सौ ऐ मसीह रै बराबर धर्मी सा ।"
"1JN","3","8","ज़ो कोई पापा रै कोम केरदा रौहा सा शैताना री तरफा न सा। परमेश्वरा रा बेटा तैबै आऊ कि शैताना रा कोम नाश केरै।"
"1JN","3","9","ज़ो कोई परमेश्वरा न पैदा हुआ सा, सौ पाप नैंई केरदा; किबैकि परमेश्वरा रा बेज़ा तेईन बणीया रौहा सा, होर सौ पाप केरी ही नैंई सकदा किबैकि सौ परमेश्वरा न पैदा हुआ सा"
"1JN","3","10","ऊँई लाईया ही आसै परमेश्वरा री औलाद होर शैताना रै औलाद बूझा सी; ज़ो कोई धर्मा रै कोम केरा सी सौ परमेश्वरा, होर ज़ुण लोका आपणै भाई सैंघै झ़ुरी डाह सी ते परमेश्वरा री धिरै न सी।"
"1JN","3","11","ज़ो समाद तुसै शुरू न शुणु सा, सौ ऐ सा कि आसै एकी दुज़ै सैंघै झ़ुरी डाहलै;"
"1JN","3","12","होर तुसै आदमा रै शोहरू कैना सांही मता बणदै, ज़ो तेई शैताना सैंघै ती, ज़ुणियै आपणा भाई मारू ती होर सौ किबै मारू? तैबै तेई रै कोम बूरै ती, होर तेई रै भाई रै कोम धर्मै रै ती।"
"1JN","3","13","हे भाइयो बैहणा, अगर दुनिया रै लोका तुसा सैंघै बैर डाहलै ता तुसै हैरान मता होंदै।"
"1JN","3","14","आसै जाँणा सी कि आसै मौऊती न पार होईया ज़िन्दगी न पुजै सी; किबैकि आसै भाई सैंघै झ़ुरी डाह सी। ज़ो झ़ुरी नैंई डांहदा सौ मौऊती री दशा न रौहा सा।"
"1JN","3","15","ज़ो कोई आपणै भाई सैंघै बैर डाह सा, सौ खूनी सा; तुसै जाँणा सी कि कोई खूनी न हमेशा री ज़िन्दगी नैंई रौंहदी ।"
"1JN","3","16","आसै झ़ुरी तैबै जाणी कि तेइयै आसरी तैंईंयैं आपणा प्राण धिना, तैबै आसाबै भी लोड़ी कि आपणै भाई री तैंईंयैं आपणा प्राण दै।"
"1JN","3","17","पर ज़ो कोई हागै दुनिया रा धन हो सौ आपणै भाई बै गरीब ज़ाणिया, तेई पैंधै तरस नैंई खाँदा हो, ता तेई हागै परमेश्वरा री झ़ुरी कैण्ढी तैरहा बणीया रौहणी।"
"1JN","3","18","ओ मेरै प्यारै शोहरूओ, आसै वचन होर जीभा सैंघै ही नैंई, पर कोम होर सच़ाई रै ज़रियै भी झ़ुरी डाहलै।"
"1JN","3","19","ज़ैबै आसै एकी दुज़ै सैंघै झ़ुरी रखा सी, ऊँई सैंघै ही आसै पछ़ियाणिया सी कि आसै सच़ाई रै सी; होर ज़ुणी गैला न आसरा मन आसाबै दोष देला, तेइरै बारै न यीशु मसीह रै सामनै आपणै-आपणै मना बै तसल्ली देई सकलै,"
"1JN","3","20","किबैकि परमेश्वर आसरै मना न बड़ा सा, होर सैभ किछ़ जाँणा सा।"
"1JN","3","21","हे मेरै प्यारै भाइयो, बैहणा, अगर आसरा मन आसाबै दोष न दै, ता आसाबै परमेश्वरा रै सामनै हौंसला होआ सा,"
"1JN","3","22","होर ज़ो किछ़ आसै मुँगा सी, सौ आसाबै तेईन मिला सा, किबैकि आसै तेइरै हुक्मा बै मना सी होर ज़ो तेइबै खुश केरा सा आसै सौऐ केरा सी।"
"1JN","3","23","परमेश्वरा रा हुक्म ऐ सा कि आसै तेई रै बेटै यीशु मसीह रै नाँह पैंधै बशाह केरलै, होर ज़ैण्ढी तेइयै आसाबै हुक्म धिना सा तेई रै मुताबक आपु न झ़ुरी डाहलै।"
"1JN","3","24","ज़ो तेइरै हुक्मा बै मना सी, ते परमेश्वरा न होर परमेश्वर तिन्हां न बणिया रौहणा होर तेथा रा, मतलब तेई पवित्र आत्मा न ज़ो तेइयै आसाबै धिनी सा, आसै जाँणा सी कि सौ आसा न सा।"
"1JN","4","1","ओ मेरै प्यारो, हर एक मांहणु बै झ़ुरी मता केरदै, बल्कि मांहणु बै परखा कि सौ परमेश्वरा री तरफा न सा कि नैंई; किबैकि बोहू झ़ूठै भविष्यवाणी केरनु आल़ै दुनिया न निकतै सी।"
"1JN","4","2","परमेश्वरै री आत्मा तुसै ऐण्ढी तैरहा पछ़ियाणी सका सी: ज़ो आत्मा ऐ मना सा कि यीशु मसीह मांहणु रा रूप लेयिआ आऊ सा सौ परमेश्वरा री तरफा न सा,"
"1JN","4","3","होर ज़ो आत्मा यीशु बै नैंई मनदी, सौ परमेश्वरा री तरफा न नैंई ऑथि; होर सौऐ ता मसीह बरोधी आत्मा सा, ज़ुणिरै बारै न तुसै पैहलै न ओरु शुणुदा सा कि सौ ऐणु आल़ा सा, होर सौ ऐबै भी दुनिया न सा।"
"1JN","4","4","ओ प्यारे शोहरूओ, तुसै परमेश्वरा रै सी, होर तुसै तिन्हां झ़ूठी भविष्यवाणी केरनु आल़ै न जीतू सा; किबैकि ज़ो पवित्र आत्मा तुसा न सा सौ तेई शैतानै री शक्ति न बड़ी सा ज़ो ऐई दुनिया न बड़ा सा।"
"1JN","4","5","तै झ़ूठी भविष्यवाणी केरनु आल़ै सी, ऐई बजहा न तैआ दुनिया री गैला केरा सी, होर दुनिया रै लोक तिन्हरी शुणा सी।"
"1JN","4","6","आसै परमेश्वरा रै सी। ज़ो परमेश्वरा बै जाँणा सा, सौ आसरी शुणा सा; होर ज़ो परमेश्वरा बै नैंई जाणदा सौ आसरी नैंई शुणदा। ऐई बजहा न आसै सच़ बोलणु आल़ा होर भरमाणै आल़ै री आत्मा बै पहचाणी सका सी।"
"1JN","4","7","हे प्यारो, आसै आपु न झ़ुरी डाहे; किबैकि झ़ुरी परमेश्वरा न सा, ज़ो कोई एकी दुज़ै सैंघै झ़ुरी डाह सा, सौ परमेश्वरा री औलाद सा होर परमेश्वरा बै जाँणा सा।"
