Book, Chapter, Verse, Text
"GAL","1","1","आऊँ पौलुस, जेड़ा नां मनुक्खें दी मर्जी कन्नें, ते नां मनुक्ख थमां, बरन यीशु मसीह ते पिता परमेसर थमां, जेस ने यीशु मसीह गी मरें दे बिचा ज़िंदा कित्ता, प्रेरित ऐं।"
"GAL","1","2","ते सारे विश्वासी पैन,प्राऐं थमां जेडे मेरे कन्नें, गलातिया लाकें दी कलीसिया दे नां;"
"GAL","1","3","ए मेरी प्रार्थना ऐ, के परमेसर पिता ते साडे प्रभु यीशु मसीह थमां तुसेंगी क्रपा ते शान्ति मिलदी रवै।"
"GAL","1","4","साडे परमेसर ते पिता दी मर्जी दे मताबक मसीह यीशु ने अपने आप गी साडे पापें दै कारन बली करी दित्ता तां जे अस अज दी दुनिया दे लोकें दे बुरे परबहा बचे रौचै।"
"GAL","1","5","मेरी ए प्रार्थना ऐ, के लोक परमेसर दी स्तुति ते बड़ाई अर एक योग च मेशा करदे रौंन। अमीन।"
"GAL","1","6","मीकी ए सुनिऐ रांनगी ओंदी ऐ, के जेस ने तुसेंगी मसीह दी क्रपा च चलने आसतै बलाया ओस कोला तोस इन्नी जल्दी फिरियै बखरी चाली दी श्खिया उपर विश्वास करन लगे।"
"GAL","1","7","एक गै सच्चा शोभ समाचार ऐ; लेकन गल्ल ए ऐ, के किन्नें लोक ऐसे न जेडे मसीह दे शोभ समाचार गी बगाडीयै तुसेंगी तोखा देना चांदे न।"
"GAL","1","8","लेकन जेकर अस, जां सोर्ग थमां कोई सोर्गदूत बी उतरीयै ओस शोभ समाचार गी छुड़ीयै जेड़ा असें तुसेंगी सनाया ऐ, कोई दुई शिखया तुसेंगी दै, तां ओ स्रापित उवै।"
"GAL","1","9","जियां अस पैलें अखी चुके दे न, उयां गै आऊँ पी आखना, के ओस शोभ समाचार गी छुड़ीयै जिसी अस्सें तुसेंगी सनाया ऐ, जेकर कोई दुई शिखया दै, ओ स्रापित उवै।"
"GAL","1","10","ऊन आऊँ के मनुक्खें गी खोश करना ऐं, जां परमेसर गी? के आऊँ मनुक्खें गी खोश करना चानां ऐं? जेकर आऊँ ऊन तकर मनुक्खें गी गै खोश करदा रौना, तां मसीह दा दास नेई ओंदा।"
"GAL","1","11","ए विश्वासी प्राओ, आऊँ तुसेंगी सनाई दीना ऐं, के जेड़ा शोभ समाचार मै सनाया ऐ, ओ मनुक्ख थमां नेई।"
"GAL","1","12","किके ओ मीकी मनुक्ख दी तरफा नेई पुजया, ते नां मीकी कुसै सखाया, लेकन यीशु मसीह थमां मेरे उपर परकट कित्ता गिया।"
"GAL","1","13","प्राओ तोस सुनी चुके दे ओ; के यहूदी मत च जेड़ा पैलें मेरा चाल चलन हा, के आऊँ परमेसर दी कलीसिया दे वश्वासियें गी मता सतांदा हा ते नाश करदा हा।"
"GAL","1","14","ते आऊँ यहूदी तर्म च अपने बेलै दे मते सारे मेरी गै उम्र दे साथी पराऐं कोला मता अगें बदा करदा हा, ते अपने बजुर्गें दे रिती रवाजें ते शिखयें आसतै मता गै जशिला हा।"
"GAL","1","15","लेकन जदुं परमेसर दी इच्छा ओई, ओस मिकी मां दे गर्भ चा गै चुनी लिया ते अपनी क्रपा कन्नें बलाई लेता,"
"GAL","1","16","के मेरे उपर अपने पुत्र गी प्रकट करै, के आऊँ दुई जातीयें च ओस दा शोभ समाचार सनां, ते एस समाचार दै बारै च मैं कुसै मनुक्खे छा सलाह नेई लेती,"
"GAL","1","17","ते नां यरूशलेम शैर गी उन्दे कोल गिया जेडे मेरे थमां पैलें प्रेरित चुने गेदे हे, लेकन फोरन अरब दे देश च सनसांन जगै गी चली गिया ते पी उत्त्थुआं दा दमिश्क शैर गी बापस आई गिया।"
"GAL","1","18","पी त्रैं सालें दे बाद आऊँ प्रेरित पतरस (कैफा) कन्नें मुलाक़ात करने आसतै यरूशलेम दे शैर गी गिया, ते ओदे कोल पंद्रां देन तकर रिया।"
"GAL","1","19","लेकन प्रभु दे प्रा याकूब गी छुड़ीयै ओर प्रेरितें बिचा कुसै कन्नें बी नेई मिलया।"
"GAL","1","20","परमेसर जानदा के जेड़ीयां गल्लां आऊँ तुसेंगी लिखना ऐ, दिखो, परमेसर गी आजर समझीयै आखना ऐं, के ओ गल्लां चुठियां नेई।"
"GAL","1","21","उनें प्रेरितें कन्नें मिलीयै ते यरूशलेम शैर गी छुड़ने दे बाद आऊँ सीरिया ते किलिकिया दे लाकें च आया।"
"GAL","1","22","लेकन यहूदिया दे लाके दे विश्वासी कलीसिया लोक जेड़े मसीह च हे, मिगी ते उनें कदें दिखे दा नेई हा;"
"GAL","1","23","लेकन ओ विश्वास बार-बार ईयै सुना करदे हे, के जेड़ा असेंगी पैलें सतांदा हा, ओ ऊन उसै विश्वास दा शोभ समाचार सुनांदा ऐ, जिसी पैलें नाश करदा हा।"
"GAL","1","24","ते मसीह विश्वास मेरे बारै च आखदे हे, के सताने आला कियां यीशु दा चेला बनया, ओ एस गल्ल उपर परमेसर दी मैमा करदे रौंदे हे।"
"GAL","2","1","4 चौदां साल दे बाद आऊँ बरनबास दै कन्नें पी यरूशलेम शैर गी गिया, ते तीतुस गी बी कन्नें लेई गिया।"
"GAL","2","2","मेरा जाना परमेसर दे परकट ओनें कन्नें ओया; ते जेड़ा शोभ समाचार आऊँ दुई जातीयें च प्रचार करना ऐ, उसी मै उनेंगी सनाई दीता, लेकन कलै च उनेंगी जेडे कलीसिया दे अगबें हे, तां जे ऐसा नेई उवै, के मेरे एस बेलै दी, जां पिछली दौड़-धोप बेकार ओई जा।"
"GAL","2","3","लेकन तीतुस बी जेड़ा मेरे कन्नें हा ते जेड़ा यूनानी ऐ, ओदा खतना कराने आसतै यरूशलेम दे शैर दी कलीसिया दे अगबें मजबूर नेई कित्ता।"
"GAL","2","4","ते ए उनें चुठे प्रां दै कारन ओया, जेडे छपीयै साडे च आई गै हे, ते ओ अजादी जेड़ी साडे उद्धारकर्ता मसीह यीशु च ऐ उसी नाश करने दी कोष्ट कित्ती तां जे ओ असेंगी परतीयै यहूदीयें दे कनून दे गलाम बनांन।"
"GAL","2","5","एक घड़ी बी उन्दे कन्नें सेंमत ओंना असें नेई मनया, एस आसतै के शोभ समाचार दी सचाई थूआड़े च बनी दी रवै।"
"GAL","2","6","उनें कलीसिया दे अगबें मेरी शिखया च कोई ओर गल्ल नेई जोड़ी,मिगी इनें अगबें थमां कोई फरक पौंदा के ए कोन न किके परमेसर शकल दिखीयै न्याय नेई करदा।"
"GAL","2","7","लेकन एस दे ओलटा जेस लै उनें अगबें ए समझया, के जियां खतना किते दे यहूदी लोकें आसतै शोभ समाचार सुनाने दा कम पतरस गी सोंपया गिया, उयां गै बिना खतने आलें दुई जातीयें गी शोभ समाचार सनानें दी जिमेंवारी मिगी सौम्पी।"
"GAL","2","8","किके जेस ने पतरस थमां यहूदीयें दें बेच प्रेरिताई दा कम तकड़ा कराया, उसै मेरे थमां बी गैर यहूदीयें च तकड़ा कम कराया"
"GAL","2","9","ते जेस लै उनें ओस क्रपा गी जेड़ी मीकी मिली ही जानी लेता, ते याकूब, ते पतरस, ते यूहन्ना ने जेडे कलीसिया दे खास अगुबे समझे जंदे हे, मेरी ते बरनबास दी सेंमती दसी, के अस गैर यहूदीयें दे कोल जाचै, ते ओ यहूदीयें दे कोल जान,"
"GAL","2","10","उनें साड़े कोला सेर्फ ए पूछ्या के, अस यरूशलेम शैर दे गरीब वश्वासियें दी मदद करचै, ते इसै कम गी करने दी आऊँ अप्पुं बी कोष्ट करा दा हा।"
"GAL","2","11","पर जेस लै पतरस अन्ताकिया शैर च आया, तां मै उसी दुए वश्वासियें दै सामने चेडकना पीया,किके ओ ठीक कम नेई करै करदा हा।"
"GAL","2","12","एस आसतै ओ पैलें दुई जातीयें दे लोकें कन्नें रुट्टी खंदे हे; लेकन याकूब दे उत्त्थुआं दा केछ लोक आए, तां खतना किते दे यहूदीयें दै डर दै मारे ओ पिच्छें अटी गिया ते पासा देंन लगया।"
"GAL","2","13","ओदे कन्नें बाकी यहूदी मसीहियें बी कपट कित्ता, इत्थें तकर के बरनबास बी उन्दे कोला डरन लगया ते दुई जातीयें कन्नें संगति करना बन्द करी दिती।"
"GAL","2","14","लेकन जेस लै मै दिखया, के ओ शोभ समाचार दी सचाई उपर सीधी चाल नेई चलदे, तां मै सारें दे सामने पतरस गी अखया, “जेस लै तू यहूदी ओइयै गैर यहूदीयें आला लेखा चलना ऐं, ते यहूदीयें आला लेखा नेई तां तू गैर यहूदीयें गी यहूदीयें आला लेखा चलने गी कि आखना ऐं?”"
"GAL","2","15","अस जेड़े जन्म थमां यहूदी न, ते दुई जाती दे पापी अखया जंदा ऐ उन्दे बिचा नेई।"
"GAL","2","16","तां बी ए समझीयै के मनुक्ख मूसा दे कनून दे कम्में कन्नें नेई, लेकन सेर्फ यीशु मसीह दे उपर विश्वास करने कन्नें तरमी बनदा ऐ, एस लेई असें अप्पुं बी मसीह यीशु उपर विश्वास कित्ता, के अस कनून दे कम्में कन्नें नेई, लेकन मसीह उपर विश्वास करने थमां तरमी बनचै; एस आसतै के एस कनून दे इनें कम्में कन्नें कोई तरमी नेई बनग।"
"GAL","2","17","अस जेडे मसीह च तरमी बननां चानयां न, जेकर अप्पुं गै पापी निकलचै, तां के एस दा मतलब मसीह पाप दा सेवक ऐ? कदें बी नेई!"
"GAL","2","18","किके जेड़ा केछ मै मकाई दीता, जेकर उसी गै पी बनानां ऐ, तां अपने आप गी पापी बनानां ऐं।"
"GAL","2","19","आऊँ ते मूसा दे कनून थमां कनून आसतै मरी गिया, के परमेसर आसतै जियां।"
"GAL","2","20","आऊँ मसीह दे कन्नें सुल्ली उपर चढ़ीयै मरी गिया ऐं, ते ऊन आऊँ ज़िंदा नेई रिया, लेकन मसीह मेरे च ज़िंदा ऐ; ते आऊँ जेंद च ऊन जेड़ा ज़िंदा ऐं ते सेर्फ ओस विश्वास कन्नें ज़िंदा ऐं जेड़ा परमेसर दे पुत्र उपर ऐ, जेस ने मेरे कन्नें प्यार कित्ता ते मेरे आसतै अपने आप गी देई दीता।"
"GAL","2","21","आऊँ परमेसर दी क्रपा गी बेकार नेई जाना दिन्दा; किके जेकर कनून थमां लोकें गी तार्मिकता मिलदी, तां मसीह गी मरने दी जरुरत नेई ओंदी।"
"GAL","3","1","ए गलातियों दे बेसमझ वश्वासियो, कोन्नें तुसेंगी अपने जाल बेच फसाई लिया, मन्नो थूआड़ीयें ते अखीं दै सामने यीशु मसीह सुल्ली उपर चाढे दा दसया गिया।"
"GAL","3","2","आऊँ थूआड़े थमां सेर्फ ए जानना चानां ऐं, के तुसें पवित्र आत्मा गी, के मूसा दे कनून दे कम्में कन्नें,जां विश्वास दे शोभ समाचार कन्नें पाया?"
"GAL","3","3","के तोस ऐसे बेबकुफ़ ओई गै, के पवित्र आत्मा दी ताकत कन्नें नमीं जींदडी शुरू करीयै ऊन जेंद दी ताकत कन्नें खत्म करना चांदे ओ?"
"GAL","3","4","के तुसें दोख बेकार गै चलया? लेकन कदें बी बेकार नेई।"
"GAL","3","5","एस लेई जेड़ा तुसेंगी पवित्र आत्मा दान करदा ते थूआड़े च चमत्कार दे कम करदा ऐ, ओ के कनून दे कम्में कन्नें जां विश्वास दे शोभ समाचार कन्नें ऐसा करदा ऐ?"
"GAL","3","6","“अब्रहाम ने ते परमेसर उपर विश्वास कित्ता ते ए ओस आसतै तार्मिकता गिनी गेई।”"
"GAL","3","7","एस आसतै ए जानी लियो, के जेडे विश्वास करने आले न, ओ सच्च गै अब्रहाम दे खांनदान दे न।"
"GAL","3","8","ते पवित्र शास्त्र च परमेसर ने पैलें थमां गै अखे दा हा, के परमेसर दुई जातीयें गी विश्वास कन्नें तरमी बनाग, पैलें थमां गै अब्रहाम गी ए शोभ समाचार सनाई दीता, के “तेरे थमां सब जातीयां आशीष पागन।”"
"GAL","3","9","तां जेडे विश्वास करने आले न, ओ विश्वास अब्रहाम दे कन्नें आशीष पांदे न।"
"GAL","3","10","एस आसतै जिन्नें लोग कनून दे कम्में उपर विश्वास करदे न, ओ सब स्राप दै थलै न, किके पवित्र शास्त्र च लिखे दा ऐ, “जेड़ा कोई मूसा दे कनून दी कताब च लिखी दियें सारियें गल्लें गी पूरा करने च टिके दा नेई रौंदा, ओ स्राप दै थलै ऐ।”"
"GAL","3","11","लेकन ए गल्ल सच्च ऐ, के कनून थमां परमेसर दे इत्थें कोई तरमी नेई बनदा, किके पवित्र शास्त्र आखदा ऐ के “तरमी जन विश्वास कन्नें ज़िंदा रौग।”"
"GAL","3","12","लेकन मूसा दे कनून दा विश्वास कन्नें कोई जोड़ नेई; लेकन पवित्र शास्त्र च लिखे दा ऐ; “जेड़ा उनें सारियें गल्लें गी मनग, ओ उन्दे कारन ज़िंदा रौग।”"
"GAL","3","13","मसीह जेड़ा साडे आसतै लानत बनया, असेंगी खरीदीयै कनून दे स्राप थमां छटकाया, किके जियां पवित्र शास्त्र च लिखे दा ऐ, “जेड़ा कोई कोठ दी बनाई दी सुल्ली उपर लड़काया जंदा ऐ ओ स्रापत ऐ।”"
"GAL","3","14","किके यीशु मसीह ने जेड़ा कम कित्ता, के अब्रहाम दी आशीष मसीह यीशु च दुई जातीयें तकर पुज्जै, ते अस विश्वास थमां ओस पवित्र आत्मा गी आसल करचै, जेस दा बायदा ओए दा ऐ।"
"GAL","3","15","ए विश्वासी प्राओ, आऊँ एक मनुक्ख आला लेखा आखना ऐं, जदुं दो मनुक्खें दा करार बी पक्का ओई जंदा ऐ, तां नां कोई उसी टालदा ऐ ते नां ओस च केछ ओर बदांदा ऐ।"
"GAL","3","16","मतलब ईयै, जे बायदा अब्रहाम गी, ते ओदे खांदान गी दिते गै, पवित्र शास्त्र ए नेई आखदा, “खांनदानें गी,” जियां मतें सारें दै बारै च पवित्र शास्त्र च अखया गिया; लेकन जियां एक दे बारै च के “तेरे खांनदान गी” ते ओ मसीह ऐ।"
"GAL","3","17","लेकन आऊँ ए आखना चानां ऐं; के जेड़ा करार परमेसर ने पैलें थमां पक्का किते दा हा, उसी मूसा दा कनून चार सौ त्रि साल दे बाद आईयै नेई टाली सकदा, के परमेसर दा बायदा बेकार ओई जा।"
"GAL","3","18","किके जेकर जायदाद कनून थमां मिली ऐ, ते पी बायदा कन्नें नेई, लेकन परमेसर ने अब्रहाम गी बायदे थमां देई दीती दी ऐ।"
"GAL","3","19","ओस बेलै पी कनून कि दिता? कनून एस आसतै दित्ता के लोकें गी पाप करने कोला रोकया जा ते ओ कनून मसीह जेड़ा अब्रहाम दी औलाद ऐ ओस दे औने तकर केमं रौग ईसै औलाद दै बारै च परमेसर ने बायदा किते दा हा। परमेसर ने कनून सोर्गदूत थमां मूसा गी दिता हा जेड़ा परमेसर ते लोकें दे च बचोले हा।"
"GAL","3","20","परमेसर ने अप्पुं अब्रहाम कन्नें बायदा कित्ता हां एस आसतै बचोले दी जरूरत नेई।"
"GAL","3","21","तां के कनून परमेसर दे बायदा दै बरोध च ऐ? कदें बी नेई! किके जेकर ऐसा कनून दिता जंदा जेडा मेशा दी जींदडी देई सकदा, तां सच्च गै तार्मिकता कनून थमां ओंदी।"
"GAL","3","22","लेकन पवित्र शास्त्र आखदा ऐ के दुनिया दे सारे मनुक्ख पाप दै बंधन च न, तां जे परमेसर ने जेड़ा देनें दा बायदा किते दा ऐ उनेंगी दियै जेड़े यीशु मसीह उपर विश्वास करदे न।"
"GAL","3","23","लेकन यीशु मसीह च विश्वास करने थमां पैलें कनून दी धीनता च अस कैद च हे, ते ओस विश्वास दे आैने तकर जेड़ा परकट ओनें आला हा, अस ओदे गै काबू च रे।"
"GAL","3","24","एस आसतै कनून मसीह तकर पुजने आसतै साडा सखाने आला ओया ऐ, के अस यीशु मसीह च विश्वास करने थमां तरमी बनचै।"
