"GAL","3","25","लेकन जेस लै यीशु मसीह च विश्वास आई चुकया, तां जे असेंगी कनून दी जरूरत नेई के ओ असेंगी चला ते साड़ी मदद करै।"
"GAL","3","26","किके तोस सारे ओस विश्वास करने थमां जेड़ा मसीह यीशु उपर ऐ, परमेसर दे बच्चे बने।"
"GAL","3","27","ते थूआडे चा जिनें बी मसीह च पवित्रशनांन लेता ऐ उनें मसीह यीशु गी लाई लेता ऐ।"
"GAL","3","28","ऊन मसीह यीशु च विश्वास करने आले च नां कोई यहूदी रिया ते नां यूनानी, नां कोई दास, नां अजाद, नां कोई नर ते नां नारी, किके तोस सारे मसीह यीशु च एक ओ।"
"GAL","3","29","ते जेकर तोस मसीह च ओ, तां तोस बायदा कन्नें अब्रहाम दे सच्चे बच्चे ओ।"
"GAL","4","1","आऊँ ए आखना ऐं, के वार्स जदुं तकर बच्चा ऐ, आलां के सारियें चीजें दा मालक ऐ, तां बी ओस च ते दास च केछ फर्क नेई।"
"GAL","4","2","लेकन पिता दे पक्के किते दे बेलै तकर रख्या करने आलें ते कर दा बंधोबस्त करने आलें दै अख्त्यार च रौंदा ऐ।"
"GAL","4","3","उयां गै अस बी, जेस लै बच्चे आला लेखा ओं, तां दुनिया दे बनाए दे रीती रबाजें दै काबू च ओईयै दास बने दे हे।"
"GAL","4","4","लेकन जेस लै परमेसर दी योजना दा बेला पूरा ओया, तां परमेसर ने अपने पुत्र गी पेजया, जेड़ा जनांनी थमां जम्या, ते मूसा दे कनून दे धीन पैदा ओया,"
"GAL","4","5","तां जे मूसा दे कनून दे धीन रौने आले गी खरीदीयै छुटकाई लै, ते असेंगी गोदीपुत्र बनने दा अख्त्यार मिलै।"
"GAL","4","6","ते तोस जेडे पुत्र ओ, एस लेई परमेसर ने अपने पुत्र दी आत्मा गी, जेड़ी साडे एर्दें च पेजी दी ऐ, “ए अब्बा, ए पिता” आखीयै बलांदा ऐ।"
"GAL","4","7","एस आसतै तू ऊन दास नेई, लेकन पुत्र ऐ; ते जेस लै पुत्र ओया, तां परमेसर थमां वारस बी ओया।"
"GAL","4","8","जदुं तोस परमेसर गी नेई जानदे हे, तां ओस वेलै उन्दे दास हे, जेडे स्वाव च परमेसर नेई,"
"GAL","4","9","लेकन ऊन जियां तुसें परमेसर गी पंछानी लेता बरन परमेसर ने तुसेंगी पंछानी लेता, तां ओ कमजोर ते नकमें दुनिया दे रीती रबाजें आले पासे गी कि फिरदे ओ, जिंदे तोस फी दास बननां चांदे ओ?"
"GAL","4","10","तोस परमेसर कोला अपनी तरफदारी चांदे ओई देन ते मिनें ते पक्के किते दे बेलै गी ते सालें गी मनदे ओ।"
"GAL","4","11","आऊँ थूआड़े बारै च चेंता करना ऐं, कुते ऐसा नेई उवै, के जेड़ी मेंनत मै थूआड़े लेई कित्ती दी ऐ ओ बेकार जा।"
"GAL","4","12","ए विश्वासी प्राओ, थूआड़े आला लेखा बननें आसतै मै यहूदीयें दे कनून गी मननां बंद करी दिते दा ऐ जेड़ा मै पैलें मनदा हा एस लेई आऊँ थूआड़े अगें अर्ज करना ऐं, तोस मेरे आला लेखा बनो ते यहूदीयें दे कनून गी नेई मनो।"
"GAL","4","13","लेकन तुसेंगी चेत्ता ओना, के पैलो-पैल मै जिंदु दी बमारी दै कारन तुसेंगी शोभ समाचार सनाया।"
"GAL","4","14","ते तुसें मेरी जिंदु दी बमारी गी जेड़ी थूआडे लेई अजमैश दा कारन ही, तोच्छ नेई समझया; नां ओस कन्नें नफरत कित्ती; ते परमेसर दे दूत बरन मसीह आला लेखा मेरी पूरी खातरदारी कित्ती।"
"GAL","4","15","ते ओ थूआड़ा नंद मनाना कुत्थें गिया? आऊँ थूआड़ा गवाह ऐं, के जेकर ओई सकदा हा, तां तोस मेरे लेई इनां बलिदान बी करने आसतै त्यार ओई जंदे के अपनीयां अखीं बी कडीयै मीकी देई दिंदे।"
"GAL","4","16","तां के थूआड़े कन्नें सच्च बोलने दै कारन आऊँ थूआड़ा बैरी बनी गेदा ऐं?"
"GAL","4","17","ओ तुसेंगी मित्र तां बनाना चांदे न, लेकन साफ़ मन कन्नें नेई। बरन तुसेंगी मेरे थमां बख करना चांदे न, के तोस उन्दे गै मित्र बनी जाओ।"
"GAL","4","18","लेकन जोश ओना अच्छी गल्ल ऐ, के पली गल्ल च अर बेलै कोष्ट कित्ती जा, नां सेर्फ ओस बेलै, के जेस लै आऊँ थूआड़े कन्नें रौना ऐ।"
"GAL","4","19","ए मेरे विश्वासी बच्चयो, जेस लै तकर थूआड़ा स्वाव मसीही आला लेखा नेई बनी जा, ओस बेलै तकर आऊँ थूआड़े लेई बच्चा जमने आली पीड़ें आला लेखा दोख बर्दाश करदा रौना ऐं।"
"GAL","4","20","इच्छ्यां ते मेरे मन च ए उया दी ऐ, के ऊन गै थूआड़े कोल आईयै प्यार कन्नें थूआड़े कन्नें गल्लां करां, किके थूआड़े बारै च मिगी चेंता ऐं।"
"GAL","4","21","तोस जेडे मूसा दे कनून दे धीन ओना चांदे ओ, मीकी सनाओ, के तोस कनून दी नेई मन्नदे?"
"GAL","4","22","ए पवित्र शास्त्र च लिखे दा ऐ, के अब्रहाम दे दो पुत्र ओए; एक हाजिरा थमां जेड़ी दासी ही, ते दुवा सारा थमां जेड़ी दासी नेई ही।"
"GAL","4","23","लेकन जेड़ा हाजिरा थमां ओया, ओ अब्रहाम दी जिंदु दी इच्छ्यां कन्नें जमया; ते जेड़ा सारा थमां जमया, ओ परमेसर दे बायदा दे मताबक जमया।"
"GAL","4","24","इनें गल्लें च ए मसाल ऐ; ए जनांनियां समझो दो करार न, एक तां सिनै पाड़ दी जेस थमां दास गै पैदा ओदे न; ते ओ हाजिरा ऐ।"
"GAL","4","25","ते हाजिरा समझो अरब देश दा सिनै पाड़ ऐ, ते अज दा यरूशलेम शैर ओदे बराबर ऐ, किके अपने बच्चें समेत गलामी च ऐ।"
"GAL","4","26","लेकन सोर्ग दा यरूशलेम सारा आला लेखा ऐ, ते ओदे बच्चे गलाम नेई ऐंन। ए यरूशलेम अस वश्वासियें लेई माता आला लेखा ऐ।"
"GAL","4","27","किके पविख्वक्ता ने लिखे दा ऐ, “ए बिना बच्चे आलीयै, तू जेडी नेई जानदी नंद मना; तू जिसी बच्चें आलियां पीड़ां नेई ओदीयां, गला खोलीयै जयजय कर; किके त्यागी ओई दे बच्चे सुआगन दे बच्चें थमां बी मते न।”"
"GAL","4","28","ए विश्वासी प्राओ, अस इसहाक आला लेखा बायदा दे बच्चे न।"
"GAL","4","29","ते जियां ओस बेलै जिंदु दी इच्छ्यां दै मताबक जमें दा पवित्र आत्मा दे मताबक जमें दे गी सतांदा हा, उयां गै ऊन बी ओंदा ऐ।"
"GAL","4","30","लेकन पवित्र शास्त्र आखदा ऐ “दासी ते ओदे पुत्र गी कड्डी दे, किके दासी दा पुत्र अजाद जनांनी दे पुत्र दै कन्नें जायदाद दा अक्दार नेई ओग।”"
"GAL","4","31","एस आसतै ए विश्वासी प्राओ, अस ओस दासी हाजिरा दे बच्चे नेई के मूसा दे कनून गी मनचै लेकन सारा जेड़ी दासी नेई ऐ ओस दे बच्चे न जेड़े विश्वास करने थमां परमेसर गी ग्रेण ओनें आले बनी जंदे न।"
"GAL","5","1","मसीह ने अजादी आसतै असेंगी मूसा दे कनून गी मनने कोला अजाद कित्ता ऐ; एस आसतै एस अजादी च टिके दे रबो, ते कोई परतियै तुसेंगी मूसा दे कनून गी मनने आसतै गलाम नेई बना।"
"GAL","5","2","त्यांन कन्नें सुनो, आऊँ पौलुस थूआड़े कन्नें आखना ऐं, के जेकर खतना करागे, तां मसीह थमां तुसेंगी केछ फायदा नेई ओग।"
"GAL","5","3","पी बी आऊँ अर एक खतना कराने आले गी चतावनी दीना ऐ, के उसी मूसा दे सारे कनून मनना पौगन।"
"GAL","5","4","तोस जेडे मूसा दे कनून कन्नें तरमी बनना चांदे ओ, मसीह थमां बख ते ओदी क्रपा थमां दूर ओई चुके दे ओ।"
"GAL","5","5","किके पवित्र आत्मा दै कारन अस विश्वास कन्नें, आस कित्ती दी तार्मिकता दा एन्तज़ार करनयां न।"
"GAL","5","6","अगर तोस मसीह यीशु दे चेलें ओ तां खतना कराना ते खतना नेई कराना केछ खास गल्ल नेई ऐ, लेकन ख़ास गल्ल ए ऐ के अस मसीह गी अपना उद्धारकर्ता ग्रेण करचै ते परमेसर ते दुए लोकें कन्नें प्रेम करचै।"
"GAL","5","7","तोस तां मसीह कन्नें जुडीयै अच्छे अगें बदा करदे हे। ऊन तुसेंगी मसीह उपर विश्वास करने लेई कोन्नें रोकया, के सच्चाई गी नेई मन्नों?"
"GAL","5","8","ए जेई सेख परमेसर थमां नेई मिली जेस ने तुसेंगी अपने बच्चे बननें लेई बलाया।"
"GAL","5","9","ए चुठी शिखया थूडे जिये खमीर आला लेखा ऐ जेड़ा पुरे आटे गी खमीर करी दिंदा ऐ।"
"GAL","5","10","आऊँ प्रभु उपर थूआड़े बारै च परोसा करना ऐं, के थूआड़ा कोई दुआ बचार नेई ओग; लेकन जेड़ा तुसेंगी गुमराह करी दिंदा ऐ, ओ कोई कि नेई ओग परमेसर कोला सज़ा पाग।"
"GAL","5","11","ए विश्वासी प्राओ, आऊँ ए प्रचार करै करना के खतना जरूरी नेई ऐ, तां अयां बी यहूदी लोक मिकी सता करदे न अगर आऊँ मसीह दी सुल्ली थमां उद्धार दा प्रचार नेई करदा तां लोकें गी बुरा नेई लगग।"
"GAL","5","12","पला ओंदा, के जेडे तुसेंगी गुमराह करदे न, ओ लोक अपने आप गी खुसरा बनाई लेंन।"
"GAL","5","13","ए विश्वासी प्राओ, तोस मूसा दा कनून नेई मनने आसतै परमेसर ने बलादे ओ; लेकन ऐसा नेई उवै, के ए अजादी जिंदु दी बुरियां खुआशां गी पूरी करने दा मौका बनी जा, बरना प्यार कन्नें एक दुए दी सेवा करने आले बनो।"
"GAL","5","14","किके सारा कनून एस एक गै गल्ल च पूरा ओई जन्दा ऐ, “तू अपने गुआंडी कन्नें अपने जियां प्यार कर।”"
"GAL","5","15","लेकन जेकर तोस लगातार लड़ाई ते एक दुजे कन्नें जलन करदे ओ, तां चकने रबो, के एक दुए दा सत्यानाश नेई करी ओड़ो।"
"GAL","5","16","लेकन आऊँ आखना ऐं,के पवित्र आत्मा दे अखने उपर चलो, तां तोस जिंदु दे बुरे कम दी ख्वैशें गी कुसे बी रिती कन्नें पूरा नेई करगे।"
"GAL","5","17","किके जिंदु दियां बुरियां इच्छ्यां पवित्र आत्मा दे बरोध च ते पवित्र आत्मा जिंदु दियां बुरियां इच्छ्यां दे बरोध च कम करदा ऐ, ते ए एक दुए दे बरोधी न, एस आसतै के जे केछ तोस करना चांदे ओ, ओ नेई करी सकदे।"
"GAL","5","18","ते जेकर तोस पवित्र आत्मा दे चलाए चलदे ओ, तां मूसा दे कनून दे धीन नेई रे।"
"GAL","5","19","जिंदु दियां बुरियां इच्छ्यां ते साफ लबदियां न, मतलब ब्यभिचार, गंदे कम, लुच्चा पन,"
"GAL","5","20","ओ मूरत दी पुजा, टूना, बैर, लड़ाई, एर्षा, गुस्सा, बरोध, फ़ोट, फेरका बाजी,"
"GAL","5","21","अड़ना, मतवालापन,जिंदु दा पोघ-पलास, ते इंदे जे ओर-ओर कम न, इंदे बारै च आऊँ तुसेंगी पैलें गै खबरदार करी दीना ऐं जियां पैलें अखी बी चुके दा ऐं, के ए जिए कम करने आले परमेसर दे राज दे वार्स नेई ओगन।"
"GAL","5","22","लेकन पवित्र आत्मा दा फल प्यार, नंद, शान्ति, स्बर, तरस, पलाई, विश्वास,"
"GAL","5","23","धीनगी, ते अपने आप गी काबू करना ऐ; ए जिए कम्में दै बरोध च कोई कनून नेई।"
"GAL","5","24","ते जेडे मसीह यीशु दे न, उनें जिंदु दी बुरी इच्छ्यें ते खुआशें समेत सुल्ली उपर चड़ाई दीता ऐ।"
"GAL","5","25","जेकर अस पवित्र आत्मा दे मताबक जिनयां न, तां पवित्र आत्मा दे मताबक चलचे बी।"
"GAL","5","26","अस कमणडी ओइयै एक दुए गी नेई छेड़चै, ते नां एक दुए कन्नें एर्षा करचै।"
"GAL","6","1","ए विश्वासी प्राओ, जेकर ए पता चलै के कुसै मनुक्खे पाप कित्ता ऐ, तां तोस जेडे आत्मिक ओ, धीनगी कन्नें उसी सेई रस्ते उपर लेई आओ, ते अप्पुं बी चकने रबो के तोस बी उसै अजमैश बेच नेई पवो।"
"GAL","6","2","तोस परेशानी बेच एक दुए दी मदद करो, ते एस चाली मसीह दे कनून गी पूरा करो।"
"GAL","6","3","किके जेकर कोई केछ नेई ओनें उपर बी अपने आप गी बड्डा समझदा ऐ, तां ओ अपने आप गी तोखा दिन्दा ऐ।"
"GAL","6","4","लेकन अर एक अपने गै कम गी जांची लै,के ओदा कम सेई ऐ, ते दुए दै बारै च नेई लेकन अपने कम दै बारै च उसी कमण्ड करने दा बेला थोग।"
"GAL","6","5","किके अर एक मनुक्ख अपने गै कम दा जिमेंबार ओग।"
"GAL","6","6","जेड़ा बचन दी शिखया लिया दा ऐ, ओ सारियें छैल चीजें च सखाने आले गी जियां पैसे रुट्टी थमां दी मदद करै।"
"GAL","6","7","अपने आप गी तोखा नेई दियो; परमेसर गी कोई कदें मुर्ख नेई बनाई सकदा, किके मनुक्ख जे केछ रांदा ऐ उवै कटग।"
"GAL","6","8","किके जेड़ा अपनी जिंदु दी बुरी इच्छ्यां पूरी करने आसतै कम करदा ऐ, ओ जेंद थमां नाश ओनें दी फसल कटग; ते जेड़ा पवित्र आत्मा दी इच्छ्यां आसतै कम करदा ऐ, ओ पवित्र आत्मा थमां मेशा दी जींदडी दी फसल कटग।"
"GAL","6","9","अस पले कम करने आसतै इम्त नेई छुड़चै, किके जेकर अस आंरचै नेई, तां परमेसर दे अपने बेलै च नांम पागे।"
"GAL","6","10","एस आसतै जिथें तकर मौका मिलै अस सारें कन्नें पलाई करचै, ख़ास करियै विश्वासी प्रांऐं दै कन्नें।"
"GAL","6","11","दिखो, मै कियां बड्डे-बड्डे अखरें च अपने अथ्थें कन्नें लिखे दा ऐ।"
"GAL","6","12","जेडे लोग यहूदीयें गी खोश करना चांदे न, ओ खतना करांदे न तां जे यहूदी उनेंगी ग्रेण करन,ते उनेंगी नेई सतांन एस गल्ल दा प्रचार करने दै कारन के परमेसर उनेंगी गै बचाग जेड़े ए विश्वास करदे न के यीशु मसीह उन्दे वासतै सूली उपर मरया"
"GAL","6","13","किके खतना करने आले यहूदी अप्पुं ते कनून उपर नेई चलदे, लेकन थूआड़ा खतना इसै आसतै करना चांदे न के थूआड़ी जिंदु दी आलत उपर घमणड करन।"
"GAL","6","14","लेकन ऐसा नेई उवै के आऊँ बखरी कुसे गल्लें उपर घमणड करां, सेर्फ साडे प्रभु यीशु मसीह दी सुल्ली दा, जेस थमां दुनिया मेरी नजर च ते आऊँ दुनिया दी नजर च सुल्ली उपर चढ़ाया गेदा ऐं।"
"GAL","6","15","किके नां खतना ते नां बिना खतना केछ खास गल्ल ऐ, लेकन पवित्र आत्मा थमां नमीं जींदडी।"
"GAL","6","16","जिन्नें एस उक्म उपर चलगन उन्दे उपर ते, परमेसर दे चुनें दे लोकें उपर शान्ति ते दया ओंदी रवै।"
"GAL","6","17","अगें गी कोई मीकी दोख नेई दीयै, किके आऊँ यीशु दे दागें गी अपनी जिंदु च ओदे दास आला लेखा फिरना ऐं।"
"GAL","6","18","ए विश्वासी प्राओ, साड़ी ए प्रार्थना ऐ, के साडे प्रभु यीशु मसीह दी क्रपा थूआड़ी आत्मा दै कन्नें रवै। अमीन।"
