Book,Chapter,Verse,Text
LUK,17,33,जिस कुसकी ने अपणी जान बचाणे रोई कोशीश करणी तिसने तिसजो गवाई दैणा ते जिस ने तिसजो दाव पर लाणा तिसने अपनी जान बचाई लैणी। 
LUK,17,34,"मै तुसी जो बोल्दा, कि तधाड़ी राती दो मणु इक्क मन्जे पर सुत्ते रे होणे अते इक्क अपणे कने लेई जाणा अते दुज्जा छड्डी दित्ता जाणा "
LUK,17,35,तधाड़ी दो जनानियाँ आट्टा पिह्न्दी होणी अते इक्क अपणे कन्ने लेई जाणी अते दुई छड्डी दित्ती जाणी 
LUK,17,36,"तधाड़ी दो जणे खेत्रा बिच हुन्गे, इक्क लेई लिता जाणा ते दुजा तित्ते ही रेई जाणा "
LUK,17,37,"ए सुणी करी चेल्‍लेयां ने पुछेया कि, हे प्रभु ऐसा कुस जगह हुणा? यीशु ने तिन्हा जो जवाब दित्तेया, सारे लोक्कां जो ए इय्यां पता लगी जाणा कि ए कुते होणा जिय्यां कि इल्लणां रे कठीणे पर लाश रा पता चलदा। "
LUK,18,1,फिरी यीशु ने अपणे चेल्‍लेयां जो ए बताणे तांइ कि से हर बेल्ले प्रार्थना करदे रैन अते दुख्खी ना होण तिधेरे तांइ इक्क उदारण दित्ता 
LUK,18,2,"तिन्हा ने बोल्लेया, कुसकी शहरा बिच इक्क हाकिम थिया से ना तां परमेश्‍वर जो मन्दा थिया ना ही मणुआं री परुवाह् करदा थिया "
LUK,18,3,"तिस्सी शहर बिच इक्क बिधवा जनानी रैंन्दी थी से तिसका घड़ी-घड़ी आन्दी थी अते बोल्दी थी, मेरे दुस्मण ने मेरे कने बे-न्याई करी के मेरा नुकसान कित्ता, अवे मेरे जो तिस मणु का फैसला मिलणा ही चाएदा। "
LUK,18,4,"तिस हाकिम ने मते रोजाँ तांइ तिस बिधवा री गल्लां री कोई परवाह ही नी कित्ती, पर बाद बिच तिन्ने अपणे मनां अन्दर सोचेया, कि मै ना तां परमेश्‍वर का डरदा ना ही मणुआं री परवाह करदा, "
LUK,18,5,"पर तां भी से जनानी घड़ी-घड़ी मेरे का आई करी मेरे जो तंग करदी रैंन्दी इधेरे तांइ मै इय्यां करदा कि तिसेरा फैसला करी ही दिन्दा, नी तां तिन्ने मेरे नक्का धूँ देई रखणा, "
LUK,18,6,"फिरी प्रभु यीशु ने बोल्लेया, सुणो, तिस अधर्मी हाकिम ने क्‍या बोल्लेया था? "
LUK,18,7,"तां क्‍या परमेश्‍वर अपणे चुणे दे मणुआं पर ध्यान नी दिह्गां, जे तिन्हा जो रात-ध्याड़ी चेता करदे अते मन्गदे कि असां जो फैसला कर? क्‍या परमेश्‍वर ने तिन्हेरी सुनणे तांइ बड़ी हाण लगागाँ? "
LUK,18,8,"मै तुसी जो बोल्दा, कि परमेश्‍वर ने तिसी ही बेल्ले तिन्हेरा फैसला करणा पर जां मणु रा पुत्तर जे मै ही है, इस दुनिया बिच आणा, तां इदेय किन्ने हुन्गे जे ईदेया विश्वास करणे वाले हुन्गे? "
LUK,18,9,"ते यीशु ने इक्क उदारण तिन्हा लोक्कां जो सुणाया जे अप्पु जो बड़ा पवित्तर मनदे थिये ते दुए लोक्कां जो अप्पु सामणे किच्‍छ नी समझदे थिये, "
LUK,18,10,"इक्क बारी दौ मणु मन्दिर बीच प्रार्थना करने तांइ गे! इक्क फरीसी थिया, दूज्जा चुंगी लैणे वाला थिया! "
LUK,18,11,"से फरीसी कल्ला खड़ी करी प्रार्थना करणे लगया, हे परमेश्‍वर, मै तेरा शुकर करदा, कि मै दूज्याँ साँई ना ही मणुआं जो ठगदा, ना ही मै गलत करदा, अते ना ही व्यभिचारी है, अते ना चुंगी लैणे वाले साँई है "
LUK,18,12,"मै हफ्तै बीच दौ वारी ब्रत्त रखदा, हाँ, अते मिन्जो मिलणे वाली हर इक्क चीज रा दसमाँ हिस्सा तिजो दिन्दा! "
LUK,18,13,"पर से चुंगी लैणे वाला मणु दूर खड़ी करी प्रार्थना करणे लगेया! पर प्रार्थना करदे बेल्ले स्वर्ग रे पासे अपणी अख्खाँ चुकणे री हिम्मत नी करी सकया! बजाए इसेरे, से अपणे हिक्का जो पीटी-पीटी करी बड़े दुख्खी मन कने बोलणे लगया, हे परमेश्‍वर, मेरे पर दया करो, किजोकी मै बड़ा पाप्पी मणु है! "
LUK,18,14,"यीशु ने फिरी बोल्लेया, मै तुसी जो बोलदा हाँ कि ए चुंगी लैणे वाला मणु परमेश्‍वर रे अग्गे धार्मिक मन्नेया गेया, अते अपणे घरे वापिस हटी गेया, ना कि दुज्जा! पर फरीसी कने इदेया नी होया, किजोकी जे कोई भी अपणे आप जो बड्डा समझगा, से छोटा कित्ता जाँणा, पर जे कोई अपने आप जो छोटा समझगा, तिसजो बड्डा कित्तेया जाँणा। "
LUK,18,15,"इक्क रोज किच्‍छ माँ प्यो अपणे निक-निकेयाँ जो यीशु का लेई आए कि से तिन्हा पर हथ रखण! पर, यीशु रे चेल्‍लेयां ने तिन्हा जो बोल्लेया, कि यीशु जो तंग मत करो "
LUK,18,16,"पर यीशु ने चेल्‍लेयां जो बोल्लेया, निक्याँ जो मेरे का आणा देयो, अते इन्हा जो मेरे का आणे तांइ ठाक्को मत! किजोकी परमेश्‍वर रा राज बिच इदेय ही मणु होणे "
LUK,18,17,"मै तुसी जो सच बोल्दा, कि ईदेया कोई भी जे परमेश्‍वर रे राज जो निक्के-निक्के सांइ नी मन्गा, स्वर्ग बिच से नी जाई सकदा। "
LUK,18,18,"इक्क बारी कुसकी यहुदी सरदार ने यीशु का सवाल पूच्छया, हे उत्तम गुरु, हमेशा री जिन्दगी पाणे तांइ मै क्‍या कराँ? "
LUK,18,19,"यीशु ने बोल्लेया, तू मेरे जो उत्तम किजो है बोल्दा? सिर्फ परमेश्‍वर ही उत्तम है! "
LUK,18,20,"तिज्जो परमेश्‍वर रे नियमाँ रे हुकमा रा पता ही है कि परमेश्‍वर रे क्‍या हुकम हिन: व्याभिचार नी करणा, जान नी लैणी, कने चोरी नी करनी, झूठी गवाई नी दैणी, अते अपणे माँ प्यो री इजज्त करणी! "
LUK,18,21,"तिस मणु ने बोल्लेया, जां मै हल्का थिया, तां दा मै ए सारे हुकमा जो मन्या करदा आया है! "
LUK,18,22,"यीशु ने ए सारी गल्लां जो सुनी करी तिसजो बोल्लेया, तेरे बिच अवे भी इक्क गल्ल री कमी है, से ए कि अपणा सब किच्‍छ बेची करी गरीबा बिच बन्डी दे फिरी तिज्जो स्वर्ग रा धन्न मिलणा! फिरी आ अते मेरे पिच्छे चली पे! "
LUK,18,23,पर जिस बेल्ले तिस मणु ने ए गल्लां सुणी तिसेरा मूँ हल्का होई गेया किजोकी से बडा अमीर थिया! 
LUK,18,24,"जां यीशु ने तिसजो बड़ा दुख्खी हुन्दे दिख्खया, तां से अपणे चेल्‍लेयां जो बोलणे लगे, अमीर मणु रा परमेश्‍वर रे राज बीच आणा बड़ा मुस्कल है! "
LUK,18,25,"इक्क से ही रे नाके बीच का ऊँट आसानी कने निकली सकदा पर, इक्क अमीर मणु सवर्ग रे राज अन्दर चली जाए ए नी होई सकदा! "
LUK,18,26,"इस पर सुनणे वालेयां ने पुच्छेया, तां फिरी कुसेरा छुटकारा होई सकदा? "
LUK,18,27,"तां यीशु ने जवाब दित्या, जे मणु का नी होई सकदा, से परमेश्‍वर का होई सकदा! "
LUK,18,28,"पतरस ने बोल्लेया, असां ने तां तुसी रे पिछे चलणे तांइ अपणा घर-बार बेची दित्या "
LUK,18,29,"यीशु ने तिन्हा जो बोल्लेया, मै तुसी जो सच बोल्दा, जिस कुसकी ने भी परमेश्‍वर रे राज तांइ, घर-बार, लाडी, भ्याल, माँ प्यो, या बाल बच्चे छडी दिता हो "
LUK,18,30,तिसजो इस जुग बिच तां कई गुणा जादा मिलणा ही पर आणे वाले जुग बिच हमेशा री जिन्दगी भी मिलणी। 
LUK,18,31,"फिरी तिन्हा ने अपणे कने बारा चेल्‍लेयां जो लित्या, अते तिन्हा जो बोल्लेया, असी यरूशलेम शहर जो जाए करदे हिन अते जिस बेल्ले असी तित्ते पूज्जणा, तां मणु रे पुत्तर, जे मै ही है रे बारे बिच, भविष्यद्वक्ता री लिखी रियां से सारी गल्लां पूरी होणी "
LUK,18,32,कि से पापियाँ रे हात्था पकड़ाया जाणा तिन्हा ने तिसेरा मजाक उडाणा अते तिसजो कोस्या जाणा अते तिस पर थूकणा! 
LUK,18,33,तिन्हा तिसजो कुटणा अते तिसजो मारी दैणा! पर तिन्नी तिज्जे रोज्जे फिरी जिन्दा होई जाणा 
LUK,18,34,"पर, यीशु जे किच्‍छ बोल्लेया करदे थिये, से गल्लां चेल्‍लेयां रे पल्ले नी थी पेया करदी अते से गल्लां तिन्हा का छीपी रेई, अते से जाणी नी पाए कि से कुधेरे बारे बोल्लेया करदे हिन। "
LUK,18,35,जां से यरीहो रे नेड़े जाई पुज्जे तां इक्क अन्ना भिखारी सड़क रे कनारे बैठ्ठे दा थिया 
LUK,18,36,"फिरी जां मणु तिसेरे मुहाग्गर पुज्जे तां तिन्हेरी अवाज सुणी करी से कुसकी का पुछणा लगेया, ए क्‍या होया करदा है? "
LUK,18,37,"तिन्हा ने तिसजो बोल्लेया कि, नासरत कस्बे रे यीशु, जी जाया करदे हिन "
LUK,18,38,"अते तां तिन्ने हक्क लाई करी बोल्लेया, हे दाऊद रे पुत्तर, यीशु! मेरे पर दया करो! "
LUK,18,39,"जे मणु यीशु रे अग्गे आग्गे चलदे थिये से तिसजो बक्णा लगे, पर से होर भी जादा जोरे हक्कां लाणे लग्गेया, हे दाऊद रे पुत्तर! मेरे पर दया कर! "
LUK,18,40,"तां यीशु ने तिसेरी अवाज सुणी, अते अपणे चेल्‍लेयां जो बोल्लेया, इसजो मेरे का लेई आओ जां तिसजो लेई आए, तां यीशु ने पुच्छेया, "
LUK,18,41,"तू क्‍या चाह्‍ंदा कि मै तेरे तांइ करां? तिन्ने बोल्लेया, हे प्रभु जी, मै ए चाह्‍ंदा कि मै अपणी हाख्खियाँ कने दिख्खी सकां "
LUK,18,42,"यीशु ने तिसजो बोल्लेया, तां ठीक है, तू अवे दिख्खी सकदा अते तेरे विश्वास ने तिज्जो खरा कित्ता "
LUK,18,43,तां से तिस्सी बेल्ले दिख्णा लगी पेया अते परमेश्‍वर री बडाई करणा लग्गेया अते यीशु रे पिच्छे चली पेया अते ए सब किच्‍छ दिख्खी करी मणु परमेश्‍वर री बड़ाई करणा लगे। 
LUK,19,1,यीशु यरीहो नाँ रे शहर का जाया करदे थिये। 
LUK,19,2,"तित्ते जक्कई नाँ रा मणु चुंगी वसूलणे वालेयां रा प्रधान, अते से बड़े पैसे वाला थिया "
LUK,19,3,"से यीशु जो दिख्णा चाह्‍ंदा थिया पर, बड़े सारे मणुआं री वजह कने से दिख्खी नी थिया पाया करदा, किजोकी से बोणा थिया। "
LUK,19,4,"इधेरे तांइ से दौड़ी करी त्रिम्बल रे बूट्टे पर चढ़ी गेया, जे कि तिसी रस्ते पर लगे दा थिया, अते जित्ते का यीशु ने जाणा थिया। "
LUK,19,5,"जां यीशु तिस्स तिस रस्ते का होई करी जाणा लग्गे जित्ते से बुट्टा थिया तां तिन्हा ने बूट्टे पर जक्कई जो दिख्खेया, अते तिसजो बोल्लेया, हे जक्कई, झट्ट थल्ले उतर किजोकी अज्ज तेरा घरे रैणा जरूरी है "
LUK,19,6,जक्कई झट्ट तिस बुट्टे का थल्ले उतरेया अते बड़ी खुशी कने यीशु कने मिलेया अते तिन्हा जो अपणे घरे लेई गेया। 
LUK,19,7,"पर मणुआं जो ए गल्ल ठीक नी लग्गी, अते बुड़बुड़आणा लगी पेय अते बोलणा लग्गे से तां पाप्पी मणु रे उत्ते प्रोणा बणी करी तिसेरे घरे जो गेया "
LUK,19,8,"जां यीशु ते तिन्हेरे चेल्‍ले तिसेरे घरे रोट्टी खाया करदे थिये तां जक्कई खड़े होई गेया अते यीशु जो बोलणा लग्गेया, हे प्रभु जी, मै अपणी धन-दौलत रा अद्धा हिस्सा गरीबां बिच्च बन्डी दैणी अते प्रभु जी मै जिन्हा मणुआं जो ठग्गी करी तिन्हा का जरुरत का जादा लित्ते दा है तिन्हा जो मै चार गुणा मोड़ी दिह्गां। "
LUK,19,9,"यीशु ने तिसजो बोल्लेया, अज्ज तेरा अते तेरे घरे वालेयां रा छुटकारा होया है किजोकी अज्ज तु अब्राहम ओलाद बणेया। "
LUK,19,10,"किजोकी मणु रा पुत्तर, जे मै ही है तेरे जदेय होर भी मणुआं जो हमेशा री सजा का बचाणे तांइ आए रा है। "
LUK,19,11,"जां से गल्लां सुणेया करदे थिये, तां तिन्हा ने इक्क उदहरण बोल्लेया, इधेरे तांइ किजोकी से यरूशलेम शहर रे नेड़े थिये ते से सोचदे थिये कि परमेश्‍वर रा राज आणे वाला है, "
LUK,19,12,इक्क ठीक पैसे वाला मणु अपणे देश रा राज्जा बनणे दी इजाज़त लैणे तांइ इक्क देश जो गेया 
LUK,19,13,"जाणे का पैल्ले तिन्ने अपणे नौक्करां जो सद्देया अते बोल्लेया, कि मै जां तांइ हटि नि आन्दा तां तांइ मै तुसी जो दस सोन्ने रे सिक्के देई जान्दा, अते तिन्हा कने किच्‍छ कमाई करे, "
LUK,19,14,"पर तिसेरे शहर रे मणु तिसजो सुखान्दे नी थिये, इधेरे तांइ तिन्हा ने किच्‍छ मणु तिसेरे पिच्छे ए बोल्ली करी उस देश जो भेज्जी दित्ते, कि असी नि चाह्‍ंदे कि ए असां रे पर राज करण "
LUK,19,15,"जां से राज्जा अपणे राज्जा बनणे री मंजूरी लेई करी आई गेया, तां तिन्ने जे सोन्ने रे सिक्के नौक्करां जो दित्ते रे थिये, तिन्हेरा साह्ब-किताब लैणे तांइ तिन्हा जो सद्देया कि तिन्हा लेन देन बिच् क्‍या कमाये रा है "
LUK,19,16,"तां पैल्ले नौक्कर ने आई करी बोल्लेया, हे मालक, तुसी जे सिक्के मेरे जो दित्ते थिये, तिन्हा सिक्के कन्ने मे दस गुणा होर सिक्के कमाई ले "
LUK,19,17,"मालक, ने तिसजो बोल्लेया, शाबास, तू तां बड़ा खरा कन्ने भरोसे रे लायक नौक्कर है, इधेरे तांइ मै तिज्जो दस राज रा अधिकारी बणाई दिन्दा "
LUK,19,18,"दुज्जे ने आई करी बोल्लेया, हे मालक, तुसी ने जे सिक्के दित्ते थिये तिन्हा कन्ने मै पान्ज गुणा होर सोन्ने रे सिक्के कमाए हिन "
LUK,19,19,"तिन्ने तिसजो बोल्लेया, तिज्जो भी पान्ज राज रा अधिकारी बणाई दिन्दा "
LUK,19,20,"तिज्जे ने आई करी बोल्लेया, हे मालक, मै तुसी रे दित्ते रे सिक्केयाँ जो कपड़े बिच बन्नी करी संभाली रख्खे दा थिया "
LUK,19,21,"किजोकी मेरे जो तुसी का डर लगदा किजोकी तुसी इक्क सख्त मणु हिन, इधेरे तांइ कि तुसी जेह्ड़ा, तुसी रा नी है तिसजो भी लेई लिन्दे अते जे तुसी बाया भी नी तिसजो भी कट्टी लिन्दे "
LUK,19,22,"से राज्जा तिस पर टुटी पेया, अते बोलणे लगेया, हे नलायक नौक्करां मै तेरी ही गल्लां का तिज्जो दोषी बणादा! जे तू मेरे बारे अन्दर इन्ना किच्‍छ जाणदा थिया कि मै बुरा मणु है जे कि बांदा भी नी अते तिसजो कट्टी भी लिन्दा "
LUK,19,23,तां तू मेरे सोन्ने रे सिक्केयाँ जो ब्याज पर उधार किजो नी देई दित्ता ताकी मै जां वापस हटी करी तां मेरे जो किच्‍छ ब्याज तां मिली जान्दा? 
LUK,19,24,"जे नौक्कर नेड़े खड़ितेरे थिये तिन्हा जो राज्जे ने बोल्लेया, इस नौक्करां का से सोन्ने रे सिक्के लेई लो अते जिनिये सबका जादा सिक्के कमाए तिसजो देई दो "
