Book,Chapter,Verse,Text
LUK,11,17,"पर यीशु तिन्हेरे मन री गल्ल जो समझी गे ते तिन्हा ने जवाब दित्तेया, जिस देश अन्दर फूट पेई गे री हो, से उजड़ी जान्दा: ते जिस घर अन्दर कहला हो पेई गे री से कदी भी बसी नी सकदा "
LUK,11,18,"ते अगर शैतान अप्पु जो नुकसान पूजाणा सुरु करी देयो, तां शैतान रे राज रा सत्यानास होई जाणा तुसी जे मेरे पर इल्जाम लांदे कि मै दुष्टात्मां रे सरदार री मदद कने दुष्टात्मा जो कडदा, "
LUK,11,19,जे अगर मै दुष्टात्मां रे सरदार री मदद कने दुष्टात्मा जो कडदा तां तुसी री औलादां कुसेरी मदद कने कडदी? इधेरे तांइ तिन्हा ने ही तुसी रा फैसला करणे वाला। 
LUK,11,20,"पर जे मै परमेश्‍वर रा नां लेई करी दुष्टात्मा जो कडदा, तां तुसी ए समझी लेयो कि परमेश्‍वर तुसी रे बिच राज करणे तांइ आई गे रे हिन। "
LUK,11,21,जां कोई ताकतवर मणु पूरी तयारी कने अपणे घर री पैहरेदारी करदा तां तिसेरा घर-बार बची रैहन्दा। 
LUK,11,22,"पर जिस बेल्ले कोई तिसका भी जादा ताकतवर मणु आई करी तिस पर हमला करी के तिसजो हराई देयो तां तिसेरे हथियारां जो जिन्हा पर तिसजो विश्वास थिया, खुस्सि करी तिसेरा घर-बार लुट्टि करी से सब किच्‍छ अप्पु-मिते बंड़ी लिन्दे। "
LUK,11,23,"जे मेरे पास्से नी है से मेरे खिलाफ है, ते जे मेरे कन्ने नी बटोलदा, से बखेरी रखदा। "
LUK,11,24,"जां कोई दुष्टात्मा कुसकी मणु बिच का निकली जान्दी तां से अराम करणे तांइ सुक्की जगह् का होई करी जान्दी, ते जिस बेल्ले तिसजो अराम नी मिलदा तां से बोल्दी, मै अपणे पुराणे घरे जो दुबारा हटी जान्दी जित्ते का मै आए री है। "
LUK,11,25,ते हटी करी तिसजो से साफ-सुथरा ते सजा सजाया मिलदा। 
LUK,11,26,"होर तां होर, इस बेरी से अप्पु कन्ने सत्त होर दुष्टात्मा जो भी कन्ने लेई आँदी, अते तिस बिच वास करणा लगी पैन्दी ते तिसेरी हालत पैल्ले का भी जादा बुरी होई जान्दी। "
LUK,11,27,"जिस बेल्ले यीशु हल्ले ए सब गल्लां बोल्लेया ही करदे थिये, कि मणुआं री भीड़ बिच का इक्क जनानी ने जोरे सणे बोल्लेया, कि धन्न है से जनानी जिसा तुसी जो जम्मेया, ते धन्न है से जनानी जिसा तुसी जो अपणा दुध पियाया। "
LUK,11,28,"इस गल्ल पर यीशु ने बोल्लेया, हां, पर जादा धन्न से हिन जे जे परमेश्‍वर रे वचनां जो ध्यान कने सुणदे ते तिन्हा पर मनदे भी। "
LUK,11,29,"जिय्यां जिय्यां मणुआं री भीड़ बधणा लगी, तां यीशु तिन्हा जो बोलणा लगे कि इस जुग रे मणु बड़े भरी बुरे हिन, से निशानी तोपदे रैह्‍न्दे पर इन्हा जो योना रे अलावा होर कोई भी निशानी नी दित्ती जाणी। "
LUK,11,30,"जिय्यां योना नीनवे रे मणुआं तांइ इक्क निशानी बणेया थिया, तिय्यां ही मणु रे पुत्तर, जे मै ही है ने इस जमाने रे मणुआं तांइ निशानी बनणा "
LUK,11,31,"दक्षिण री राणी ने इस जमाने रे मणुआं पर इल्जाम लगाणे ते तिन्हा जो गुनेह्गार साबित करणा, किजोकी से राजा सुलैमान री समजदारी वाली गल्लां सुनणे तांइ दुनिया रे इक्क कुणे का आए थी, ते इत्ते तां कोई राजा सुलैमान का भी बड्डा है। "
LUK,11,32,"नीनवे रे मणुआं ने भी परमेश्‍वर रे हिसाब लैणे वाले रोजे अज्ज रे जुग रे मणुआं पर इल्जाम लाणे, किजोकी उन्हा ने योना री गल्लां सुणी करी अपणे पाप का तौबा कित्ती थी, ते अवे तां योना का भी खास कोई इत्ते है "
LUK,11,33,"कोई भी मणु दीय्या बाली करी तिसजो लुह्काई करी या भान्डे अन्दर पाई करी नी रखदा, पर उच्ची बखारी पर रखदा ताकी ईणे-जाणे वाले जो लौ मिल्दी रेयो। "
LUK,11,34,"अख्खां मणु रे शरीर रे दिये सांइ हुंदी, इधेरे तांइ जे अगर तेरी हाख्खी साफ है तां तेरा पूरा शरीर भी लौ कने चमकदा होणा पर जे अगर से बुरी हिन तां तेरा पूरा शरीर न्याहरा है। "
LUK,11,35,"इधेरे तांइ ध्यान रेयो, कि तुसी रे अन्दर री लौ नह्यारा नी बणी जाओ "
LUK,11,36,"पर जे तुसी रा पूरा शरीर लौ कने चमकदा है, ते शरीर रा कोई भी हिस्सा न्याहरे बिच नी है तां से पूरी तरह् कने इय्यां लस्कणा मन्नो कोई दीया तुसी पर अपणी किरणां चमकाया करदा है। "
LUK,11,37,"जां यीशु ए गल्लां बोल्ली बैठ्ठे तां कुसकी फरीसी मणु ने तिन्हेरे छंदे कित्ते, कि तुसी मेरे घरे रोट्टी खाओ, ते से अन्दर जाई करी रोट्टी खाणा बेई गे। "
LUK,11,38,जिस बेल्ले तिस फरीसी ने दिख्खेया कि यीशु ने रोट्टी खाणे का पैल्ले अपणे हत्थ नी धोये तां तिसजो बड़ी हैरानी होई 
LUK,11,39,"ते इस गल्ल पर प्रभु जी ने तिसजो जवाब दित्तेया, हे फरीसियों, तुसी थाली ते कटोरी जो तां उपरा-उपरा का माँजदे, पर तुसी ही अन्दर का लालच अते बुराई कन्ने भरितेरी हिन "
LUK,11,40,"हे बेअक्कलो, जिनिए बाहरले हिस्से जो बणाया, क्‍या से अन्दरले हिस्से जो नी बणाए रा है? "
LUK,11,41,पर जे तुसी अन्दरे री चिज्जां जो दान करी दिंगे तां तुसी रा सब किच्‍छ सुच्चा होई जाणा 
LUK,11,42,"पर, हे फरीसियों, तुसी पर लाणत है! किजोकी तुसी अपणे पुदीने ते सुदाब बूटियाँ रा दसमाँ हिस्सा तां चढ़ान्दे पर, परमेश्‍वर रे प्यार ते तिन्हेरे फैसले जो नकारी दिन्दे दसमाँ हिस्सा तां दैणा चाहिदा, पर परमेश्‍वर रे प्यार अते तिन्हेरे फैसले जो नकारे रे बगैर "
LUK,11,43,हे फरीसी मणूओं तुसी पर लाणत है! तुसी सभास्थल बिच छैल जगह् बैणा चाह्‍ंदे ते जां बजार जान्दे तां सबनी मणुआं का अप्पु जो प्रणाम कराणा चाह्‍ंदे 
LUK,11,44,तुसी पर लाणत है! किजोकी तुसी तिन्हा लुके री कबरां सांइ हिन जिन्हा पर लोक चलदे पर जाणदे नी। 
LUK,11,45,"तां कुसकी शास्त्रि लोक्कां ने तिन्हा जो जवाब दित्तेया, कि हे गुरु जी, इदेय गल्लां बोल्ली करी तुसी असां री भी बेजती करेया करदे हिन "
LUK,11,46,"यीशु ने तिस्जो बोल्लेया, कि हे शास्त्रियों, तुसी पर भी लाणत है! तुसी लोक्कां तांइ नियमां रा इदेया बोझ बणाई दिदें जिस जो चुकणा भी मुश्किल है ते अप्पु तिसजो अपणी उंग्गल कने भी छूणा नी चाह्‍ंदे "
LUK,11,47,"तुसी पर लाणत है! किजोकी तुसी तिन्हा भविष्यद्वक्ता तांइ कबराँ बणान्दे, जिन्हा जो तुसी रे बाब्ब-दाद्देयाँ ने ही मारेया थिया "
LUK,11,48,"इन्हा सबनी गल्लां कने तुसी ए साबित करदे कि तुसी रे पुरखां ने जे भविष्यद्वक्तां जो मारे तिस बिच तुसी राजी हुंदे, किजोकी तिन्हा ने मारेया थिया ते तुसी ने तिन्हेरी कबरां बणाई दित्ती। "
LUK,11,49,"इधेरे तांइ परमेश्‍वर रे वचन अन्दर भी बोल्ले रा है, कि मै तिन्हा का भविष्यद्वक्ता जो ते प्रेरिता जो भेजणा ते तिन्हा ने उन्हा मणुआं बिच का किच्‍छ जो मारी दैणा ते किच्‍छ मणुआं तांइ मुसीबत खड़ी करी दैणी "
LUK,11,50,"इधेरे तांइ दुनिया री शुरुआत का जितणे भी भविष्यद्वक्ता रा खून रूलया, तिसेरा हिसाब इस पीढ़ी रे मणुआं का लित्तेया जाणा "
LUK,11,51,"मतलब ए है कि हाबिल रे खून होणे का लेई करी जकरयाह रे मरणे तीकर, जे कि परमेश्‍वर रे मन्दिर ते बेदी रे बिच मरे थिये तिन्हेरे मरणे रा हिसाब, इस पीढ़ी रे मणुआं का लित्तेया जाणा "
LUK,11,52,"तुसी शास्त्रियों पर लाणत है! किजोकी तुसी ने समजदारी री मती सारी गल्लां सिख्खी तां लेईयाँ, पर अप्पू तिन्हा गल्लां पर नी चले ते जे चलणे री कोशीश करदे थिये तिन्हेरे भी रस्ते पर तुसी रूकावट बणे "
LUK,11,53,ते फिरी जां यीशु तित्ते का चली गे तां फरीसी ते शास्त्रि तिन्हेरे खिलाफ होई करी बुरे हाल्ले पिच्छे पेई गे कि से होर भी गल्लां पर यीशु कने सवाल-जवाब करण 
LUK,11,54,किजोकी से तिन्हेरी ही बोल्लेरियाँ गल्लां पर तिन्हा जो फँसाणे री भाल अन्दर थिये। 
LUK,12,1,"जां हजाराँ रे साह्बे मणु किठ्ठि गे ते सब इक्क दूज्जे पराल्ले चढ़या करदे थिये, तां यीशु ने पैल्ले अपणे चेल्‍लेयां जो बोल्लेया, कि फरीसी मणुआं रे खमीर का जे कि इन्हेरा कपट है, बची करी रेयो "
LUK,12,2,"किजोकी इदेया किच्‍छ भी छुपे रा नी है जे कि सामणे नी आणा, ते ईदेया किच्‍छ भी ढकित्तेरा नी है, जे खोलेया नी जाणा "
LUK,12,3,"इधेरे तांइ तुसी ने जे किच्‍छ भी न्याहरा अन्दर बोल्ले रा है, से लौ अन्दर सुणाया जाणा: अते जे किच्‍छ भी तुसी ने बन्द कमरेयाँ बिच इक्क-दुज्जे रे कन्ना अन्दर बोल्ले रा है, से गल्लां घरे री छत्ती पर जाई करी जोरे जोरे दस्सी जाणियां। "
LUK,12,4,"पर मेरे मित्रो, मै तुसी जो बोलदा तिन्हा का मत डरो जे सिर्फ तुसी रे शरीर जो घात करी सकदे ते तिसेरे बाद इदेया किच्‍छ भी नी है जे तिन्हेरे बस अन्दर होणा। "
LUK,12,5,"मै तुसी जो पक्की गल्ल दसी दिन्दा कि कुसका डरणा चाएदा? परमेश्‍वर का डरो जे तुसी जो मारणे रे बाद नरक बिच पाणे रा हक्क रखदा हाँ, मै बोलदा, बस परमेश्‍वर का ही डरो "
LUK,12,6,क्‍या दो पैसे री पंज चिड़ियाँ नी बिकदी? फिरी भी परमेश्‍वर तिन्हा बिच का इक्क जो भी नी भूलदा। 
LUK,12,7,"दिख्खो, तुसी रे सरे रा इक्क-इक्क बाल भी परमेश्‍वर ने गिणि रख्खे रा है इधेरे तांइ डरो मत, किजोकी तुसी तां बड़ी सारी चिड़ियाँ का भी जादा किमती हिन। "
LUK,12,8,"फिरी यीशु ने बोल्लेया, मै तुसी जो बोलदा, कि जे कोई मेरे जो मणुआं रे सामणे मन्नी लिन्गा, तिसजो मणु रे पुत्तर, जे मै ही है ने भी परमेश्‍वर रे स्वर्गदूतां सामणे मन्नी लैणा। "
LUK,12,9,"पर, जे मणुआं रे सामणे मेरे का मुक्करगा, तिसेरा परमेश्‍वर रे स्वर्गदूतां सामणे इन्कार कित्तेया जाणा "
LUK,12,10,"ते हर तिस मणु जो माफ कित्तेया जाणा, जे मणु रे पुत्तर, जे मै ही है रे खलाफ़ किच्‍छ गलत बोल्गा, पर जे कोई पवित्रात्मा री बेजती करगा, तिसजो माफ नी कित्तेया जाणा "
LUK,12,11,"जां से तुसी जो सभास्थल, राज्जेयाँ अते बड्डे प्रधाना रे मुहाग्गर लेई जाह्न्गे तां फिकर मत करदे कि तुसी अप्पु जो किय्यां बचांगे या असां जो क्‍या बोलणा चाईन्दा "
LUK,12,12,किजोकी पवित्रात्मा ने तुसी जो सखाई दैणा कि तिस बेल्ले तुसी जो क्‍या बोलणा चाएदा। 
LUK,12,13,"फिरी तिन्हा मणुआं री भीड़ बिच का कुसकी ने यीशु जो बोल्लेया, हे गूरु जी, मेरे भ्याल जो बोल्लो कि से असां रे प्यो री जायदात का मेरे हिस्से री जायदात जो मेरे जो देई देयो। "
LUK,12,14,"यीशु ने जवाब दित्तेया, कि हे मणू, तुसां री इन्हा गल्लां रा फैसला करणे वाला या बटवारा करणे वाला मेरे जो कुनिए बणाया? "
LUK,12,15,"फिरी यीशु ने बोल्लेया, ध्यान रख्खो, कि तुसी कुसकी भी चीज रा लालच मत करदे, किजोकी कुसकी रे जिन्दगी री बराबरी तिसेरी जमीन-जायेदात रे बाध्धे होणे कने नी कित्ती जान्दी "
LUK,12,16,यीशु ने ए उदारण भी दित्तेया कि इक्क अमीर मणु री जमीन अन्दर बड़ी छैल फसल लगी 
LUK,12,17,"ते से अपणे मनां अन्दर सोचणा लगेया, कि अवे मै क्‍या कराँ? इतणा सारा अनाज कुते रखगा, मेरे का तां रख्खणे तांइ जगह् भी नी है? "
LUK,12,18,"फिरी तिनिए बोल्लेया, अच्छा, मै इय्यां करदा कि अनाज रखणे वाले ढन्ड़ू जो तोड़ी करी इक्क बड्डा कमरा बणादा, ताकी मेरा सारा अनाज तिस बिच आई जाओ। "
LUK,12,19,"ते फिरी मै अपणे आप जो बोलणा, कि तेरे का तां बड़ा भरी अनाज है जे केई सालाँ तांइ तेरे का बची रैह्णा अते अवे चैन कने खा-पी ते मजे कने जी। "
LUK,12,20,"पर परमेश्‍वर ने तिसजो बोल्लेया, हे नासमझ, तैं अज्ज राती ही मरी जाणा ते तैं जे इतणा सारा अनाज कठेरी रख्खे रा है, से सब कुस जो मिलणा? "
LUK,12,21,"दिख्खो, इदेया ही से मणु भी हुन्दा जे अप्पु तांइ धन्न कठेरदा, पर परमेश्‍वर री नजराँ बिच से अमीर नी है। "
LUK,12,22,"फिरी यीशु ने अपणे चेल्‍लेयां जो बोल्लेया, इधेरे तांइ मै तुसी जो बोलदा कि अपणे जीणे री फिकर मत करेया करो कि असी हर रोज रोट्टी ते कपड़े कुदका खान्गे अते लान्गे। "
LUK,12,23,"किजोकी जीणा, रोट्टी का ते जिस्म, कपड़ेयाँ का जादा बद्धी करी है "
LUK,12,24,"जरा पछीं पास्से तां दिख्खो से ना तां भी बांदे, ना फसल कटदे ना तां तिन्हा का अनाज कने भरे रे बड्डे-बड्डे कमरे हुन्दे तां भी परमेश्‍वर तिन्हा जो खाणे जो दिन्दा तुसी तां चिडू-पखेरुआँ का भी जादा कीमती हिन "
LUK,12,25,"तुसी बिच का इदेया कुण है, जे फिकर करी के अपणी उमर जो इक्क घड़ी तांइ भी अग्गे बदाई सकदा हो? "
LUK,12,26,जे फिकर करी के तुसी इस छोटी जह्णी गल्ल जो नी करी सकदे तां बड्डी गल्लां री फिकर करी के क्‍या फायदा? 
LUK,12,27,"सोसनों रे फूलां पास्से दिख्खी करी जरा सोच्चो, कि से किय्यां उगदे से ना तां मैह्नत करदे, ना ही खेत्तर बांदे, फिरी भी मै तुसी जो बोलदा कि राजा सुलैमान रे महिमा होणे पर भी तिसेरे कपड़े इन्हा फूल्लाँ बिच का कुसकी इक्क का भी जादा छैल नी थिये। "
LUK,12,28,"इधेरे तांइ अगर परमेश्‍वर द्रब्बड री घा जो, जे कि अज्ज ईत्ते है, ते कल से अग्ग बिच फूक्की दित्ती जाणी, इतणा छैल सजाई सकदा, तां क्‍या से तुसी जो नी पुआई सकदा तुसी मणुआं अन्दर विश्वास री कमी है "
LUK,12,29,पर तुसी इन्हा गल्लां री फिकर मत करो कि असी क्‍या खांगे ते क्‍या पींगे इधेरे तांइ तुसी मत सोच्चो 
