Book,Chapter,Verse,Text
LUK,6,24,"पर लाणत है तिन्हा मणुआं पर, जे अज्ज बड़े अमीर हिन, किजोकी तिन्हा ने अपणा सुख-चैन भोग्गि लेया। "
LUK,6,25,"लाणत है तिन्हा मणुआं पर जे अब्बे रज्जे रे हिन, किजोकी तिन्हेरा भूख्खे रैह्णे रा बेल्ला भी आणा। लाणत है तिन्हा मणुआं पर जे अज्ज हसदे हिन, किजोकी इदेया बेल्ला भी आणा जां तिन्हा ने रोणा अते दुखी होणा। "
LUK,6,26,"लाणत है तुसी पर जां सब मणु तुसां री बड़ी तरीफां करण, किजोकी तिन्हेरे बब्ब-दाद्दे भी झूठे-भविष्यद्वक्ता री इय्यां ही बड़ाई करदे थिये। "
LUK,6,27,"पर मै तुसी सबनी सुनणे वालेयां जो बोलदा, कि तुसी अपणे दुस्मणां कने भी प्यार कने रेया करो जे तुसी कने नफरत करदे, तिन्हेरा भला करो। "
LUK,6,28,"जे मणु तुसी जो धिक्कार देंन, तिन्हा जो तुसी आशीष देया करो, जे तुसी री बुराई करदे, तिन्हेरे तांइ प्रार्थना करेया करो "
LUK,6,29,"जे तुसी री खाड्डी रे इक्क पास्से चन्ड्ड मारो, तां तिसेरे अग्गे दूजी खाड्डी भी करी देयो ते जे कोई तुसी का तुसी रा सोल खुस्सि लेयो, तिसजो अपणी कमीज भी लैणा देयो "
LUK,6,30,"जे कोई तुसी का किच्‍छ भी मन्गे तिसजो देयो, अते जिनिए तुसां री कोई चीज लित्ते री ए तां उस का मंगो मत "
LUK,6,31,"जिय्यां तुसी चाह्‍ंदे कि मणु तुसी रे कने करो, तिय्यां ही तुसी भी तिन्हा कने करो "
LUK,6,32,जे तुसी अपणे प्यार करणे वालेयां कन्ने ही प्यार कने रैह्न्गे तां इस अन्दर कुण देह्ई बड्डी गल्ल ए? किजोकी पापी मणु भी तां इय्यां ही करदे 
LUK,6,33,"जे तुसी अपणे भला करणे वालेयां कन्ने ही भलाई करगे, तां इस अन्दर कुण देह्ई बड्डी गल्ल है? किजोकी पापी मणु भी तां इय्यां ही करदे "
LUK,6,34,"तुसी कुसकी जो उधार देई करी तिसका लैणे री आस रखदे तां इस बिच तुसां री क्‍या बड़याई? किजोकी पापी मणु भी तां इय्यां ही चाएदे कि जितणा दित्तेया, तितणा ही वापस हटी आओ। "
LUK,6,35,"पर तुसी अपणे दुस्मणां कने भी प्यार करो, अते भलाई करो, ते जे कुसकी जो उधार दित्ते रा हो, तां फिरी दुबारा वापस लैणे री भाल मत करो, इय्यां करगे तां परमेश्‍वर रे पास्से का तुसी जो स्वर्ग बिच इक्क बड्डा ईनाम मिलणा, ते तुसी परमप्रधान परमेश्‍वर री सन्तान होई जाणा, किजोकी परमेश्‍वर तां इतणे दयालू हिन कि से तिन्हा मणुआं पर भी अपणी कृपा दृष्टि बणाई रखदे जे परमेश्‍वर रा शुकर नी करदे अते बुरे हिन। "
LUK,6,36,"जिय्यां तुसी रा स्वर्ग अन्दर वाला पिता परमेश्‍वर रहमदिल है, तिय्यां ही तुसी भी रहमदिल बणो। "
LUK,6,37,"कुसकी पर इल्जाम मत लाओ, ताकी हिसाब-किताब रे बेल्ले तुसी पर भी इल्जाम नी लगाये जाये दुज्जेयाँ जो कसुरवार मत समझो, ताकी तुसी भी कसुरवार नी समझे जाओ पर, दुज्जेयाँ जो माफ करी देया करो, तां तुसी जो भी माफ कित्ता जाणा। "
LUK,6,38,"दुज्जेयाँ जो देया करो, तां तुसी जो भी दित्तेया जाणा, मणुआं ने पूरा नापी करी अते जिक्की-जिक्की करी ते हिलाई-हिलाई करी अते उछलदा-उछलदा तुसी री खोख्खा बिच पाणां, किजोकी जिस नाप कने तुसी नापदे, तिस्सी नाप कने तुसी तांइ भी नाप्पेया जाणा "
LUK,6,39,"फिरी यीशु ने तिन्हा जो इक्क उदारण दित्तेया, क्‍या इक्क अन्ना दुजे अन्ने जो रस्ता दस्सी सकदा? जे दस्गा तां क्‍या तिन्हा दोना ने गत्ता बिच नी पैणा? "
LUK,6,40,"चेल्ला अपणे गुरु का बड्ड़ा नी होई सकदा पर हाँ, जे सब किच्‍छ सीख्खी लिन्दा, सेह्ई अपणे गुरु सांइ होई सकदा "
LUK,6,41,"“तुसी किजो अपणे भाई री छोटी जदेई गलती जो दिख्खेया करदे हिन, जां तुसी री अपणी जिन्दगी बिच बड्डी गलतियां हिन।” "
LUK,6,42,"जां तेरी अपणी जिन्दगी बिच बड्डी गलतियां हिन, तां तुसी किय्यां अपणे भाई जो बोल्ली सकदे कि अपणी गलतियां जो सुधार? हे ढोंगी, पैल्ले तू अपणी बड्डी गलतियां जो सुधार, फिरी तू ठीक तरिक्के कने अपणे भाई री गलतियां जो सुधारी सकणा। "
LUK,6,43,"किजोकी कोई भी खरा बूट्टा नी जिस बिच बुरे फल लगदे हो, अते ना कोई बुरा बूट्टा ए जिस बिच खरा फल लगदा हो। "
LUK,6,44,हर इक्क बुट्टा अपणे फलां रे जरिए ही पछियाणेया जान्दा किजोकी मणु कन्डे वाली झिल्लाँ का अंजीर अते ना ही ते झड़बेरी का अंगूर खून्डदे 
LUK,6,45,"खरा मणु अपणे ठीक मन का ठीक गल्लां ही कडदा, ते बुरा मणु अपणे बुरे मन का बुरी गल्लां ही कडदा किजोकी जिन्हा गल्लां कने तिसेरा मन भरितेरा हून्दा, तिन्हा ही गल्लां जो मुँह पर लियान्दा "
LUK,6,46,"फिरी यीशु ने बोल्लेया, तुसी मेरे जो हे प्रभु जी, हे प्रभु जी, किजो बोलदे रैह्‍न्दे, जदकि तुसी मेरी गल्लां जो मनणे तांइ तयार नी हिन? "
LUK,6,47,"हर इक्क जे मेरे का आई करी मेरी गल्लां जो सुणी करी तिन्हा पर चलदा, मै तुसी जो दसदा कि से मणु कुसेरे सांइ ए "
LUK,6,48,"से तिस मणु सांइ ए, जिनिए अपणा घर डुग्गी नीय्याँ खणी करी पक्के पथ्थरां पर पाया अते जां हड़ आया ते तिसेरा पाणी तिस घरां कने बज्या, तां से घर जो हिलाई भी नी सकेया किजोकी से बड़ा पक्का बणे रा थिया "
LUK,6,49,"पर जे मणु मेरी गल्लां जो सुणी करी तिन्हा पर नी चलदा, से तिस मणु सांइ ए, जिनिए घर री नीं बणाये बगैर ही जमीन पर घर पाया अते जां हड़ आया अते तिसेरा पाणी घर कने टकराये, अते से ढेई पेया ते पूरी तरह कने बर्बाद होई गेया। "
LUK,7,1,"जां यीशु ए सारी गल्लां करी बैठ्ठे, तां से कफरनहूम कस्बे जो वापस हटि गे। "
LUK,7,2,"तित्ते इक्क सुब्बेदार थिया, अते तिसेरा इक्क नौक्कर थिया, जे की तिसजो बड़ा प्यारा थिया से बिमारी री वजह कने मरणे जो होई गे रा थिया। "
LUK,7,3,"तिस्स हाकिम ने यीशु रे बारे अन्दर बड़ी गल्लां सुणे री थिया, इधेरे तांइ तिन्ने किच्‍छ यहुदी लोक्कां रे बुजुर्गां जो यीशु का ए बिनती करणे तांइ भेज्जेया कि से आई करी तिसेरे नौक्कर जो ठीक करी देन। "
LUK,7,4,"तां से यीशु का जाई करी तिन्हेरे छंदे करी के बोलणा लग्गे, कि तुसी असां रे कन्ने हाकिम रे नौक्कर जो ठीक करणा चलो "
LUK,7,5,"किजोकी से हाकिम, असां यहूदीयाँ कने बडा़ प्यार रखदा, अते तिन्ने ही असां तांइ सभास्थल जो बणवाए दा है "
LUK,7,6,"यीशु तिन्हा कन्ने चली पे, ते जां से सुबेदार रे घर रे नेड़े पुज्जे तां सुबेदार ने अपणे मित्तरां का ए गलाई भेजया, कि हे प्रभु जी, तुसी मेरे घरे आणे री तकलीफ मत करो, किजोकी मै इस जोग्गा नी है, कि तुसी मेरे घरे आण। "
LUK,7,7,"अते इस ही वजह कने मै अप्पु जो इस जोग्गा नी समझेया, कि तुसी रे नेड़े भी आई सकां इधेरे तांइ तुसी जित्ते हिन, तित्ते का ही अपणे मुँह् का बोल्ली देयो कि मेरा नौक्कर ठीक होई जाओ, तां तिन्ने ठीक होई जाणा "
LUK,7,8,"किजोकी, मै भी कुसकी रे हेठ कम्म करणे वाला मणु है, अते किच्‍छ सपाई मेरे भी हेठ कम्म करदे अगर तिन्हा जो मै कुदखी जाणे तांइ बोल्दा, तां से जान्दे आणे तांइ बोल्दा, तां से आन्दे अते अगर मै अपणे नौक्कर जो बोल्दा, कि ए कम्म कर, “या से कम्म कर” तां से तिय्यां ही करदे "
LUK,7,9,"ए सुणी करी यीशु हैरान होई गे, अते तिन्हा ने अपणे पिछ्छे आणे वाले मणुआं जो बोल्लेया कि, इस गैर-यहूदी मणु साँई विश्वास तां मै कदी इस्राएल रे मणुआं अन्दर भी नी दिख्खेया। "
LUK,7,10,"फिरी जे मणु तिस सुब्बेदार ने भेज्जे रे थिये, से घरे जो हटी आए अते तिन्हा दिख्खेया कि से बुमार नौक्कर, जे मरणे जो होई गे रा थिया, से बिल्कुल ठीक होई गे रा थिया। "
LUK,7,11,"थोड़े रोज्जां बाद, यीशु नाईन नां रे ग्राँ जो जाया करदे थिये, अते तिन्हेरे कन्ने मते सारे मणु अते तिन्हेरे चेल्‍ले भी थिये। "
LUK,7,12,"जां से तिस ग्राँ रे दुआर का पुज्जे, तां इक्क बड्डी भीड़ मणु इक्क मुर्दे जो दबणे तांइ तिस ग्राँ का बाहर लेई चले रे थिये। मरणे वाला जे थिया, से अपणी माँ रा इकलौता मुन्डा थिया, अते तिसेरी माँ बिधवा थी। "
LUK,7,13,"ए दिख्खी करी, यीशु रा मन रहम कने भरी गेया, अते तिन्हा ने तिस्स बिधवा जो बोल्लेया, मत रोआँ! "
LUK,7,14,"अते से तिस अर्थी का गे अते जाई करी तिस अर्थी जो छुतेया जिन्हा ने अर्थी चुक्केरी थी, से रुकी गे तां यीशु ने बोल्लेया, हे जुआन, मै तिज्जो बोलदा कि उठी जा! "
LUK,7,15,"तां तिस मुर्दे बिच प्राण आई गे, अते से उठ्ठी करी बेई गेया ते बोलणा लगी पेया! यीशु ने तिसजो तिसेरी माँ का देई दित्ता "
LUK,7,16,"ए दिख्खी करी मणु डरी गे, अते परमेश्‍वर री बड़ाई करी के बोल्णा लगे कि, इक्क बड्डा भविष्यद्वक्ता असां का आए रा है, परमेश्‍वर ने अपणे लोक्कां पर बड़ी दया कित्ती है। "
LUK,7,17,"तिस रोज जे होया थिया, तिसेरी खाप्प यहुदियां प्रदेश अते अरे-परे रे सबनी देसाँ बिच फैल्ली गई। "
LUK,7,18,"ए जे किच्‍छ भी होया थिया, इन्हा सबनी गल्लां रे बारे अन्दर युहन्ना जो तिसेरे चेल्‍लेयां ने खबर देई दित्ती। "
LUK,7,19,"तां युहन्ना ने अपणे दो चेल्‍लेयां जो यीशु का ए पूछणे तांइ भेज्जेया, कि जिस मसीह यीशु जो असी भालदे हिन, से तुसी ही हिन, कि से कोई होर है? "
LUK,7,20,"तां से चेल्‍ले यीशु का गे अते तिन्हा जो बोल्णा लगे कि, असां जो युहन्ना बपतिस्मा दैणे वाले ने ए पूछणे तांइ भेज्जेया, कि जिस मसीह यीशु जो असी भालदे हिन, से तुसी ही हिन कि कोई होर हिन? "
LUK,7,21,"तां यीशु ने तिन्हेरे ही सामणे मते जणेयाँ जो बुमारियाँ का अते तकलीफाँ, अते दुष्टात्मा का छुड़ाया, अते मते जणे अन्ने मणुआं जो लौ दित्ती "
LUK,7,22,"फिरी यीशु ने युहन्ना रे चेल्‍लेयां जो बोल्लेया, तुसी ने अब्बे जे किच्‍छ भी दिख्खेया-सुणेया, ए जाई करी युहन्ना जो दस्सी देयो, कि अन्ने दिखदे हिन, लट्टे मणु हन्ड़दे-फिरदे हिन, कोढ़ी मणु सुच्चे होया करदे हिन, जे मणु टौणे थिये से सुणेया करदे हिन, मुरदे जिन्दे होया करदे हिन, अते गरीबां जो परमेश्‍वर रा शुभ संदेश सुणाया जाया करदा है "
LUK,7,23,धन्न हिन से जे मेरे बारे बिच धोखा ना खाए 
LUK,7,24,"जां युहन्ना रे चेल्‍ले चली गे, तां यीशु मणुआं जो पुछणा लगे, ए युहन्ना है कुण, जिस जो दिखणा तुसी बणा अन्दर गे थिये? क्‍या से हवा कने हिलि जाणे वाले नलू सांइ इक्क कमजोर मणु है? "
LUK,7,25,"कि तुसी ए सोची करी गे थिये कि, तित्ते कोई मैह्न्गे अते छैल कपड़े पाणे वाला मणु होणा? तां क्‍या तुसी ए नी जाणदे कि जे मैह्न्गे अते छैल कपड़े पान्दे, से मज्जे कने अपणी कोठ्ठियाँ बिच रैह्‍न्दे, बणा बिच नी "
LUK,7,26,"तां फिरी तुसी क्‍या दिखणा गे थिये? कुसकी भविष्यद्वक्ता जो? हां, मै तुसी जो बोल्दा, कि से तां भविष्यद्वक्ता का भी बड्ड़ा है "
LUK,7,27,"युहन्ना से ही है, जिसेरे बारे अन्दर पवित्रशास्त्र बिच लिख्खे गे रा है, “दिख्ख, मै अपणे दूत जो तेरे अग्गे-अग्गे भेजदा, जिनिये तेरे का पैल्ले जाई करी तेरे मणुआं जो तेरे तांइ तयार करणा।” "
LUK,7,28,"फिरी यीशु ने बोल्लेया, मै तुसी जो बोल्दा, कि हल्ले तांइ ईदेया कोई मणु नी जम्मेया, जे युहन्ना का बधि करी हो पर, परमेश्‍वर रे राज बिच जे सबका छोटा है, से युहन्ना का भी बधि करी है "
LUK,7,29,"जा तिन्हा लोक्कां ने ए सुणेया, तां सारे लोक्कां ने ते इत्ते तिकर कि चुंगी लैणे वालेयां ने भी मन्नी लेया कि परमेश्‍वर री गल्लां जो मनणा सही है किजोकी तिन्हा ने युहन्ना का बपतिस्मा लेई लित्तेया थिया। "
LUK,7,30,पर फरीसियाँ अते शास्त्रि लोक्कां ने परमेश्‍वर री मर्जी जो सच नी मन्नी करी युहन्ना का बपतिस्मा लैणे का मना करी दित्ता थिया। 
LUK,7,31,"यीशु ने मणुआं जो फिरी पुच्छेया कि, मै अज्ज रे जुग रे मणुआं री बराबरी कुस्स कने कराँ? कि ए हिन कुस्स साँई? "
LUK,7,32,"किजोकी ए मणु तां तिन्हा बच्चेयाँ साँई हिन, जे कि खेल-खेल बिच इक्क-दुज्जे री सिकाइता लान्दे, कि असां ने तुसी तांइ पीपणी बजाई पर तुसी नच्चे नी, असां ने तुसी तांइ रोणे वाले गाणे गाए, पर, तुसी रोए नी "
LUK,7,33,किजोकी युहन्ना बपतिस्मा दैणे वाला ना रोट्टी खान्दा अते ना ही अंगूर रा रस पिन्दा थिया पर तुसी बोल्दे हिन कि तिस्स बिच दुष्टात्मा है 
LUK,7,34,"अते मै, मणु रा पुत्तर, जे मै ही है रोट्टी खान्दा अते अंगूर रास भी पीन्दा, तां तुसी मेरे बारे अन्दर बोल्दे, कि ए तां भुखांग ते पियक्कड़ है अते चुंगी लैणे वाले अते पाप्पी मणुआं कन्ने रैहन्दा "
LUK,7,35,पर समझ अपणे मनणे वालेयां री वजह कने सही साबित हुंदी 
LUK,7,36,"इक्क फरीसी मणु ने यीशु रे छंदे कित्ते कि, मेरे घरे रोट्टी खाणे तांइ चलो अते तिस फरीसी री गल्ल मन्नी करी यीशु तिसेरे घरे आए अते रोट्टी खाणा बेई गे। "
LUK,7,37,"जां तिस ग्राँ री इक्क पापण जनानी जो पता लग्गेया, कि यीशु फरीसी रे घरे रोट्टी खाणे तांइ आए दे हिन, तां से इक्क संगमरमर रे भाडें अन्दर खुश्बू वाला इक्क बड़ा मैहन्गा तेल लेई आई। "
LUK,7,38,अते अपणे गोडे रे भारे बेई करी रोणा लगी अते हाख्खी का फुए यीशु रे पैरां पर पैणा लगे अते से यीशु रे पैरां जो अपणे बालां कने पुंजणा लगी अते तिन्हा जो घड़ी-घड़ी चुम्मी करी तिस पर इत्र मली करी तिन्हेरा अभिषेक कित्तेया। 
